id,title,url,points,created_at
44421849,Critical number of spacecraft in low Earth orbit [pdf],https://conference.sdo.esoc.esa.int/proceedings/sdc9/paper/305/SDC9-paper305.pdf,10,2025-06-30 11:15:21+00:00
44421848,The Liberal Misinformation Bubble About Youth Gender Medicine,https://www.theatlantic.com/ideas/archive/2025/06/transgender-youth-skrmetti/683350/,8,2025-06-30 11:15:10+00:00
44421844,HighCharts (JS Charting Library) User Guide,https://embeddable.com/blog/how-to-build-dashboards-with-highcharts,1,2025-06-30 11:14:34+00:00
44421836,How Do You Teach Computer Science in the A.I. Era?,https://www.nytimes.com/2025/06/30/business/computer-science-education-ai.html,1,2025-06-30 11:12:42+00:00
44421804,What Happens After A.I. Destroys College Writing?,https://www.newyorker.com/magazine/2025/07/07/the-end-of-the-english-paper,49,2025-06-30 11:07:57+00:00
44421803,Gartner Predicts over 40% of Agentic AI Projects Will Be Canceled by End of 2027,https://www.gartner.com/en/newsroom/press-releases/2025-06-25-gartner-predicts-over-40-percent-of-agentic-ai-projects-will-be-canceled-by-end-of-2027,30,2025-06-30 11:07:56+00:00
44421788,Serenading Cells with Audible Sound Alters Gene Activity,https://www.scientificamerican.com/article/cells-can-hear-sounds-and-respond-genetically/,27,2025-06-30 11:04:53+00:00
44421786,Would you trust an AI agent to auto-approve low-value insurance claims?,,1,2025-06-30 11:04:39+00:00
44421784,"A rare asteroid flyby will happen soon, but NASA may be left on the sidelines",https://arstechnica.com/features/2025/06/trump-budget-kills-nasas-golden-opportunity-to-see-a-killer-asteroid-up-close/,34,2025-06-30 11:03:39+00:00
44421778,"Huawei Patents 3,000km Solid-State Battery with 5-Minute Charge",https://carnewschina.com/2025/06/18/huaweis-3000km-solid-state-battery-patent-with-5-minute-charge-ignites-industry-race/,25,2025-06-30 11:02:56+00:00
44421776,Show HN: New Ensō – first public beta,https://untested.sonnet.io/notes/new-enso-first-public-beta/,251,2025-06-30 11:02:55+00:00
44421769,"After nine years, Ninja has merged support for the GNU Make jobserver",https://thebrokenrail.com/2025/06/30/ninja-jobserver.html,2,2025-06-30 11:02:36+00:00
44421750,High Precision Folder Matching (HPFM) for faster open source scanning,,1,2025-06-30 10:59:30+00:00
44421749,GOP Bill Adds Surprise Tax That Could Cripple Wind and Solar Power,https://www.nytimes.com/2025/06/29/climate/gop-bill-adds-surprise-tax-that-could-cripple-wind-and-solar-power.html,36,2025-06-30 10:59:25+00:00
44421742,Microsoft releases foundation model of quantum wavefunctions,https://arxiv.org/abs/2506.19960,3,2025-06-30 10:58:18+00:00
44421738,Build Your Own Car,https://caterhamcars.com/en/models/assembly,1,2025-06-30 10:57:58+00:00
44421694,OpenTyrian2000 – multi platform SDL3 version of Tyrian 2000 released,https://github.com/andyvand/opentyrian2000/releases/tag/3.0.0-SDL3,13,2025-06-30 10:52:31+00:00
44421677,Previously Unknown Structure Hiding Inside Human Cells,https://gizmodo.com/biologists-uncover-previously-unknown-structure-hiding-inside-human-cells-2000621339,13,2025-06-30 10:49:52+00:00
44421674,"Show HN: InvoiceFast – Generate clean, compliant invoices in seconds",,1,2025-06-30 10:49:32+00:00
44421667,DOJ clears HPE to buy Juniper if it sells Instant On WiFi and licenses some code,https://www.theregister.com/2025/06/30/doj_approves_hpe_juniper_merger/,2,2025-06-30 10:49:03+00:00
44421663,On-Demand GPU Clusters – Spin up TCP clusters across cloud providers easily,https://gpus.exla.ai/,1,2025-06-30 10:48:38+00:00
44421649,I Am Claude Code: An AIs Journey to Self-Awareness,https://termbin.com/jbzb,7,2025-06-30 10:46:22+00:00
44421646,Researchers take first steps to creating synthetic human genomes,https://wellcome.org/news/researchers-take-first-steps-creating-synthetic-human-genomes,1,2025-06-30 10:45:38+00:00
44421641,Show HN: AI image alt text generation tool – Turn images into text with AI,https://imagerr.ai/,8,2025-06-30 10:44:58+00:00
44421604,How to Get WiFi in the Woods – DIY Solar Internet Station [video],https://www.youtube.com/watch?v=tXf8opZCQdk,2,2025-06-30 10:37:11+00:00
44421582,Can You Ever Really Know a Person? Biographers Keep Trying,https://www.nytimes.com/2025/06/13/magazine/ai-biographies-books-genre.html,3,2025-06-30 10:32:24+00:00
44421573,Apple Planning to Launch Low-Cost MacBook Powered by iPhone Chip,https://www.macrumors.com/2025/06/30/apple-to-launch-low-cost-macbook/,3,2025-06-30 10:30:18+00:00
44421571,Tried Cursor for the First time.. Made this,https://architrixs.github.io/leave-excuse-generator/,2,2025-06-30 10:29:53+00:00
44421566,Ask HN: What Are You Working On?,,1,2025-06-30 10:28:43+00:00
44421547,Spotify Discover Weekly Turns 10,https://newsroom.spotify.com/2025-06-30/discover-weekly-turns-10-celebrating-100-billion-tracks-streamed-and-a-decade-of-personalized-discovery/,1,2025-06-30 10:25:12+00:00
44421542,History of Unix Manpages,https://manpages.bsd.lv/history.html,3,2025-06-30 10:24:21+00:00
44421540,The Trump administration is building a national citizenship data system,https://www.npr.org/2025/06/29/nx-s1-5409608/citizenship-trump-privacy-voting-database,4,2025-06-30 10:24:08+00:00
44421531,"Sinaloa cartel hacked security cameras to track and kill FBI informants, US says",https://www.theguardian.com/world/2025/jun/27/sinaloa-cartel-fbi-hackers,7,2025-06-30 10:22:16+00:00
44421509,Free Postgres DB Tool (looking for feedback),https://seepatcode.github.io/datagres/,1,2025-06-30 10:19:08+00:00
44421504,Show HN: Wasmrun – A WASM runtime with plugin support (formerly Chakra),,3,2025-06-30 10:18:17+00:00
44421499,Trusting the Boot Process: Inside Bottlerocket's Security Architecture,https://molnett.eu/blog/25-06-30-trusting-the-boot-process,1,2025-06-30 10:17:29+00:00
44421497,Exception Handling in Rustc_codegen_cranelift,https://tweedegolf.nl/en/blog/157/exception-handling-in-rustc-codegen-cranelift,2,2025-06-30 10:17:22+00:00
44421490,Manipulating trapped air bubbles in ice for message storage in cold regions,https://www.cell.com/cell-reports-physical-science/fulltext/S2666-3864(25)00221-8,64,2025-06-30 10:15:52+00:00
44421488,Scientist Says the Universe May Have a Memory of Its Own,https://www.popularmechanics.com/science/a65178424/memory-cells/,5,2025-06-30 10:15:26+00:00
44421476,Lewis Capaldi Makes Surprise Return to Glastonbury,https://themusic.com.au/news/i-m-f-cking-back-baby-lewis-capaldi-makes-surprise-return-to-glastonbury/07Rpx8bJyMs/28-06-25,1,2025-06-30 10:12:33+00:00
44421457,ChatGPT and other AI tools are changing the teaching profession,https://apnews.com/article/ai-chatgpt-teacher-chatbot-b1630bc549e9044d1e3bbcc060fb422c,2,2025-06-30 10:10:20+00:00
44421447,Europe's First Exascale Supercomputer Powers Up,https://spectrum.ieee.org/jupiter-exascale-supercomputer-europe,5,2025-06-30 10:08:09+00:00
44421410,Generate Data with Gemini in Google Sheets,https://workspaceupdates.googleblog.com/2025/06/generate-data-with-gemini-in-google-sheets.html,1,2025-06-30 10:03:10+00:00
44421386,"The whistleblowers were less sure that Boeing's 787 Dreamliner are the ""safest""",https://www.bbc.com/news/articles/cwyq7vgq2e5o,4,2025-06-30 09:58:28+00:00
44421384,Positive link between cannabis use and 'Major Adverse Cardiovascular Events',https://heart.bmj.com/content/early/2025/06/10/heartjnl-2024-325429,41,2025-06-30 09:58:18+00:00
44421377,"Neptune-32: modular, extensible CPU emulator written in Java",https://github.com/LPC4/Neptune-32,1,2025-06-30 09:57:35+00:00
44421376,Ask HN: Best way to add trackable events at Homebrew/casks?,,1,2025-06-30 09:57:22+00:00
44421335,Garamond,https://www.google.com/search?q=Garamond,3,2025-06-30 09:51:08+00:00
44421325,Unleash Blading Resurrection,,1,2025-06-30 09:49:37+00:00
44421324,"Building a Zero-Dependency Networking Tool with Go, C++, and Zig",https://nanoping.com/blog/building-a-zero-dependency-networking-tool-with-go-cpp-and-zig,4,2025-06-30 09:49:26+00:00
44421323,First Indian Astronaut to Arrive Soon on NASA's International Space Station,https://www.bbc.com/news/articles/crenw0nyqnqo,4,2025-06-30 09:49:26+00:00
44421301,Apple to release cheaper MacBook powered by iPhone processor,https://9to5mac.com/2025/06/30/cheaper-macbook-iphone-chip-kuo/,5,2025-06-30 09:44:49+00:00
44421276,Pulsar.pub: Create simple websites fast,https://pulsar.pub/,2,2025-06-30 09:40:41+00:00
44421258,Writing Code to Be Read at a Glance,https://jelv.is/blog/Writing-Code-To-Be-Read-at-a-Glance/,1,2025-06-30 09:35:53+00:00
44421257,Show HN: Being overlooked by recruiters s_cks. So I built this,https://www.interviuu.com/,1,2025-06-30 09:35:51+00:00
44421254,If AI Lets Us Do More in Less Time–Why Not Shorten the Workweek?,https://sfg.media/en/a/if-ai-lets-us-do-more-in-less-time/,73,2025-06-30 09:35:35+00:00
44421253,When Analog and FPGA collide – precision sampling,https://www.hackster.io/adam-taylor/precision-analog-measurement-b26dbc,2,2025-06-30 09:35:35+00:00
44421226,The billionaire betting on crypto – and the skeptic betting against him,https://www.washingtonpost.com/business/2025/06/28/michael-saylor-jim-chanos-bitcoin-feud/,3,2025-06-30 09:31:23+00:00
44421214,Content as structured data – Compile content to syntax trees and vice versa,https://unifiedjs.com/,1,2025-06-30 09:29:25+00:00
44421196,Switching from Desktop Linux to FreeBSD,https://hackaday.com/2025/06/29/switching-from-desktop-linux-to-freebsd/,3,2025-06-30 09:27:27+00:00
44421185,The provenance memory model for C,https://gustedt.wordpress.com/2025/06/30/the-provenance-memory-model-for-c/,225,2025-06-30 09:25:14+00:00
44421177,"What the rise of “buy now, pay later” services tells us about the  economy",https://www.vox.com/today-explained-podcast/417970/buy-now-pay-later-klarna-doordash-economy,1,2025-06-30 09:24:22+00:00
44421172,Leap: AI Agent That Deploys to Your AWS Account,https://leap.new/?,2,2025-06-30 09:23:14+00:00
44421159,"Show HN: A rigorous proof that the imaginary unit ""i"" is real(PGP and DOI)",https://zenodo.org/records/15771155,1,2025-06-30 09:20:34+00:00
44421141,AI Infra Guard,https://github.com/Tencent/AI-Infra-Guard,1,2025-06-30 09:17:51+00:00
44421113,Skin Deep: Source Code Release,https://blendogames.com/news/post/2025-06-26-skindeepsourcecode/,1,2025-06-30 09:12:32+00:00
44421095,High-flux and stable thin-film evaporation from fiber membranes,https://www.sciencedirect.com/science/article/abs/pii/S2542435125001564,1,2025-06-30 09:10:31+00:00
44421094,What's the difference between named functions and arrow functions in JavaScript?,https://jrsinclair.com/articles/2025/whats-the-difference-between-named-functions-and-arrow-functions/,46,2025-06-30 09:10:23+00:00
44421086,AxiomOS An AI system where agents generate and evolve under an Overseer,https://github.com/Linutesto/AxiomOS,1,2025-06-30 09:09:42+00:00
44421082,Warzonemeta.io,https://warzonemeta.io/,2,2025-06-30 09:09:15+00:00
44421063,How we moved to Shadcn to standardize UI in LocalOps,https://localops.co/blog/new-ui-how-we-used-shadcn-ui-standardise-ui-ux-in-localops,1,2025-06-30 09:06:34+00:00
44421039,Show HN: RepoInsightAI – Learn about a GitHub Repository with LLM,https://github.com/TigerkidYang/RepoInsightAI,1,2025-06-30 09:01:57+00:00
44420963,Why Americans are less likely to voice their opinions on political issues?,https://werd.io/self-censorship-and-the-spiral-of-silence-why-americans-are-less-likely-to-publicly-voice-their-opinions-on-political-issues/,3,2025-06-30 08:51:47+00:00
44420943,Thousands in Norway told they had won life-changing sums in lottery error,https://www.theguardian.com/world/2025/jun/29/thousands-in-norway-told-they-had-won-life-changing-sums-in-lottery-error,45,2025-06-30 08:47:54+00:00
44420900,PostgreSQL: HypoPG 1.4.2 Is Out,https://www.postgresql.org/about/news/hypopg-142-is-out-3094/,1,2025-06-30 08:41:05+00:00
44420893,"Recently, June 29, 2025 – island94.org",https://island94.org/2025/06/recently-june-29-2025,1,2025-06-30 08:40:09+00:00
44420892,"Show HN: Oomol – A local-first, code-first workflow automation engine",https://oomol.com,2,2025-06-30 08:40:08+00:00
44420880,Android Workgroup,https://www.swift.org/android-workgroup/,4,2025-06-30 08:37:11+00:00
44420870,OpenAI is doing a 1 week company shutdown,https://twitter.com/TheRealAdamG/status/1939447922006909376,4,2025-06-30 08:35:03+00:00
44420868,Understanding Keyword Search,https://kentro-learn.com/free-content/keyword-search-fundamentals,1,2025-06-30 08:35:00+00:00
44420865,"""Sovereign cloud""? A Trojan Horse at Europe's digital gates",https://tuta.com/blog/sovereign-washing,10,2025-06-30 08:34:11+00:00
44420860,Intel will shut down its automotive business,https://fortune.com/2025/06/26/why-intel-will-shut-down-its-automotive-business/,4,2025-06-30 08:33:38+00:00
44420846,NASA Mars Orbiter Learns New Moves After Nearly 20 Years in Space,https://www.jpl.nasa.gov/news/nasa-mars-orbiter-learns-new-moves-after-nearly-20-years-in-space/,2,2025-06-30 08:32:19+00:00
44420817,How [NOT] to Evaluate Your RAG,https://nixiesearch.substack.com/p/how-not-to-evaluate-your-rag,5,2025-06-30 08:28:33+00:00
44420801,Compiling Brainfuck Code – Part 1: An Optimized Interpreter,https://rodrigodd.github.io/2022/10/21/bf_compiler-part1.html,1,2025-06-30 08:25:13+00:00
44420785,How Humans Solve Problems,https://theness.com/neurologicablog/how-humans-solve-problems/,1,2025-06-30 08:21:25+00:00
44420775,How Long Contexts Fail,https://www.dbreunig.com/2025/06/22/how-contexts-fail-and-how-to-fix-them.html,1,2025-06-30 08:20:18+00:00
44420769,First Hack Contest for LLMs:),https://github.com/yanndegat/gol-llm-challenge,4,2025-06-30 08:19:41+00:00
44420742,Using Advanced JSON Context Profiles to generate same-looking AI images,https://www.yurikoval.com/blog/generate-consistent-images-using-advanced-json-context-profiles.html,2,2025-06-30 08:16:14+00:00
44420740,When the CTO Asks You to Use Autocomplete,https://idiallo.com/blog/when-cto-asks-you-to-use-autocomplete,1,2025-06-30 08:15:45+00:00
44420737,Show HN: VidVeo3 – AI Video Creation with Seamless Sound,https://www.vidveo3.com/,1,2025-06-30 08:15:27+00:00
44420735,Tripthesia – Create personalized travel itineraries with AI,https://tripthesia.travel,1,2025-06-30 08:15:26+00:00
44420731,Canada rescinds digital services tax to advance trade negotiations with the US,https://www.canada.ca/en/department-finance/news/2025/06/canada-rescinds-digital-services-tax-to-advance-broader-trade-negotiations-with-the-united-states.html,3,2025-06-30 08:14:21+00:00
44420728,Former NTSB IG: Boeing 787 FADEC may have caused AirIndia crash,https://sundayguardianlive.com/investigation/boeing-787-software-may-have-caused-ai-crash-aviation-expert,6,2025-06-30 08:14:00+00:00
44420715,Would you use a chat app that auto-generates to-do list from chat?,https://markhub.ink,1,2025-06-30 08:11:09+00:00
44420711,Show HN: I rewrote my notepad calculator as a local-first app with CRDT syncing,https://numpad.io,46,2025-06-30 08:10:27+00:00
44420687,I Left Quantum Computing Research [video],https://www.youtube.com/watch?v=pDj1QhPOVBo,5,2025-06-30 08:05:20+00:00
44420678,The Accuracy Trap – Why Winning Too Often Can Break You,https://www.fractiz.com/the-accuracy-trap/,2,2025-06-30 08:04:01+00:00
44420677,"Safeguarding and Monetizing Music in Digital, Virtual and AI-Driven Worlds",https://www.copyrightdelta.com/,2,2025-06-30 08:03:40+00:00
44420643,Creating a Chatbot with Google Gemini Vertex AI and Quarkus,https://www.loicmathieu.fr/wordpress/en/informatique/creer-un-chatbot-avec-google-gemini-vertex-ai-et-quarkus/,1,2025-06-30 07:58:10+00:00
44420616,"After decades in the US, Iranians arrested in Trump's deportation drive",https://apnews.com/article/iran-immigration-arrests-us-trump-deportations-9a4136657bda3a277125738807848368,4,2025-06-30 07:55:40+00:00
44420602,Anthropic's Claude AI became a terrible business owner in an experiment,https://techcrunch.com/2025/06/28/anthropics-claude-ai-became-a-terrible-business-owner-in-experiment-that-got-weird/,3,2025-06-30 07:54:11+00:00
44420586,"Harper: Offline, privacy-first grammar checker. Fast, open-source, Rust",https://github.com/Automattic/harper,4,2025-06-30 07:51:41+00:00
44420574,What is wrong with all those AArch64 desktops? (2019),https://marcin.juszkiewicz.com.pl/2019/10/23/what-is-wrong-with-all-those-aarch64-desktops/,5,2025-06-30 07:49:24+00:00
44420559,"Ask HN: What made you click TCP, THE TRANSPORT LAYER OF INTERNET?",,1,2025-06-30 07:46:34+00:00
44420548,Ask HN: MCP vs. Browser-Based Agents,,1,2025-06-30 07:45:04+00:00
44420525,Show HN: Anagnorisis. A Vision for Better Information Management,https://medium.com/@AlexeyBorsky/anagnorisis-part-1-a-vision-for-better-information-management-5658b6aaffa0,2,2025-06-30 07:40:09+00:00
44420501,Low-Rank Multiplicative Adaptation for LLMs,https://exploration-lab.github.io/LoRMA/,5,2025-06-30 07:35:45+00:00
44420467,60-Foot Magnet Could Be the Key to Fusion Energy,https://www.slashgear.com/1894572/green-nuclear-fusion-energy-us-iter-magnet/,5,2025-06-30 07:30:26+00:00
44420436,Louvre shuts down with staff sounding the alarm on mass tourism,https://www.washingtonpost.com/world/2025/06/16/louvre-museum-paris-closed-lines-delay/2b303a16-4a9f-11f0-8fff-262d6ec54ab9_story.html,16,2025-06-30 07:24:54+00:00
44420413,The Lightswitch Problem,https://therectangle.substack.com/p/the-lightswitch-problem,5,2025-06-30 07:20:27+00:00
44420411,Web Share – Get access to premium Tailwind CSS code and Figma designs for free,https://web-share-seven.vercel.app/,3,2025-06-30 07:20:03+00:00
44420406,"Show HN: CommandChronicles – Secure, project-aware CLI history with sync",https://commandchronicles.dev,2,2025-06-30 07:18:51+00:00
44420400,How did Quake work on Windows 95?,https://www.doomworld.com/forum/topic/153992-how-did-quake-work-on-windows-95/,2,2025-06-30 07:17:29+00:00
44420372,Sir Francis Graham-Smith 'Towering figure' of British astronomy dies at 102,https://www.bbc.com/news/articles/cly18j7wqvpo,7,2025-06-30 07:12:32+00:00
44420367,Why learn about the golden-section search,https://wordsandbuttons.online/why_learn_about_the_golden_section_search.html,2,2025-06-30 07:11:35+00:00
44420363,Cisco IP Phones (7960 / 7965) [video],https://www.youtube.com/watch?v=uA1VXI7uWLM,1,2025-06-30 07:10:44+00:00
44420326,Thejaswi Adimulam Releases Transformative Insights in the Synergy of Minds,https://www.indiehackers.com/post/thejaswi-adimulam-releases-transformative-insights-in-the-synergy-of-minds-how-ai-and-machine-learning-are-reshaping-our-world-dfwgBFHUMZrqpDqY2S7C,1,2025-06-30 07:02:54+00:00
44420320,Usbsid-Pico is a RPi Pico based board for interfacing MOS SID chips,https://github.com/LouDnl/USBSID-Pico,5,2025-06-30 07:02:20+00:00
44420274,Show HN: A Support Group for adults in pursuit of Happiness,https://childrensbookforall.org/support-group/1,1,2025-06-30 06:54:06+00:00
44420231,Show HN: AGI-SaaS v1.0.0 – Modular Python RAG Framework for LLM Pipelines,https://github.com/KilianDiama/AGI-SaaS/releases/tag/v1.0.0,1,2025-06-30 06:48:21+00:00
44420200,Copyleft-next: A non-weak copyleft license inspired by the GNU GPL,https://lists.copyleft.org/pipermail/next/2025q2/000000.html,2,2025-06-30 06:45:15+00:00
44420194,Handling the Shoes,https://fi-le.net/shoes/,2,2025-06-30 06:43:36+00:00
44420190,Investors flock to Europe as bloc's stability contrasts with concerns over US,https://www.reuters.com/business/finance/investors-flock-europe-blocs-stability-contrasts-with-concerns-over-us-2025-06-30/,14,2025-06-30 06:42:03+00:00
44420177,Automated Book Scanner,https://old.reddit.com/r/arduino/comments/1lkgw0y/automated_book_scanner/,2,2025-06-30 06:40:23+00:00
44420175,Security and Human Rights in the Age of BCIs,https://blog.unsupervision.com/bci-security-and-human-rights/,1,2025-06-30 06:40:22+00:00
44420142,Costly SEO Mistakes Your Business Can't Afford,https://www.slideshare.net/slideshow/7-costly-seo-mistakes-your-business-can-t-afford-pptx/280736434,1,2025-06-30 06:35:28+00:00
44420135,An Initial LLM Safety Analysis of Apple's On-Device Foundation Model,https://www.cycraft.com/post/a-first-look-an-initial-llm-safety-analysis-of-apples-on-device-foundation-model-en-20250630,1,2025-06-30 06:34:42+00:00
44420127,Fears and Secret Dreams,https://thepointmag.com/criticism/hidden-fears-and-secret-dreams/,4,2025-06-30 06:32:56+00:00
44420097,Kagi scheduled maintainence for about 1 hour,https://status.kagi.com,4,2025-06-30 06:27:58+00:00
44420091,We just added bounties on Windows and macOS issues,https://github.com/f3d-app/f3d/issues,2,2025-06-30 06:27:22+00:00
44420075,UBS employee data leaked after cyber attack on supplier,https://www.computerweekly.com/news/366626166/UBS-employee-data-leaked-after-cyber-attack-on-supplier,2,2025-06-30 06:25:18+00:00
44420074,KolibriOS,https://kolibrios.org/en/,5,2025-06-30 06:24:34+00:00
44420072,"AI Systems Are Now Learning to Deceive, Scheme, and Threaten Humans",https://in.mashable.com/tech/96357/ai-systems-are-now-learning-to-deceive-scheme-and-threaten-humans-say-experts,14,2025-06-30 06:23:50+00:00
44420063,Linux Con ZRAM,https://github.com/JoAzar/Ciberseguridad/blob/main/Linux_swap_zram.md,1,2025-06-30 06:22:24+00:00
44420049,Disastrous rebrands and what you can learn from them,https://www.creativebloq.com/design/branding/5-disastrous-rebrands-and-what-you-can-learn-from-them,6,2025-06-30 06:20:59+00:00
44420005,Rhythmic mantle plume rising beneath Ethiopia is creating a new ocean,https://www.livescience.com/planet-earth/pulsing-like-a-heartbeat-rhythmic-mantle-plume-rising-beneath-ethiopia-is-creating-a-new-ocean,8,2025-06-30 06:15:45+00:00
44419997,Show HN: Velvet Security Framework,https://osf.io/4f6n9/?view_only=4fa3464ba56046ce8f79a1aad88d08fd,1,2025-06-30 06:14:47+00:00
44419994,"Volvo delivers 5,000th electric semi with little fanfare",https://electrek.co/2025/06/29/volvo-delivers-5000th-electric-semi-with-little-fanfare-sending-a-big-message/,5,2025-06-30 06:14:21+00:00
44419986,"Want to meet people, try charging them for it?",https://notes.eatonphil.com/2025-06-28-want-to-meet-people-charge-them.html,192,2025-06-30 06:13:10+00:00
44419979,Serfdom,https://en.wikipedia.org/wiki/Serfdom,2,2025-06-30 06:11:51+00:00
44419947,Show HN: Ship Name AI Tool,https://shipname.net,2,2025-06-30 06:06:16+00:00
44419944,USPS still delivers mail via mule,https://facts.usps.com/8-mile-mule-train-delivery/,2,2025-06-30 06:05:44+00:00
44419933,"LLMs, but Only Because Your Tech Sucks",https://aartaka.me/llms-suck.html,3,2025-06-30 06:04:08+00:00
44419912,Can Sunlight Cure Disease?,https://www.scientificamerican.com/article/surprising-ways-that-sunlight-might-heal-autoimmune-diseases/,7,2025-06-30 05:59:34+00:00
44419873,Official Brave F-Droid repository now available,https://brave.com/blog/f-droid/,2,2025-06-30 05:52:50+00:00
44419872,Ask HN: Is noprocrast still working for you?,,10,2025-06-30 05:52:39+00:00
44419841,Financial Times and Detektor.fm boldly exploring the Fediverse frontier,https://stylestitches.substack.com/p/where-no-media-has-gone-before-the,2,2025-06-30 05:47:01+00:00
44419804,EFF – Surveillance Self-Defense,https://ssd.eff.org/,2,2025-06-30 05:39:59+00:00
44419775,Smelters say they are losing power battle with Big Tech,https://www.ft.com/content/deab6a77-12f2-4b66-a9f7-2625654fb493,3,2025-06-30 05:35:18+00:00
44419762,Canada Drops Digital Tax That Infuriated Trump to Restart Trade Talks,https://www.bloomberg.com/news/articles/2025-06-30/canada-drops-digital-tax-that-infuriated-trump-to-restart-trade-talks,6,2025-06-30 05:31:20+00:00
44419753,That Dropped Call with Customer Service? It Was on Purpose,https://www.theatlantic.com/ideas/archive/2025/06/customer-service-sludge/683340/,86,2025-06-30 05:29:10+00:00
44419747,Body Type Calculator,https://calc9.com/body-type-calculator,1,2025-06-30 05:28:09+00:00
44419702,The parental dead end of consent morality,https://world.hey.com/dhh/the-parental-dead-end-of-consent-morality-e4e8a8ee,6,2025-06-30 05:21:42+00:00
44419677,MTTR: Bullshit Masquerading as Operational Efficiency,https://medium.com/@Hatchman76/mttr-bullshit-masquerading-as-operational-efficiency-bc06fda12207,2,2025-06-30 05:18:34+00:00
44419660,Show HN: Ishihara plate generator I made in Rust,https://ishihara.datrova.workers.dev,2,2025-06-30 05:15:00+00:00
44419648,Why would you use .gitkeep?,https://joeblu.com/blog/2025_06_gitkeep/,3,2025-06-30 05:13:23+00:00
44419566,"Radioactive Bling: The Atomic ""Bomb"" Ring from KiX",https://globaltoynews.com/2022/06/24/radioactive-bling-the-atomic-bomb-ring-from-kix/,2,2025-06-30 04:58:44+00:00
44419560,It took 45 years but spreadsheet legend Mitch Kapor finally got his MIT degree,https://www.bostonglobe.com/2025/06/24/business/mitch-kapor-mit-degree-bill-aulet/,4,2025-06-30 04:58:00+00:00
44419555,Development Containers,https://containers.dev/,2,2025-06-30 04:57:32+00:00
44419520,2025 State of Foundation Models [video],https://www.youtube.com/watch?v=RwaLaDtTqag,2,2025-06-30 04:53:06+00:00
44419496,LetsEncrypt – Expiration Notification Service Has Ended,https://letsencrypt.org/2025/06/26/expiration-notification-service-has-ended/,181,2025-06-30 04:49:39+00:00
44419491,The Cubic Kilometer Problem,https://fromtheprism.com/cubic-kilometer-problem.html,4,2025-06-30 04:48:38+00:00
44419446,Bought myself an Ampere Altra system,https://marcin.juszkiewicz.com.pl/2025/06/27/bought-myself-an-ampere-altra-system/,206,2025-06-30 04:38:49+00:00
44419411,Wellsaid Review,https://coquitts.com/blog/wellsaid-review,2,2025-06-30 04:33:51+00:00
44419405,Thank You Apple (WWDC25),https://jhan.bearblog.dev/thank-you-apple-wwdc25/,3,2025-06-30 04:33:10+00:00
44419398,Silicon Valley Insider Exposes Cult Like AI Companies [video],https://www.youtube.com/watch?v=8enXRDlWguU,4,2025-06-30 04:32:16+00:00
44419389,Bring Me Problems,https://codingfearlessly.com/bring-me-problems,4,2025-06-30 04:30:11+00:00
