id,title,url,points,created_at
44749526,Chess.com but for debating(AI judge who wins),https://crs-prod-rankeddebate-l4dnggfaca-nn.a.run.app/,2,2025-07-31 20:03:08+00:00
44749523,Internal Microsoft pay guidelines reveal compensation ranges by level,https://www.businessinsider.com/microsoft-pay-guidelines-new-hire-offers-exception-2025-7,3,2025-07-31 20:02:38+00:00
44749501,What's with the Labubu Hate?,,3,2025-07-31 20:00:47+00:00
44749500,Unsloth improvements to gguf tool calling for Qwen3,https://huggingface.co/unsloth/Qwen3-Coder-30B-A3B-Instruct-GGUF,1,2025-07-31 20:00:47+00:00
44749498,Kashikodokoro Riding Car,https://en.wikipedia.org/wiki/Kashikodokoro_Riding_Car,2,2025-07-31 20:00:39+00:00
44749496,LangExtract: A Gemini powered information extraction library,https://developers.googleblog.com/en/introducing-langextract-a-gemini-powered-information-extraction-library/,2,2025-07-31 20:00:26+00:00
44749481,"Slack, Notion, and VSCode Improved Electron App Performance – Palette Docs",https://palette.dev/blog/improving-performance-of-electron-apps,1,2025-07-31 19:58:58+00:00
44749477,A Sequoia Forest Grows in Detroit,https://reasonstobecheerful.world/detroit-sequoias-super-trees/,3,2025-07-31 19:58:39+00:00
44749474,Microsoft Becomes Second Company Valued over $4T After Q2 Earnings,https://www.forbes.com/sites/zacharyfolk/2025/07/31/microsoft-becomes-second-company-valued-over-4-trillion-after-strong-second-quarter-earnings/,1,2025-07-31 19:58:30+00:00
44749467,91 people killed and 600 wounded while waiting for aid in Gaza in last 24 hours,https://www.theguardian.com/world/2025/jul/31/deaths-people-killed-aid-gaza-us-envoy-steve-witkoff-visits-israel,15,2025-07-31 19:58:00+00:00
44749466,Show HN: Reality Defender – Free Tier for Deepfake Detection in Images and Audio,https://app.realitydefender.ai/auth/login,16,2025-07-31 19:57:46+00:00
44749443,Show HN: TheHypeBridge – AI-Powered Influencer Vetting Reports for Brands,https://eval.thehypebridge.com/dashboard,1,2025-07-31 19:55:06+00:00
44749438,Kaleidos – A portable nuclear microreactor that replaces diesel generators,https://radiantnuclear.com/,117,2025-07-31 19:54:42+00:00
44749412,"Provider-agnostic, open-source evaluation infra for LLMs",https://github.com/groq/openbench,3,2025-07-31 19:52:10+00:00
44749387,The Big Oops in type systems: This problem extends to FP as well,https://danieltan.weblog.lol/2025/07/the-big-oops-in-type-systems-this-problem-extends-to-fp-as-well,96,2025-07-31 19:49:35+00:00
44749385,"Show HN: Patio Ask, a Perplexity-style DIY home improvement assistant",https://patio.so/ask,4,2025-07-31 19:49:17+00:00
44749370,Money Stuff: You Can Insider Trade NFTs Now,https://newsletterhunt.com/emails/195983,3,2025-07-31 19:47:35+00:00
44749365,"EPA eliminates research and development office, begins layoffs",https://apnews.com/article/epa-zeldin-trump-reorganization-science-research-acf0ad3a649f940e138b2a917169405f,6,2025-07-31 19:47:18+00:00
44749345,"Inside TSMC, the $1 Trillion Ghost Foundry Behind Nvidia's Crown",https://howardyu.substack.com/p/inside-tsmc-the-1-trillion-ghost,2,2025-07-31 19:45:38+00:00
44749337,TechnologyRanked: The Most Popular Programming Languages (2014-2024),https://www.visualcapitalist.com/ranked-the-worlds-most-popular-programming-languages-2014-2024/,2,2025-07-31 19:44:21+00:00
44749336,IRS chief says agency plans to end free filing program,https://www.cnbc.com/2025/07/30/irs-chief-says-agency-plans-to-end-free-direct-file-program.html,6,2025-07-31 19:44:17+00:00
44749326,Lethal Cambodia-Thailand border clash linked to cyber-scam slave camps,https://www.theregister.com/2025/07/31/thai_cambodia_war_cyberscam_links/,3,2025-07-31 19:42:54+00:00
44749319,Show HN: Flowcus – Kanban Board for OmniFocus and Apple Reminders,https://getflowcus.app/,1,2025-07-31 19:42:03+00:00
44749318,Show HN: I built an AI brand generator to stop wasting days naming side projects,https://brandkiit.com,4,2025-07-31 19:42:01+00:00
44749309,Community Contributions,https://philippemnoel.posthaven.com/community-contributions,2,2025-07-31 19:41:08+00:00
44749293,Figma's S-1/A from their IPO today,https://www.sec.gov/Archives/edgar/data/1579878/000162828025035381/figma-sx1a.htm,4,2025-07-31 19:39:43+00:00
44749284,Charvaka,https://en.wikipedia.org/wiki/Charvaka,1,2025-07-31 19:38:49+00:00
44749280,The upstart company that wants to build the largest aircraft,https://www.bbc.com/future/article/20250729-windrunner-the-company-that-wants-to-build-the-worlds-largest-aircraft,2,2025-07-31 19:38:35+00:00
44749278,Why Is Everyone Missing This with AI Agents? (Memory and Tools That Scale) [video],https://www.youtube.com/watch?v=F1I9JN0z0w0,2,2025-07-31 19:38:23+00:00
44749276,How to Dig for Music Without Spotify,https://pitchfork.com/thepitch/how-to-dig-for-music-without-spotify/,2,2025-07-31 19:38:16+00:00
44749273,Show HN: Moots AI (YC W22) helps you turn meetup contacts into deals,,1,2025-07-31 19:37:55+00:00
44749250,How to Build a Custom Mechanical Keyboard,https://www.alexotos.com/how-to-build-a-mechanical-keyboard/,2,2025-07-31 19:35:17+00:00
44749241,Show HN: SafeRate – AI chat-native mortgage lender,https://saferate.com/,11,2025-07-31 19:34:19+00:00
44749238,"Figma stock soars 230% in first day of trading, valuing company north of $40B",https://finance.yahoo.com/news/figma-stock-soars-230-in-first-day-of-trading-valuing-company-north-of-40-billion-132215034.html,3,2025-07-31 19:33:59+00:00
44749224,Chasing Riskless Profits with Triangular Arbitrage Bot on Binance,https://shufflingbytes.com/posts/binance-triangular-arbitrage/,1,2025-07-31 19:32:31+00:00
44749219,My Heart of Hearts,https://www.astralcodexten.com/p/my-heart-of-hearts,1,2025-07-31 19:32:19+00:00
44749211,What Can a Cell Remember?,https://www.quantamagazine.org/what-can-a-cell-remember-20250730/,83,2025-07-31 19:31:39+00:00
44749202,Sweeney confirms Epic Games Store launch on Play Store after Google loses appeal,https://www.neowin.net/news/fortnite-maker-confirms-epic-games-store-launch-on-play-store-after-google-loses-appeal/,6,2025-07-31 19:30:07+00:00
44749198,Sendria is a test SMTP server,https://github.com/msztolcman/sendria,2,2025-07-31 19:29:29+00:00
44749193,New ultrasound imaging to map drug delivery into the brain,https://medicalxpress.com/news/2025-07-ultrasound-imaging-drug-delivery-brain.html,2,2025-07-31 19:28:26+00:00
44749185,"From Elvis to ""Men in Black,"" the Story of the Hamilton Ventura",https://wornandwound.com/from-elvis-to-men-in-black-the-story-of-the-hamilton-ventura/,2,2025-07-31 19:27:13+00:00
44749178,"Andrew Tate's ""The Real World"" is stealing my software (2022)",https://insrt.uk/post/andrew-tate-stealing-software-revolt/,3,2025-07-31 19:26:27+00:00
44749175,Show HN: DJ-style audio waveform thumbnailer in Python,https://github.com/Alzy/Xochi-Thumbnailer,2,2025-07-31 19:26:20+00:00
44749173,The missing trust model in AI tools,https://docs.freestyle.sh/blog/missing-trust-model,1,2025-07-31 19:26:05+00:00
44749161,Orch.space – A visual builder for AI reasoning workflows (BYOK),https://www.orch.space/,1,2025-07-31 19:24:44+00:00
44749126,Changes in Inflation by City,https://wallethub.com/edu/cities-inflation/107537,3,2025-07-31 19:21:42+00:00
44749115,"Model Context Protocol, Product Demos, and the New App Store",https://wjgilmore.com/articles/model-context-protocol-product-demos-and-the-new-app-store,27,2025-07-31 19:20:02+00:00
44749107,Robotaxis are powered by human drivers as it launches ride-hailing in Bay Area,https://electrek.co/2025/07/31/teslas-robotaxis-officially-powered-by-human-drivers-as-it-launches-ride-hailing-bay-area/,2,2025-07-31 19:19:18+00:00
44749070,Show HN: Microsoft research on impact of GenAI on jobs,https://www.youtube.com/watch?v=agceklIOXLU,1,2025-07-31 19:15:11+00:00
44749063,Intuitive explanation of LLM Transformers without math,https://www.youtube.com/watch?v=VlbBgj2lBls,1,2025-07-31 19:14:24+00:00
44749059,Playwright users–wants design-partner to shape an AI tool that tames flaky tests,,1,2025-07-31 19:13:51+00:00
44749051,Our first outage from LLM-written code,https://sketch.dev/blog/our-first-outage-from-llm-written-code,7,2025-07-31 19:13:05+00:00
44749046,KDE Linux,https://kde.org/linux/,35,2025-07-31 19:12:38+00:00
44749042,Parsing Without ASTs and Optimizing with Sea of Nodes [video],https://www.youtube.com/watch?v=NxiKlnUtyio,3,2025-07-31 19:12:20+00:00
44749024,The Practicals of Writing: Paper and Pens,https://brianschrader.com/archive/the-practicals-of-writing-paper-and-pens/,4,2025-07-31 19:09:45+00:00
44749023,What Is Space-Time? Einstein's Theory of Time and Gravity Explained,https://www.discovermagazine.com/the-sciences/what-is-space-time-einsteins-theory-of-time-and-gravity-explained,7,2025-07-31 19:09:44+00:00
44748990,Released a lsp server for game maker language,https://github.com/Ralticks/gml_lsp,2,2025-07-31 19:06:17+00:00
44748987,Tesla hits a speed bump in its California 'Robotaxi' rollout: Permits,https://www.politico.com/news/2025/07/30/tesla-robotaxi-permit-problems-california-00486269,4,2025-07-31 19:05:55+00:00
44748984,Augment Code Brings Its Coding Agent to the Terminal,https://thenewstack.io/augment-code-brings-its-coding-agent-to-the-terminal/,1,2025-07-31 19:05:27+00:00
44748981,In-Network Leaderless Replication for Distributed Data Stores [pdf],https://www.vldb.org/pvldb/vol15/p1337-lee.pdf,2,2025-07-31 19:05:06+00:00
44748958,Understanding Blockchains Through Java Code,https://blog.blockingqueue.com/understanding-blockchains-through-java-code,3,2025-07-31 19:03:25+00:00
44748953,UK Government Warns Promoting the Use of VPNs Could Attract Fines,https://www.ispreview.co.uk/index.php/2025/07/uk-government-warns-promoting-the-use-of-vpns-could-attract-fines.html,6,2025-07-31 19:03:00+00:00
44748950,Show HN: Tight Studio – impressive screen recordings made easy,https://tight.studio/,1,2025-07-31 19:02:41+00:00
44748938,"Google Drive (docs and sheets) as a simple, headless CMS",https://jedwal.co/blog/google-drive-as-a-cms,2,2025-07-31 19:01:22+00:00
44748934,Slow,https://michaelnotebook.com/slow/index.html,991,2025-07-31 19:00:58+00:00
44748931,Show HN: We built Roomsy – a better way to manage household chores,https://roomsy.fun/,1,2025-07-31 19:00:33+00:00
44748911,Job Openings Declining at Small Firms,https://www.wsj.com/opinion/job-openings-declining-at-small-firms-a69be335,3,2025-07-31 18:58:51+00:00
44748908,A Look at the Lasting Supersuit Swimming Records,https://www.swimmingworldmagazine.com/news/what-remains-a-look-at-the-lasting-supersuit-records-which-will-go-next-and-which-are-untouchable/,2,2025-07-31 18:58:14+00:00
44748899,"""Seed-Strapped"" AI Startups Are Refusing Millions– To Make Billions",https://www.forbes.com/sites/jaimecatmull/2025/07/09/seed-strapped-ai-startups-are-refusing-millions--to-make-billions/,2,2025-07-31 18:57:41+00:00
44748884,Communicating efficient circadian light for SAD therapy,,1,2025-07-31 18:56:09+00:00
44748880,Experimental Static Site Generation in Duct UI,https://duct-ui.org/docs/static-site-generation,2,2025-07-31 18:55:53+00:00
44748862,Flying Steel Detection in Wire Rod Production Based on Improved YOLO V8,https://www.mdpi.com/2227-9717/13/7/2297,2,2025-07-31 18:54:12+00:00
44748860,"Show HN: Validationly – Validate Startup Ideas via Reddit, Twitter and LinkedIn",https://validationly.com/,1,2025-07-31 18:54:00+00:00
44748845,A Boy Genius Who Killed 14M Poor People,https://www.thebulwark.com/p/the-boy-genius-who-killed-14-million-luke-farritor-doge-elon-musk-trump,19,2025-07-31 18:51:59+00:00
44748816,Big firms could be fined by the UK for paying suppliers late,https://www.bbc.com/news/articles/c4gq204x4v2o,3,2025-07-31 18:48:59+00:00
44748815,"Evidence of 2,500 y/o Honey in Bronze Jars Found in a Paestum Shrine [pdf]",https://pubs.acs.org/doi/pdf/10.1021/jacs.5c04888,1,2025-07-31 18:48:59+00:00
44748803,Google Cloud Agent2Agent Protocol Updates for Developers,https://thenewstack.io/google-brings-the-a2a-protocol-to-more-of-its-cloud/,1,2025-07-31 18:47:13+00:00
44748793,"Apple, Google, OpenAI to Work with Feds to Make Health Data Helpful",https://www.bloomberg.com/news/articles/2025-07-30/apple-google-openai-to-work-with-feds-to-make-health-data-helpful,2,2025-07-31 18:45:56+00:00
44748771,Ask HN: Which coding AI Agents or tools are used in your organization?,,1,2025-07-31 18:44:26+00:00
44748769,Zuckerberg: Anyone not wearing AI glasses in the future will be at disadvantage,https://fortune.com/2025/07/31/mark-zuckerberg-meta-ray-ban-smart-glasses-ai/,13,2025-07-31 18:44:24+00:00
44748764,Penpot: The open-source design tool for design and code collaboration,https://github.com/penpot/penpot,1,2025-07-31 18:44:16+00:00
44748757,The Modos Developer Kit,https://www.modos.tech/,2,2025-07-31 18:43:53+00:00
44748741,Code Monkey or CAD Monkey?,https://blog.nawaz.org/posts/2016/Jan/code-monkey-or-cad-monkey/,4,2025-07-31 18:42:10+00:00
44748738,Parklife: Turn a Rack app into a static build,https://parklife.dev/,2,2025-07-31 18:41:54+00:00
44748725,Omarchy – An Opinionated Arch and Hyprland Setup by DHH,https://omarchy.org/,2,2025-07-31 18:40:24+00:00
44748708,World’s ‘oldest baby’ born from embryo frozen in 1994,https://www.theguardian.com/society/2025/jul/31/worlds-oldest-baby-born-embryo-frozen-1994-ivf,8,2025-07-31 18:38:25+00:00
44748706,No AI on Daniel O'Connell Stamp Featuring TV Aerial – An Post,https://www.rte.ie/news/ireland/2025/0731/1526316-an-post-stamp/,2,2025-07-31 18:38:13+00:00
44748687,Integrating Nix and Buck2,https://www.tweag.io/blog/2025-07-31-buck2-nix/,4,2025-07-31 18:36:33+00:00
44748658,Switching to Qwen3-30B-A3B-Instruct-2507 Significantly Improves Local Agent,https://hexeditreality.com/posts/qwen3-agent-improved/,2,2025-07-31 18:32:54+00:00
44748639,Ask HN: Tell me your horror story about blowing money on AI,,7,2025-07-31 18:31:31+00:00
44748636,Deep Agents,https://github.com/hwchase17/deepagents,1,2025-07-31 18:31:23+00:00
44748634,"Astronomical Telescope “Hadley” – an easy assembly, high performance Newtonian",https://www.printables.com/model/224383-astronomical-telescope-hadley-an-easy-assembly-hig,56,2025-07-31 18:31:10+00:00
44748632,IKEA Captcha,https://twitter.com/nealagarwal/status/1950923269000823079,3,2025-07-31 18:30:42+00:00
44748630,Microsoft's Azure AI Speech needs just seconds to spit out a convincing deepfake,https://www.theregister.com/2025/07/31/microsoft_updates_azure_ai_speech/,3,2025-07-31 18:30:34+00:00
44748618,Do Not Render Your Counterfactuals,https://ussri.substack.com/p/do-not-render-your-counterfactuals,3,2025-07-31 18:30:06+00:00
44748612,Book Review: The Maniac,https://jorgevelez.substack.com/p/the-maniac,1,2025-07-31 18:29:40+00:00
44748607,Don't Live as a Utilitarian,https://gumphus.substack.com/p/dont-live-as-a-utilitarian,3,2025-07-31 18:29:15+00:00
44748590,Interviews with 16 Former Detainees of El Salvador Terrorism Confinement Center,https://www.washingtonpost.com/world/2025/07/31/venezuelans-deported-us-el-salvador-prison-cecot/,4,2025-07-31 18:28:26+00:00
44748577,American Leadership in the Digital Finance Revolution,https://www.sec.gov/newsroom/speeches-statements/atkins-digital-finance-revolution-073125,4,2025-07-31 18:26:55+00:00
44748567,"Show HN: Airbnb API, powerful and developer-friendly",https://www.airroi.com/api,2,2025-07-31 18:25:57+00:00
44748520,Security Incident at Orange Group,https://newsroom.orange.com/the-orange-group-announces-that-it-filed-a-complaint-on-monday-28-july-concerning-a-security-incident-on-one-of-its-information-systems/,2,2025-07-31 18:21:54+00:00
44748510,DRL Peg-in-Hole Task Using Robotic Arm,https://github.com/leesweqq/DRL_Peg-in-Hole_UR5,2,2025-07-31 18:20:39+00:00
44748504,Ask HN: What to do with this new found coding superpower?,,2,2025-07-31 18:20:02+00:00
44748502,"Significant mortality of old trees across a dry forest landscape, Oregon, USA",https://www.sciencedirect.com/science/article/pii/S0378112725004153,2,2025-07-31 18:19:58+00:00
44748500,"OpenAI hits $12B in annualized revenue, The Information reports",https://www.reuters.com/business/openai-hits-12-billion-annualized-revenue-information-reports-2025-07-31/,4,2025-07-31 18:19:34+00:00
44748495,Microsoft CEO Sees Quantum as 'Next Big Accelerator in Cloud',https://thequantuminsider.com/2025/07/31/microsoft-ceo-sees-quantum-as-next-big-accelerator-in-cloud-ramps-up-ai-deployment/,1,2025-07-31 18:19:12+00:00
44748442,Existential Technologies (A Close Reading of Stanisław Lem's Summa Technologiae),https://existentialtech.antikythera.org/,3,2025-07-31 18:15:09+00:00
44748441,Figma more than triples in NYSE debut after selling shares at $33,https://www.cnbc.com/2025/07/31/figma-fig-starts-trading-on-nyse-after-ipo.html,12,2025-07-31 18:15:03+00:00
44748431,What's the Difference Between 'Filmed for Imax' and 'Shot with Imax?',https://variety.com/2025/film/news/the-difference-between-filmed-for-imax-and-shot-with-imax-1236425200/,3,2025-07-31 18:14:21+00:00
44748416,Ask HN: How to learn SOTA LLM-assisted coding skills?,,1,2025-07-31 18:13:11+00:00
44748398,CVE-2025-43253: Bypassing Launch Constraints on macOS,https://wts.dev/posts/bypassing-launch-constraints/,2,2025-07-31 18:10:54+00:00
44748351,3D-printed steel capsules endure nuclear reactor testing,https://www.ornl.gov/news/3d-printed-steel-capsules-endure-nuclear-reactor-testing,3,2025-07-31 18:05:12+00:00
44748344,Why We're Surrounding Our Kids with AI,https://secondvoice.substack.com/p/why-were-surrounding-our-kids-with,1,2025-07-31 18:04:43+00:00
44748327,The Hidden World of Residential Proxies,https://www.orangecyberdefense.com/global/blog/research/residential-proxies,5,2025-07-31 18:03:27+00:00
44748321,"CISA open-sources Thorium platform for malware, forensic analysis",https://www.bleepingcomputer.com/news/security/cisa-open-sources-thorium-platform-for-malware-forensic-analysis/,4,2025-07-31 18:02:52+00:00
44748317,You Can Insider Trade NFTs Now,https://www.bloomberg.com/opinion/newsletters/2025-07-31/you-can-insider-trade-nfts-now,4,2025-07-31 18:02:38+00:00
44748316,Show HN: Relay – AI Agent that helps you connect with the best people,https://www.relayy.world,1,2025-07-31 18:02:25+00:00
44748314,The best dating apps aren't even dating apps,https://techcrunch.com/2025/07/31/the-best-dating-apps-arent-even-dating-apps/,3,2025-07-31 18:02:10+00:00
44748307,There is no free lunch when dealing with engineering processes,https://taoem.com/chapters/10/theres-no-free-lunch-with-engineering-process,3,2025-07-31 18:01:22+00:00
44748283,Show HN: Why Is Finding Internal Experts So Hard? I Built an AI to Change That,https://exploredarkmatter.com/,1,2025-07-31 17:58:25+00:00
44748275,Schematra: Sinatra inspired Chicken web framework,https://github.com/rolandoam/schematra,6,2025-07-31 17:57:49+00:00
44748274,Tesla's 'robotaxi' rides in San Francisco have a human at the wheel,https://www.theverge.com/news/716867/tesla-robotaxi-san-francisco-launch,10,2025-07-31 17:57:48+00:00
44748257,What the EU's new software legislation means for developers (2024),https://github.blog/open-source/maintainers/what-the-eus-new-software-legislation-means-for-developers/,2,2025-07-31 17:56:27+00:00
44748249,How to get another free year of updates for your Windows 10 PC,https://arstechnica.com/gadgets/2025/07/how-to-get-another-free-year-of-updates-for-your-windows-10-pc/,9,2025-07-31 17:55:30+00:00
44748235,Biology 'This wasn't obvious': the potato evolved from a tomato ancestor,https://www.theguardian.com/science/2025/jul/31/potato-evolved-from-tomato-ancestor-researchers-find,6,2025-07-31 17:54:33+00:00
44748226,Watching the World in a Dark Room: The Early Modern Camera Obscura,https://publicdomainreview.org/essay/the-early-modern-camera-obscura,14,2025-07-31 17:53:54+00:00
44748222,NYC Shooting Horror Rocks Rudin's Century-Old Property Dynasty,https://www.bloomberg.com/news/features/2025-07-31/nyc-shooting-poses-major-test-for-rudin-real-estate-dynasty,1,2025-07-31 17:53:45+00:00
44748196,Why I'm Taking Events on the Road This Fall,https://www.xoruby.com/blog/why-i-am-taking-events-on-the-road-this-fall/,1,2025-07-31 17:51:14+00:00
44748186,Show HN: Astronomical Mistake – The Song,https://www.youtube.com/watch?v=17wYUcFA72g,5,2025-07-31 17:50:15+00:00
44748152,Microfluidic Rotary Selector Valve,https://www.yputube.com/watch?v=yFyCuOm6_zA&t=17,1,2025-07-31 17:48:02+00:00
44748150,Cogito V2 Preview,https://www.deepcogito.com/research/cogito-v2-preview,2,2025-07-31 17:47:54+00:00
44748126,Ask HN: Real Karma?,,2,2025-07-31 17:45:04+00:00
44748101,Epic just won its antitrust lawsuit against Google again,https://www.theverge.com/news/716856/epic-v-google-win-in-appeals-court,6,2025-07-31 17:42:36+00:00
44748086,The Micro-Benchmark Fallacy,https://sindresorhus.com/blog/micro-benchmark-fallacy,2,2025-07-31 17:41:10+00:00
44748068,Shared neural representations for future thinking among optimistic individuals,https://www.pnas.org/doi/10.1073/pnas.2511101122,2,2025-07-31 17:39:42+00:00
44748056,FLUX.1 Krea: post-trained text-to-image model from Black Forest Labs and Krea,https://github.com/krea-ai/flux-krea,9,2025-07-31 17:38:28+00:00
44748040,Don't outsource my thinking to a chatbot.,https://karimmustaghni.substack.com/p/i-dont-want-to-outsource-my-thinking,1,2025-07-31 17:37:42+00:00
44747956,Google indexing shared ChatGPT convos,https://www.pymnts.com/news/artificial-intelligence/2025/chatgpt-users-may-be-inadvertently-sharing-conversations-search-results/,10,2025-07-31 17:30:27+00:00
44747954,Fluidically Innervated Lattices: 3-D-printed tactile sensors for soft robots,https://arxiv.org/abs/2507.21225,3,2025-07-31 17:30:18+00:00
44747942,Trump suspends trade loophole for cheap online retailers globally,https://arstechnica.com/tech-policy/2025/07/trump-suspends-trade-loophole-for-cheap-online-retailers-globally/,3,2025-07-31 17:29:19+00:00
44747940,Beijing summons Nvidia over alleged backdoors in China-bound AI chips,https://www.theregister.com/2025/07/31/beijing_nvidia_backdoors/,6,2025-07-31 17:29:14+00:00
44747936,A.I. Researchers Are Negotiating $250M Pay Packages. Just Like NBA Stars,https://www.nytimes.com/2025/07/31/technology/ai-researchers-nba-stars.html,17,2025-07-31 17:28:57+00:00
44747925,"Microfluidic device: separation, sorting, mixing [video]",https://www.youtube.com/watch?v=AENnU0vdjPo,2,2025-07-31 17:28:06+00:00
44747908,Quora's Poe releases API with access to all AI models,https://techcrunch.com/2025/07/31/quoras-poe-is-releasing-an-api-for-developers-to-easily-access-a-boquet-of-models/,4,2025-07-31 17:26:46+00:00
44747901,We're Losing the Global War on End-to-End Encryption,https://community.qbix.com/t/the-global-war-on-end-to-end-encryption/214,4,2025-07-31 17:26:16+00:00
44747893,"Poe accounts can now be used to power Cursor, Cline, Roo Code",https://twitter.com/adamdangelo/status/1950970003639116097,12,2025-07-31 17:25:45+00:00
44747886,Engineering Buy-In,https://venki.dev/notes/engineering-buy-in,33,2025-07-31 17:24:34+00:00
44747881,Beat Coding Interview Anxiety with ChatGPT and Google AI Studio,https://zackproser.com/blog/beat-coding-interview-anxiety,3,2025-07-31 17:24:03+00:00
44747880,"The String Theory [David Foster Wallace, 1996]",https://www.esquire.com/sports/a5151/the-string-theory-david-foster-wallace/,2,2025-07-31 17:24:03+00:00
44747870,Go Assembly Mutation Testing,https://words.filippo.io/assembly-mutation/,40,2025-07-31 17:23:17+00:00
44747863,Brilliant Labs new AR Glasses are here,https://brilliant.xyz/blogs/announcements/building-halo-has-been-a-journey,1,2025-07-31 17:22:22+00:00
44747843,Secure boot certificate rollover is real but probably won't hurt you,https://mjg59.dreamwidth.org/72892.html,141,2025-07-31 17:21:07+00:00
44747831,A Primer on Making Your Product Globally Adaptable (Without Doing Too Much Work),https://loctechpartners.notion.site,2,2025-07-31 17:20:13+00:00
44747824,Show HN: Pairfonts – A web application for pairing Google Fonts,https://pairfonts.surge.sh/,3,2025-07-31 17:18:54+00:00
44747816,How long before superintelligence? (1997),https://nickbostrom.com/superintelligence,57,2025-07-31 17:17:50+00:00
44747813,Rust Support in Socket,https://socket.dev/blog/introducing-rust-support-in-socket,8,2025-07-31 17:17:40+00:00
44747809,Introduction to XEphem (Motif) (2006),http://spiff.rit.edu/classes/phys445/lectures/planetarium/xephem_howto.html,15,2025-07-31 17:17:25+00:00
44747800,Nvidia CUDA-Q,https://nvidia.github.io/cuda-quantum/latest/index.html,3,2025-07-31 17:16:22+00:00
44747786,My bytecode optimizer beats Copilot by 2x,https://deviantabstraction.com/2025/07/29/how-my-bytecode-optimizer-beats-copilot-by-2x/,47,2025-07-31 17:15:25+00:00
44747785,Webflow Incident Report,https://webflow.com/blog/july-28-webflow-incident-report,7,2025-07-31 17:15:24+00:00
44747780,US imposes sanctions on Brazilian judge who charged Bolsonaro with plotting coup,https://www.reuters.com/world/americas/us-imposes-sanctions-brazilian-high-court-judge-2025-07-30/,13,2025-07-31 17:14:55+00:00
44747750,Understanding why deterministic output from LLMs is nearly impossible,https://unstract.com/blog/understanding-why-deterministic-output-from-llms-is-nearly-impossible/,2,2025-07-31 17:12:01+00:00
44747746,Figma Poised to Open Trading at More Than Triple Its IPO Price,https://www.bloomberg.com/news/articles/2025-07-31/figma-ipo-brings-value-near-20-billion-from-failed-adobe-deal,6,2025-07-31 17:11:32+00:00
44747733,Epic Games Win over Google in Fortnite Fight Upheld on Appeal,https://www.bloomberg.com/news/articles/2025-07-31/epic-games-win-over-google-in-fortnite-fight-upheld-on-appeal,18,2025-07-31 17:10:38+00:00
44747728,How to Scan Force Pushed Commits for Secrets,https://trufflesecurity.com/blog/how-to-scan-force-pushed-commits-for-secrets,20,2025-07-31 17:10:21+00:00
