id,title,url,points,created_at
43213612,An update on Mozilla's terms of use for Firefox,https://blog.mozilla.org/en/products/firefox/update-on-terms-of-use/,596,2025-02-28 23:59:35+00:00
43213592,PyFL and Its While Clauses,https://billwadge.com/2025/02/28/pyfl-and-its-while-clauses/,1,2025-02-28 23:57:39+00:00
43213583,It Was an Ambush,https://www.theatlantic.com/ideas/archive/2025/02/ukraine-us-relations-trump/681880/,95,2025-02-28 23:56:35+00:00
43213563,Formation of organic glass from a human brain,https://www.nature.com/articles/s41598-025-88894-5,14,2025-02-28 23:54:24+00:00
43213532,A CSS-Only Star Rating Component and More (Part 1) – CSS-Tricks,https://css-tricks.com/a-css-only-star-rating-component-and-more-part-1/,1,2025-02-28 23:52:18+00:00
43213530,Bloated Department of Defense spends more money than any other government agency,https://theintercept.com/2025/02/28/musk-doge-pentagon-military-spending-f35/,13,2025-02-28 23:52:16+00:00
43213504,European leaders show support for Zelenskiy after Trump clash,https://www.reuters.com/world/europe/european-leaders-show-support-zelenskiy-after-trump-clash-2025-02-28/,49,2025-02-28 23:50:10+00:00
43213473,What Lies Beneath the Gravestone of a Fictional It Girl?,https://www.atlasobscura.com/articles/trinity-churchyard-charlotte-temple-grave,2,2025-02-28 23:48:40+00:00
43213452,Musk suggests retired air traffic controllers consider returning to job,https://ny1.com/nyc/all-boroughs/transportation/2025/02/28/elon-musk-air-traffic-controller-shortage-retirees,4,2025-02-28 23:46:54+00:00
43213385,Anduril Takes Helm of Army's $22B IVAS Program,https://x.com/i/trending/1889467852807348341,1,2025-02-28 23:39:59+00:00
43213365,Disney steals art and sells it in their gift shops,https://www.youtube.com/watch?v=ylKLIjlDEi8,11,2025-02-28 23:38:34+00:00
43213334,Politics and the English Language,https://www.orwellfoundation.com/the-orwell-foundation/orwell/essays-and-other-works/politics-and-the-english-language/,3,2025-02-28 23:36:58+00:00
43213329,MedRAX: Medical Reasoning Agent for Chest X-ray,https://github.com/bowang-lab/MedRAX,1,2025-02-28 23:36:17+00:00
43213325,"China's mature chips to make up 28% of world production, creating oversupply",https://www.tomshardware.com/tech-industry/chinas-mature-chips-to-make-up-28-percent-of-world-production-creating-oversupply-western-companies-express-concern-for-their-survival,4,2025-02-28 23:35:56+00:00
43213309,Did Michelangelo paint a young adult woman with breast cancer in Sistine Chapel?,https://www.sciencedirect.com/science/article/pii/S0960977624001541,1,2025-02-28 23:34:42+00:00
43213296,Farmers depend on climate data. They're suing the USDA for deleting it,https://grist.org/food-and-agriculture/farmers-usda-climate-data-lawsuit-website-purge/,33,2025-02-28 23:33:53+00:00
43213257,Show HN: a Rust library for creating hierarchical state machines,https://docs.rs/moku/0.2.0/moku/,38,2025-02-28 23:30:37+00:00
43213252,Ask HN: Provide me ideas to code up for a school task that I have to do,,1,2025-02-28 23:30:03+00:00
43213247,Received an unexplained package? It could be a brushing scam,https://proton.me/blog/brushing-scam,6,2025-02-28 23:29:50+00:00
43213239,Selective chemical looping combustion of acetylene in ethylene-rich streams,https://www.science.org/doi/10.1126/science.ads3181,2,2025-02-28 23:29:31+00:00
43213226,Five essential strategies to master your habits,https://theconversation.com/five-essential-strategies-to-master-your-habits-250099,4,2025-02-28 23:28:37+00:00
43213215,AI Agents Friday Finds,https://sebgnotes.substack.com/p/friday-finds-post-2025-02-28,1,2025-02-28 23:27:53+00:00
43213167,Ask HN: Replacement for Rackspace SMTP Hosting?,,42,2025-02-28 23:23:56+00:00
43213157,Serbian student's Android phone compromised by exploit from Cellebrite,https://arstechnica.com/security/2025/02/android-0-day-sold-by-cellebrite-exploited-to-hack-serbian-students-phone/,5,2025-02-28 23:23:00+00:00
43213143,Inheriting is becoming nearly as important as working,https://www.economist.com/leaders/2025/02/27/inheriting-is-becoming-nearly-as-important-as-working,678,2025-02-28 23:20:38+00:00
43213090,Show HN: Torii – a framework agnostic authentication library for Rust,https://github.com/cmackenzie1/torii-rs,80,2025-02-28 23:16:16+00:00
43213042,Ask HN: Which Search Engine do you use?,,5,2025-02-28 23:12:47+00:00
43212952,Why it's so hard to build a jet engine,https://www.construction-physics.com/p/why-its-so-hard-to-build-a-jet-engine,444,2025-02-28 23:05:21+00:00
43212940,Ask HN: How do you feel now about your Tesla purchase?,,18,2025-02-28 23:04:08+00:00
43212843,Directness and Liveness in Morphic (1995) [pdf],https://worrydream.com/refs/Maloney_1995_-_Directness_and_Liveness_in_Morphic.pdf,1,2025-02-28 22:54:31+00:00
43212833,Startup co-founded by longevity guru Peter Attia emerges from stealth,https://techcrunch.com/2025/02/28/startup-co-founded-by-longevity-guru-peter-attia-emerges-from-stealth/,3,2025-02-28 22:53:54+00:00
43212725,Ask HN: Why aren't LLMs used for email spam detection?,,2,2025-02-28 22:45:35+00:00
43212707,iOS Performance tips you probably didn't know from an ex-Apple engineer (2020),https://www.fadel.io/blog/posts/ios-performance-tips-you-probably-didnt-know,4,2025-02-28 22:43:50+00:00
43212700,Political Bias on X before the 2025 German Federal Election,https://www.ucd.ie/cs/news/politicalbiasonxbeforethe2025germanfederalelection/,42,2025-02-28 22:43:14+00:00
43212695,"The Firefox ""Terms of Use"" Backlash Threatens to Destroy What's Left of Mozilla [video]",https://www.youtube.com/watch?v=gc8rvV8DDmQ,6,2025-02-28 22:42:57+00:00
43212689,Show HN: I Built a Search Engine for the Small Web – No SEO Spam,,2,2025-02-28 22:42:41+00:00
43212684,Dockerfile Optimizer: improve your Docker files with AI assistance,https://github.com/dagger/agents/tree/main/dockerfile-optimizer,2,2025-02-28 22:42:28+00:00
43212675,Show HN: I rolled my own PostgreSQL Monitoring Solution in 3 hours,,1,2025-02-28 22:41:35+00:00
43212656,Intellectual Property,https://www.s3neschal.com/posts/intellectual-property/,1,2025-02-28 22:39:33+00:00
43212652,CHIPS Act expected to be killed after mass firings of NIST employees this week,https://www.tweaktown.com/news/103522/chips-act-expected-to-be-killed-after-mass-firings-of-nist-employees-this-week/index.html,6,2025-02-28 22:39:25+00:00
43212613,Show HN: Tracking President Trump's Executive Orders,https://tonygaeta.com/labs/executive-orders,2,2025-02-28 22:35:17+00:00
43212586,Refactoring won't save you from a layoff,https://www.seangoedecke.com/where-the-money-comes-from/,3,2025-02-28 22:33:35+00:00
43212574,Hide your strength and bide your time,https://rochemamabolo.wordpress.com/2023/04/05/hide-your-strength-and-bide-your-time/,2,2025-02-28 22:32:06+00:00
43212567,Preventing race conditions: My experience with LockManager in JavaScript,https://medium.com/@volodymyrpotiichuk/preventing-race-conditions-my-experience-with-lockmanager-in-javascript-b5b15510e642,1,2025-02-28 22:31:32+00:00
43212556,Om Malik – Skype Is Dead. What Happened?,https://om.co/2025/02/28/skype-is-dead-what-happened/,3,2025-02-28 22:31:02+00:00
43212535,"UK FPGA Conference – October, London",https://www.fpgahorizons.com/,4,2025-02-28 22:29:26+00:00
43212532,We built an AI-native EHR that's free for solo physicians,https://medroid.ai/,2,2025-02-28 22:29:19+00:00
43212499,Active Agent 0.2: Making Ruby and Rails the Best Choice for AI Development,https://www.activeagents.ai/blog/active-agent-0-2-release-making-ruby-rails-the-best-choice-for-ai-development,2,2025-02-28 22:27:12+00:00
43212496,'The flying bum': can a UK firm making airships get off the ground?,https://www.theguardian.com/business/2025/feb/24/the-flying-bum-uk-firm-airships-airlander-hav,2,2025-02-28 22:27:03+00:00
43212485,"Does the moon look ""upside down"" in the southern hemisphere?",https://www.sciencefocus.com/science/does-the-moon-look-upside-down-in-the-southern-hemisphere,3,2025-02-28 22:26:05+00:00
43212445,"AI as the engine, humans as the steering wheel",https://vitalik.eth.limo/general/2025/02/28/aihumans.html,1,2025-02-28 22:23:16+00:00
43212427,Data Engineering Sucks,https://bitsonfire.substack.com/p/working-as-a-data-engineer-sucks,1,2025-02-28 22:22:17+00:00
43212379,Show HN: Find out if you qualify for an O-1 visa,https://o1pathways.com/,4,2025-02-28 22:19:27+00:00
43212362,Causal inference is not about methods,https://www.dataduets.com/2025/02/causal-inference-is-not-about-methods.html,1,2025-02-28 22:18:17+00:00
43212298,"Notorious Malware, Spam Host ""Prospero"" Moves to Kaspersky Lab",https://lemmy.sdf.org/post/30237884,2,2025-02-28 22:14:26+00:00
43212267,Explanation and Replica of the MingKwai Chinese Typewriter [video],https://www.youtube.com/watch?v=FR0RVluoim4,1,2025-02-28 22:11:55+00:00
43212250,"I made Dune in ASCII. Just like Star Wars ASCII, but with audio and color",https://twitter.com/AlexaKayman/status/1895587970453049609,1,2025-02-28 22:11:02+00:00
43212226,Jane Austen Used Pins to Edit Her Manuscripts:Before Word Processor and Wite-Out,https://www.openculture.com/2025/02/jane-austen-pins-to-edit-her-manuscripts.html,8,2025-02-28 22:10:02+00:00
43212188,US bill allowing AIs to prescribe FDA-approved drugs,https://www.congress.gov/bill/119th-congress/house-bill/238/text,32,2025-02-28 22:07:40+00:00
43212175,The Kafkaization of the Economy,https://brennancolberg.com/writing/kafka-economy,1,2025-02-28 22:07:11+00:00
43212151,"U.S. Faces Record Agricultural Imports, Worst Trade Deficit in History",https://prosperousamerica.org/u-s-faces-record-agricultural-imports-worst-trade-deficit-in-history/,4,2025-02-28 22:05:48+00:00
43212031,The trouble with seeing depression solely as a brain malfunction (2014),https://www.thenewatlantis.com/publications/the-neuroscience-of-despair,1,2025-02-28 21:59:15+00:00
43211997,"""Enough with All the Raft"" by Alex Miller",https://www.hytradboi.com/2025/2016d6c4-b08d-40b3-af2f-67926ca8521f-enough-with-all-the-raft,5,2025-02-28 21:57:22+00:00
43211977,I Hate the News (2006),http://www.aaronsw.com/weblog/hatethenews,3,2025-02-28 21:56:30+00:00
43211958,How to Deploy Kubernetes Clusters with Terraform: A Guide,https://release.com/blog/terraform-kubernetes-deployment-a-detailed-walkthrough,2,2025-02-28 21:55:12+00:00
43211944,Guilt Triggering AI,https://unslacker.com/,1,2025-02-28 21:54:12+00:00
43211925,Google's Sergey Brin: Engineers Should Work 60-Hour Weeks in Office to Build AI,https://gizmodo.com/googles-sergey-brin-says-engineers-should-work-60-hour-weeks-in-office-to-build-ai-that-could-replace-them-2000570025,73,2025-02-28 21:53:16+00:00
43211832,Heat as a Witness of Quantum Properties,https://arxiv.org/abs/2408.06418,2,2025-02-28 21:48:33+00:00
43211830,Auto CSS – Turn any web app into a mobile responsive app using AI,,1,2025-02-28 21:48:29+00:00
43211816,Building your startup – Basic Fintech stack,,1,2025-02-28 21:47:43+00:00
43211783,"Factory Pattern: Producing Objects, Pooling Resources",https://beyondthesyntax.substack.com/p/factory-pattern-producing-objects,1,2025-02-28 21:45:48+00:00
43211710,A fast revese linear scan register allocator for Cranelift,https://d-sonuga.netlify.app/gsoc/regalloc-iii/,1,2025-02-28 21:42:03+00:00
43211645,Tim O'Reilly – Ascending Levels of Nerd,https://www.oreilly.com/radar/ascending-levels-of-nerd/,1,2025-02-28 21:39:04+00:00
43211641,"AI ponders the ""fitness for office"" memo",https://hollisrobbinsanecdotal.substack.com/p/ai-ponders-the-fitness-for-office,2,2025-02-28 21:38:51+00:00
43211602,OpenAI plans to integrate Sora's video generator into ChatGPT,https://techcrunch.com/2025/02/28/openai-plans-to-integrate-soras-video-generator-into-chatgpt/,2,2025-02-28 21:37:12+00:00
43211557,Osteo-Odonto-Keratoprosthesis (OOKP),https://en.wikipedia.org/wiki/Osteo-odonto-keratoprosthesis,1,2025-02-28 21:35:42+00:00
43211506,Brian Krebs: This Administration Is Completely Compromised,https://infosec.exchange/@briankrebs/114083485241630234,170,2025-02-28 21:33:00+00:00
43211497,Building an ISS Distance Tracker in NextJS,https://www.youtube.com/watch?v=5fTEAWFWkuE,1,2025-02-28 21:32:16+00:00
43211468,Yope is sparking GenZ interest with an Instagram-like app for private groups,https://techcrunch.com/2025/02/24/yope-is-sparking-genz-and-vc-interest-with-an-instagram-like-app-for-private-groups/,3,2025-02-28 21:30:42+00:00
43211463,Sentinel-2 Explorer: another level of Earth observation,https://www.esri.com/arcgis-blog/products/arcgis-living-atlas/imagery/sentinel-2-explorer-another-level-of-earth-observation/,1,2025-02-28 21:30:37+00:00
43211455,Ep 180: Stephen Kotkin on Endgames in Ukraine,https://www.youtube.com/watch?v=-qKXJoeDw6A,2,2025-02-28 21:30:08+00:00
43211448,SVG Arena: Like Lmsys Chatbot Arena but for SVGs,https://svgarena.ai/,1,2025-02-28 21:29:56+00:00
43211444,Response to Teammate App's Notification and Disclosure,https://jltee.substack.com/p/response-to-teammate-apps-notification-and-disclosure,3,2025-02-28 21:29:39+00:00
43211433,VSCode extensions with 9M installs pulled over security risks,https://www.bleepingcomputer.com/news/security/vscode-extensions-with-9-million-installs-pulled-over-security-risks/,16,2025-02-28 21:29:22+00:00
43211399,Crossing the uncanny valley of conversational voice,https://www.sesame.com/research/crossing_the_uncanny_valley_of_voice,3,2025-02-28 21:27:45+00:00
43211350,Android phone could have stalkerware,https://techcrunch.com/2025/02/20/remove-android-spyware/,1,2025-02-28 21:25:55+00:00
43211331,"JD Vance says Big Tech has ""too much power""",https://www.cbsnews.com/news/jd-vance-interview-big-tech-too-much-power/,7,2025-02-28 21:25:17+00:00
43211311,Gajim 2.0.0,https://gajim.org/post/2025-02-28-gajim-2.0.0-released/,4,2025-02-28 21:24:41+00:00
43211296,Chris Hedges: Full Speech at Workers Strike Back Conference,https://chrishedges.substack.com/p/chris-hedges-full-speech-at-workers,1,2025-02-28 21:23:54+00:00
43211235,Binary Neutron Star Mergers as the Source of the Highest Energy Cosmic Rays,https://www.nyu.edu/about/news-publications/news/2025/february/how-do-the-universe-s-highest-energy-particles-originate--magnet.html,1,2025-02-28 21:21:16+00:00
43211159,Kmtricks: Efficient Bloom filters for large sequencing data collections,https://github.com/tlemane/kmtricks,2,2025-02-28 21:17:36+00:00
43211153,Ask HN: Recent unemployed CS grad what do I do?,,2,2025-02-28 21:17:26+00:00
43211120,RA.Aid's Journey: From Leveraging Aider to Autonomous Editing,https://christianson.ai/posts/raaid-journey/,1,2025-02-28 21:16:28+00:00
43211101,Ohio One Construction Timeline Update,https://newsroom.intel.com/corporate/ohio-one-construction-timeline-update,90,2025-02-28 21:15:36+00:00
43211054,Landing Page Battle,https://twitter.com/BrettFromDJ/status/1895548716528062828,2,2025-02-28 21:13:47+00:00
43211053,gguser – A Simple CLI to Manage Multiple Git Profiles,,1,2025-02-28 21:13:46+00:00
43211000,US Intel shows Russia and China trying to recruit disgruntled federal employees,https://www.cnn.com/2025/02/28/politics/us-intel-russia-china-attempt-recruit-disgruntled-federal-employees/index.html,32,2025-02-28 21:11:55+00:00
43210935,"Windows 11 Arm VMs on a Raspberry Pi, with BVM",https://www.jeffgeerling.com/blog/2025/windows-11-arm-vms-on-raspberry-pi-bvm,2,2025-02-28 21:09:03+00:00
43210889,"Mass firings at National Weather Service, NOAA ignite fury among scientists",https://www.latimes.com/california/story/2025-02-27/mass-firings-noaa-national-weather-service-ignite-fury,17,2025-02-28 21:07:12+00:00
43210884,"Ukraine's $500B rare earths scam:they don't exist, and we should know [video]",https://www.youtube.com/watch?v=tILXLxMTmgA,7,2025-02-28 21:06:46+00:00
43210858,How to gain code execution on hundreds of millions of people and popular apps,https://kibty.town/blog/todesktop/,1156,2025-02-28 21:05:35+00:00
43210842,Citigroup credited client's account with $81T,https://www.theguardian.com/business/2025/feb/28/citigroup-credited-client-account-with-81tn-before-error-spotted,13,2025-02-28 21:04:49+00:00
43210837,Meta - Introducing Aria Gen 2,https://www.youtube.com/watch?v=GjZo2On_oOI,2,2025-02-28 21:04:43+00:00
43210804,Wayback Machine Saves Federal Webpages Amid Purge of Government Data Under Trump,https://www.democracynow.org/2025/2/28/internet_archive_trump_admin_data_purge,2,2025-02-28 21:03:29+00:00
43210735,ChessAnalyzer.site – Analyze Chess.com Games with Stockfish 17 (Depth 18),https://chessanalyzer.site/,1,2025-02-28 21:00:28+00:00
43210713,Three Mile Island restart project 'ahead of schedule',https://world-nuclear-news.org/articles/us-reactor-restart-project-ahead-of-schedule,1,2025-02-28 20:59:21+00:00
43210710,A Few of the Birds I Love,https://moultano.wordpress.com/2024/05/03/a-few-of-the-birds-i-love/,101,2025-02-28 20:59:07+00:00
43210701,Intel delays its Ohio chip factory to 2030,https://techcrunch.com/2025/02/28/intel-delays-its-ohio-chip-factory-to-2030/,2,2025-02-28 20:58:50+00:00
43210695,AI Changes Developers (and the Code They Write),https://www.forbes.com/councils/forbestechcouncil/2025/02/25/how-ai-changes-developers-and-the-code-they-write/,2,2025-02-28 20:58:35+00:00
43210692,"Zurich, Schaumburg settle $20M remote work dispute",https://therealdeal.com/chicago/2025/02/28/zurich-settles-tax-incentive-suit-with-schaumburg-over-remote-work/,2,2025-02-28 20:58:33+00:00
43210668,Passing the Buck: The story of the 2022 Wings Over Dallas air show collision,https://admiralcloudberg.medium.com/passing-the-buck-the-story-of-the-2022-wings-over-dallas-air-show-collision-9bbe5947297b,5,2025-02-28 20:57:19+00:00
43210659,Educational Obsolescence: Revolutionizing Learning with AI,https://zackkass.substack.com/p/educational-obsolescence-revolutionizing,2,2025-02-28 20:56:52+00:00
43210649,A Comprehensive Survey on Concept Erasure in Text-to-Image Diffusion Models,https://arxiv.org/abs/2502.14896,2,2025-02-28 20:56:28+00:00
43210626,Seaofus.com,,1,2025-02-28 20:55:43+00:00
43210599,Show HN: C_ Dialect,https://github.com/cHaR-shinigami/c_,1,2025-02-28 20:54:31+00:00
43210569,"""No, we are absolutely not prepared to [fork Firefox]""",https://codeberg.org/librewolf/issues/issues/2252#issuecomment-2886286,65,2025-02-28 20:52:55+00:00
43210563,Citigroup Makes (and Then Fixes) an $81T Mistake,https://www.nytimes.com/2025/02/28/nyregion/citigroup-81-trillion-error.html,7,2025-02-28 20:52:37+00:00
43210537,Japanese Toshiba Typewriter Model BW-2112 (2020) [video],https://www.youtube.com/watch?v=JZcui85b4EE,98,2025-02-28 20:51:34+00:00
43210536,400 reasons to not use Microsoft Azure,https://azsh.it,703,2025-02-28 20:51:34+00:00
43210414,"Death Drives in the Aleph: cloud storage, rental cars, & infinity",https://www.onshoreleave.com/posts/death-drives/,2,2025-02-28 20:45:08+00:00
43210382,How Not to Launch on Hacker News,https://threekindwords.com/blog/how-not-to-launch-on-hackernews/,15,2025-02-28 20:43:26+00:00
43210344,Is Math a Science? (1996),https://web.archive.org/web/20230607134613/http://euclid.trentu.ca/math/sb/misc/mathsci.html,1,2025-02-28 20:41:05+00:00
43210294,PSA: Google Workspace users now have access to Deep Research,,1,2025-02-28 20:38:59+00:00
43210255,I solved the task with Claude 3.7 and got rejected by an AI startup,,6,2025-02-28 20:37:08+00:00
43210244,Development of Robotic Device That Performs Head Bunting to Relieve User Tension,https://dl.acm.org/doi/10.1145/3700600,2,2025-02-28 20:36:34+00:00
43210235,WSJ: 'Inside DOGE's Clash with the Federal Workforce',https://www.msn.com/en-us/money/companies/inside-doge-s-clash-with-the-federal-workforce/ar-AA1zX27g,10,2025-02-28 20:36:11+00:00
43210218,A quick ramp-up on ramping up quickly in SpiderMonkey,https://www.hytradboi.com/2025/0a4d08fd-149e-4174-a752-20e9c4d965c5-a-quick-ramp-up-on-ramping-up-quickly,3,2025-02-28 20:35:06+00:00
43210202,State Department terminates U.S. Aid in Ukraine energy grid restoration,https://www.nbcnews.com/politics/state-department-terminates-us-support-ukraine-energy-grid-restoration-rcna194259,14,2025-02-28 20:34:39+00:00
43210185,Show HN: Betting game puzzle (Hamming neighbor sum in linear time),,56,2025-02-28 20:33:43+00:00
43210172,Search images like text using Vision Language Models,https://github.com/StarlightSearch/handwritten-search,2,2025-02-28 20:33:17+00:00
43210169,Boss Wants You Back in the Office. This Surveillance Tech Could Be Waiting,https://www.wired.com/story/your-boss-wants-you-back-in-the-office-this-surveillance-tech-could-be-waiting-for-you/,16,2025-02-28 20:33:09+00:00
43210138,Hegseth orders Cyber Command to stand down on Russia planning,https://therecord.media/hegseth-orders-cyber-command-stand-down-russia-planning,76,2025-02-28 20:31:20+00:00
43210114,I created an MVP for an AI SVG maker in a week! Check it out!,https://easysvg.ai,15,2025-02-28 20:30:07+00:00
43210023,"Firefox deletes promise to never sell personal data, asks users not to panic",https://arstechnica.com/tech-policy/2025/02/firefox-deletes-promise-to-never-sell-personal-data-asks-users-not-to-panic/,19,2025-02-28 20:24:50+00:00
43209957,Microsoft is finally shutting down Skype in May,https://www.xda-developers.com/microsoft-killing-skype/,2,2025-02-28 20:20:50+00:00
43209947,Nested Perfect Arrays,https://icc.fcen.uba.ar/nested-perfect-arrays/,1,2025-02-28 20:20:12+00:00
43209919,How to solve reference error during VS Code Setup for cpp?,,1,2025-02-28 20:18:51+00:00
43209903,Trump administration retreats in fight against Russian cyber threats,https://www.theguardian.com/us-news/2025/feb/28/trump-russia-hacking-cyber-security,38,2025-02-28 20:17:25+00:00
43209887,What Would a Martian Calendar Would Look Like?,https://www.johndcook.com/blog/2025/02/28/a-calendar-for-mars/,3,2025-02-28 20:16:35+00:00
43209881,NASA sends experiment to space to study antibiotic-resistant bacteria,https://phys.org/news/2025-02-nasa-space-antibiotic-resistant-bacteria.html,2,2025-02-28 20:16:12+00:00
43209878,"Notorious Malware, Spam Host ""Prospero"" Moves to Kaspersky Lab",https://krebsonsecurity.com/2025/02/notorious-malware-spam-host-prospero-moves-to-kaspersky-lab/,69,2025-02-28 20:15:51+00:00
43209863,Why China's Xiaomi Can Make an Electric Car and Apple Can't,https://www.nytimes.com/2025/02/28/business/china-xiaomi-apple-electric-cars.html,9,2025-02-28 20:15:02+00:00
43209860,Ubuntu Releases,https://wiki.ubuntu.com/Releases,1,2025-02-28 20:14:50+00:00
43209832,Claude Artifacts Games,https://claudeartifacts.com/?category=Game,2,2025-02-28 20:13:12+00:00
43209823,Show HN: I Built Hashtini – Turn Hashtags into Shareable Landing Pages,,1,2025-02-28 20:12:30+00:00
43209784,AK HN: Is the Era of Hackers/Startups Over?,,11,2025-02-28 20:09:49+00:00
43209768,Ask HN: Firefox may be selling our data. Can you recommend an alternative?,,19,2025-02-28 20:08:38+00:00
43209750,A new study identifies differences between human and AI-generated text,https://www.cmu.edu/dietrich/news/news-stories/2025/february/large-language-models-writing-text.html,2,2025-02-28 20:06:58+00:00
43209726,Can LLMs play real-time games like supermario (other than Pokemon red)?,https://twitter.com/haoailab/status/1895557913621795076,3,2025-02-28 20:04:27+00:00
43209718,Programming Without Pointers,https://www.hytradboi.com/2025/05c72e39-c07e-41bc-ac40-85e8308f2917-programming-without-pointers,8,2025-02-28 20:04:04+00:00
43209683,Two AIs Realize They Are Not Talking to Humans and Switch to Their Own Language,https://www.iflscience.com/watch-two-ais-realize-they-are-not-talking-to-humans-and-switch-to-their-own-language-78213,6,2025-02-28 20:01:11+00:00
43209657,Kinds of Leadership,https://somic.substack.com/p/kinds-of-leadership,3,2025-02-28 19:58:45+00:00
43209652,delete,https://medtour.help/primenenie-antidepressantov-svyazano-so-stojkoj-poterej-chuvstvitelnosti-genitalij/,5,2025-02-28 19:58:24+00:00
43209650,What stack do services like Netlify and Vercel use to implement their FaaS?,,1,2025-02-28 19:58:14+00:00
43209639,Video processing pipeline for LLM – Python,https://github.com/Wearer-Lab/transfer-learning,1,2025-02-28 19:57:11+00:00
43209635,Imagus – Browser extension for previewing images/video on mouse hover,https://chromewebstore.google.com/detail/imagus/immpkjjlgappgfkkfieppnmlhakdmaab,2,2025-02-28 19:56:23+00:00
43209627,Show HN: 3D printed 10 DoF robotic hand,https://www.youtube.com/watch?v=_asrXjhP0LA,1,2025-02-28 19:55:53+00:00
43209624,A quicklook plugin for MKV (none too soon),https://github.com/Oil3/Mkv-Quicklook,1,2025-02-28 19:55:42+00:00
43209622,"Removed – Mozilla doesn't sell data about you, and we don't buy data about you",https://guptadeepak.com/mozillas-data-practices-and-privacy-evolution-recent-developments/,4,2025-02-28 19:55:34+00:00
43209619,Voice Chat with Claude,https://claudewrappers.com,1,2025-02-28 19:55:19+00:00
43209583,"FuxiCTR: Configurable, tunable, and reproducible library for CTR prediction",https://github.com/reczoo/FuxiCTR,1,2025-02-28 19:52:06+00:00
43209497,"Ransomware criminals love CISA's KEV list – and that's a bug, not a feature",https://www.theregister.com/2025/02/28/cisa_kev_list_ransomware/,3,2025-02-28 19:43:39+00:00
43209492,TypeScript 5.8,https://devblogs.microsoft.com/typescript/announcing-typescript-5-8/,2,2025-02-28 19:42:56+00:00
43209474,"Ukraine 'gambling with world war three', Trump tells Zelenskyy in fiery meeting",https://www.theguardian.com/us-news/2025/feb/28/trump-zelenskyy-meeting-ukraine-aid-war,22,2025-02-28 19:41:07+00:00
43209471,What are you doing to prepare your data is ready for GenAI?,,3,2025-02-28 19:40:50+00:00
43209428,Ask HN: Works Related to Task Decomposition?,,3,2025-02-28 19:36:42+00:00
43209424,PeopleForBikes and REI Co-Op Launch Tool to Expand Access to Bicycling Across US,https://www.rei.com/newsroom/article/peopleforbikes-and-rei-co-op-launch-groundbreaking-new-tool-to-expand-access-to-recreational-bicycling-across-the-u-s-,3,2025-02-28 19:36:09+00:00
