id,title,url,points,created_at
43207331,Medical treatments devised for war can quickly be implemented in US hospitals,https://theconversation.com/how-medical-treatments-devised-for-war-can-quickly-be-implemented-in-us-hospitals-to-save-lives-247752,30,2025-02-28 16:18:34+00:00
43207321,Everything-Except-Book Review Contest 2025,https://www.astralcodexten.com/p/everything-except-book-review-contest,1,2025-02-28 16:17:51+00:00
43207310,Fog harvesting could provide water for arid cities,https://www.bbc.com/news/articles/cvgw3l7p79po,2,2025-02-28 16:16:50+00:00
43207305,The Free-Market Welfare State: Preserving Dynamism in a Volatile World [pdf],https://www.niskanencenter.org/wp-content/uploads/old_uploads/2018/04/Final_Free-Market-Welfare-State.pdf,1,2025-02-28 16:16:31+00:00
43207297,GPT-4.5 Multimodal and Vision Analysis,https://blog.roboflow.com/gpt-4-5-multimodal/,2,2025-02-28 16:15:59+00:00
43207261,Ask HN: Skype alternative?,,4,2025-02-28 16:14:02+00:00
43207197,"Redis 8.0-M3 Brings Async I/O Threading, 12x Speed-Up with New AVX2 Code Path",https://www.phoronix.com/news/Redis-8.0-M3-Async-IO-Threads,7,2025-02-28 16:08:14+00:00
43207191,A Cornucopia of Takes,https://99d.substack.com/p/a-cornucopia-of-takes,1,2025-02-28 16:07:51+00:00
43207171,Misusing police database now over half of all cybercrime prosecutions in the UK [pdf],https://www.cl.cam.ac.uk/~ah793/papers/2025police.pdf,26,2025-02-28 16:06:29+00:00
43207169,Mozilla deletes promise not to sell Firefox users' data,https://www.osnews.com/story/141825/mozilla-deletes-promise-not-to-sell-firefox-users-data/,7,2025-02-28 16:06:24+00:00
43207162,Ask HN: How Did You Get Your Startup's First 1k Users?,,1,2025-02-28 16:05:44+00:00
43207157,"Mass firings across NOAA, National Weather Service ignite fury from scientists",https://www.tampabay.com/news/weather/2025/02/28/noaa-job-cuts-elon-musk-government-efficiency/,14,2025-02-28 16:05:09+00:00
43207153,I'm starting to suspect my work is incompatible with a full-time academic job,https://www.humprog.org/~stephen/blog/2025/02/28/#the-mess-im-in,75,2025-02-28 16:04:59+00:00
43207135,Show HN: Chicory – JSX that removes footguns and adds guardrails,https://github.com/chicory-lang/chicory,1,2025-02-28 16:03:40+00:00
43207118,OpenSSF Launches Open Source Project Security Baseline to Strengthen Software,https://socket.dev/blog/openssf-launches-open-source-project-security-baseline,3,2025-02-28 16:02:17+00:00
43207093,A Mary Meeker/Ben Evans-style presentation on kids,https://www.superawesome.com/alpha-impact-how-kids-are-shaping-media-tech-commerce/,1,2025-02-28 16:00:02+00:00
43207078,Farmers sue over purge of climate data needed for agricultural decisions,https://thehill.com/policy/energy-environment/5163917-usda-climate-data-lawsuit/amp/,43,2025-02-28 15:58:35+00:00
43207040,Imec demonstrates electrical yield for 20nm lines High NA EUV single patterning,https://www.imec-int.com/en/press/imec-demonstrates-electrical-yield-20nm-pitch-metal-lines-obtained-high-na-euv-single,31,2025-02-28 15:55:11+00:00
43207037,PhantomWiki: On-Demand Datasets for Reasoning and Retrieval Evaluation,https://arxiv.org/abs/2502.20377,1,2025-02-28 15:55:02+00:00
43207003,Elon Musk Executed His Takeover of the Federal Bureaucracy,https://www.nytimes.com/2025/02/28/us/politics/musk-federal-bureaucracy-takeover.html,22,2025-02-28 15:52:19+00:00
43207002,Cofounder of Airbnb is joining DOGE,https://www.businessinsider.com/airbnb-cofounder-apply-designer-brain-start-up-spirit-doge-2025-2,5,2025-02-28 15:52:15+00:00
43206972,The Robot Doctor Will See You Now,https://www.nytimes.com/2025/02/02/opinion/ai-doctors-medicine.html,1,2025-02-28 15:49:55+00:00
43206964,DuckDB goes distributed? DeepSeek's smallpond takes on Big Data,https://mehdio.substack.com/p/duckdb-goes-distributed-deepseeks,7,2025-02-28 15:49:18+00:00
43206957,The NetBSD Participate in Google Summer of Code 2025,https://blog.netbsd.org/tnf/entry/gsoc2025_tnf,3,2025-02-28 15:48:53+00:00
43206947,"Microsoft hangs up on Skype: service to shut down May 5, 2025",https://techcrunch.com/2025/02/28/microsoft-hangs-up-on-skype-service-to-shut-down-may-5-2025/,2,2025-02-28 15:48:11+00:00
43206934,Profit slide at HP can only mean one thing: Hammer time,https://www.theregister.com/2025/02/28/hp_cuts_jobs_as_profits_slide/,2,2025-02-28 15:47:09+00:00
43206929,The Biggest AI for Biology yet Writes Genomes from Scratch,https://singularityhub.com/2025/02/27/the-biggest-ai-for-biology-yet-writes-genomes-from-scratch/,1,2025-02-28 15:46:54+00:00
43206928,Welcome to Robot City,https://www.technologyreview.com/2025/02/26/1111796/robotics-robots-denmark-odense-collaboration/,1,2025-02-28 15:46:36+00:00
43206923,"Sneaky bamboo can control the genes of the Pandas eating it, scientists discover",https://www.livescience.com/animals/sneaky-bamboo-can-control-the-genes-of-the-pandas-eating-it-scientists-discover,9,2025-02-28 15:46:28+00:00
43206908,Machine Learning About Venture Capital Choices,https://papers.ssrn.com/sol3/papers.cfm?abstract_id=4035930,1,2025-02-28 15:45:35+00:00
43206885,Pi Network's Token Debuts at $195B Value Despite Minimal Liquidity,https://www.coindesk.com/business/2025/02/20/pi-network-s-token-debuts-at-usd195b-fdv-despite-minimal-liquidity,2,2025-02-28 15:44:20+00:00
43206865,Ask HN: Can I Post Train my own LLM?,,1,2025-02-28 15:43:06+00:00
43206843,Normalcy bias: it's not cool to overreact,https://www.okdoomer.io/its-not-cool-to-overreact/,1,2025-02-28 15:42:02+00:00
43206842,Videogaming's All-In Bet: Can Two Titans Lift a $58B Industry?,https://www.wsj.com/business/media/videogamings-all-in-bet-can-two-titans-lift-a-58-billion-industry-5b38dea1,1,2025-02-28 15:41:58+00:00
43206826,The Collective Power of Ants,https://nautil.us/the-collective-power-of-ants-1193609/,1,2025-02-28 15:41:02+00:00
43206806,Side Project Saturday,https://sideprojectsaturday.com/,1,2025-02-28 15:40:05+00:00
43206779,Ask HN: Are there any objective measurements for AI model coding performance?,,2,2025-02-28 15:38:03+00:00
43206743,How to Build an AI Agent with N8n and Live Google Search Data,https://serpapi.com/blog/how-to-build-an-ai-agent-with-n8n-and-live-google-search-data/,3,2025-02-28 15:35:29+00:00
43206742,Show HN: Spatial App Builder,https://atlas.co/product/builder/,1,2025-02-28 15:35:28+00:00
43206722,"Violence alters human genes for generations, researchers discover",https://news.ufl.edu/2025/02/syrian-violence-epigenetics/,443,2025-02-28 15:33:39+00:00
43206719,Vercel API Major Outage,https://www.vercel-status.com,5,2025-02-28 15:33:18+00:00
43206696,The Bewildering Irony Behind the Trump-Musk Partnership,https://www.nytimes.com/2025/02/27/opinion/trump-musk-doge.html,7,2025-02-28 15:31:06+00:00
43206690,The Software Engineer Spectrum: Speed vs. Accuracy,https://benhowdle.im/software-engineer-spectrum.html,3,2025-02-28 15:30:20+00:00
43206689,Nvidia enjoys $130B annual earnings despite gaming segment 'supply constraints',https://www.tomshardware.com/pc-components/gpus/nvidia-enjoys-usd130b-annual-earnings-despite-gaming-segment-supply-constraints,1,2025-02-28 15:30:18+00:00
43206667,DOJ – Jeffrey Epstein's files [pdf],https://unusual-whales.ghost.io/content/files/2025/02/doj-jeffrey-epstein-files-released-2025-02-27.pdf,4,2025-02-28 15:28:26+00:00
43206652,Prediction: UK tech stock will outperform Lloyds shares over the next 5 years,https://www.fool.co.uk/2025/02/28/prediction-this-uk-tech-stock-will-outperform-lloyds-shares-over-the-next-5-years/,2,2025-02-28 15:26:51+00:00
43206642,An Interactive Guide to Database Sharding,https://planetscale.com/blog/database-sharding,1,2025-02-28 15:26:21+00:00
43206622,Another Conflict Between Privacy Laws and Age Authentication–Murphy v Confirm ID,https://blog.ericgoldman.org/archives/2025/02/another-conflict-between-privacy-laws-and-age-authentication-murphy-v-confirm-id.htm,117,2025-02-28 15:24:48+00:00
43206615,"Haasoscope Pro ― Affordable, High-Bandwidth, Real-Time Sampling USB Oscilloscope",https://www.crowdsupply.com/andy-haas/haasoscope-pro,1,2025-02-28 15:24:21+00:00
43206587,Manager Antipatterns (2024),https://blogs.newardassociates.com/blog/2024/management-antipatterns.html,1,2025-02-28 15:21:45+00:00
43206572,Trump to Sign Executive Order Making English Official U.S. Language,https://www.wsj.com/politics/policy/trump-executive-order-english-official-language-5c0b7665,12,2025-02-28 15:21:10+00:00
43206566,AI can't read your mind but iteration is expensive,https://blog.codeyam.com/p/ai-cant-read-your-mindbut-iteration,3,2025-02-28 15:20:37+00:00
43206562,Marvellous views of Moon captured by private lunar lander [video],https://www.bbc.com/news/videos/cge11x14py4o,2,2025-02-28 15:20:03+00:00
43206539,"'Economic Blackout', it's tapped into Americans' anger",https://www.cnn.com/2025/02/28/business/economic-blackout-february-28/index.html,1,2025-02-28 15:17:51+00:00
43206520,Skype announces it will close in May,https://www.bbc.co.uk/news/articles/cn7vxlrvxyeo,3,2025-02-28 15:15:54+00:00
43206517,Consumer Bureau Drops Lawsuit Against Capital One,https://www.nytimes.com/2025/02/27/business/cfpb-capital-one-lawsuit.html,6,2025-02-28 15:15:38+00:00
43206510,Scribe,https://elevenlabs.io/blog/meet-scribe,2,2025-02-28 15:15:21+00:00
43206495,The Uncertainty Principle in Software Development,https://www.neverbeclever.org/blog/the-uncertainty-principle-in-software-development/,1,2025-02-28 15:13:26+00:00
43206491,"AI is killing some companies, yet others are thriving – let's look at the data",https://www.elenaverna.com/p/ai-is-killing-some-companies-yet,276,2025-02-28 15:12:54+00:00
43206485,Why does the Apple's store/online-store interface suck so much?,,2,2025-02-28 15:12:27+00:00
43206481,Dominant individuals are more confident in their decisions but not more accurate,https://www.sciencedirect.com/science/article/pii/S0191886924004975,2,2025-02-28 15:12:07+00:00
43206467,Explore Chrome extensions – TikTok style,https://chrome-stats.com/videos,3,2025-02-28 15:11:11+00:00
43206458,Every Pod Eviction in Kubernetes,https://ahmet.im/blog/kubernetes-evictions/,2,2025-02-28 15:10:34+00:00
43206433,Meta in Talks to Raise $35B for Data-Center Financing Led by Apollo,https://www.bloomberg.com/news/articles/2025-02-27/meta-in-talks-to-raise-35-billion-for-data-center-financing-led-by-apollo,2,2025-02-28 15:07:56+00:00
43206425,AI Solves Million-Step Math Problems,https://spectrum.ieee.org/math-ai,1,2025-02-28 15:07:07+00:00
43206423,Flower: A Friendly Federated AI Framework,https://github.com/adap/flower,2,2025-02-28 15:06:58+00:00
43206420,Ancient Vesuvius victim's brain contains first natural organic glass ever seen,https://www.chemistryworld.com/news/ancient-vesuvius-victims-brain-contains-first-natural-organic-glass-ever-seen/4021072.article,3,2025-02-28 15:06:51+00:00
43206417,Kaspersky exposes hidden malware on GitHub stealing personal data,https://www.kaspersky.com/about/press-releases/kaspersky-exposes-hidden-malware-on-github-stealing-personal-data-and-485000-in-bitcoin,175,2025-02-28 15:06:50+00:00
43206385,An Experimental Study of Bitmap Compression vs. Inverted List Compression,https://dl.acm.org/doi/10.1145/3035918.3064007,32,2025-02-28 15:04:43+00:00
43206345,Pure Independence,https://collabfund.com/blog/pure-independence/,1,2025-02-28 15:01:44+00:00
43206342,Show HN: IconigAI - Create Lifelike AI Influencers in Minutes,https://iconigai.com/,1,2025-02-28 15:01:28+00:00
43206340,Visual programming is stuck on the form,https://interjectedfuture.com/visual-programming-is-stuck-on-the-form/,3,2025-02-28 15:01:23+00:00
43206316,"The R-squared on this is kinda low, no?",https://statmodeling.stat.columbia.edu/2025/02/28/the-r-squared-on-this-is-kinda-low-no/,3,2025-02-28 14:59:22+00:00
43206298,Corporations dig deeper: using bunkers to secure data (and their CEOs),https://www.semafor.com/article/02/20/2025/corporations-dig-deeper-using-bunkers-to-secure-data,10,2025-02-28 14:58:14+00:00
43206252,Modern DDoS Threats and Countermeasures,https://arxiv.org/abs/2502.19996,1,2025-02-28 14:53:49+00:00
43206222,An Incident Review of an Incident Review – Will Gallego,https://willgallego.com/2025/01/11/an-incident-review-of-an-incident-review/,3,2025-02-28 14:51:10+00:00
43206220,What's the most bizarre root cause you've ever seen?: R/SRE,https://old.reddit.com/r/sre/comments/1i0aq6j/whats_the_most_bizarre_root_cause_youve_ever_seen/,2,2025-02-28 14:51:03+00:00
43206210,Building a coded and operational copilot: a hands-on guide with Pieces,https://pieces.app/blog/how-to-build-a-copilot,3,2025-02-28 14:49:31+00:00
43206209,Skype to Shut 14 Years After Microsoft's $8.5B Purchase,https://www.bloomberg.com/news/articles/2025-02-28/microsoft-msft-to-shut-down-skype-as-zoom-teams-dominate-video-calls,3,2025-02-28 14:49:23+00:00
43206197,Release Notes for Safari Technology Preview 214,https://webkit.org/blog/16512/release-notes-for-safari-technology-preview-214/,1,2025-02-28 14:47:20+00:00
43206189,Books That Change Trajectories,https://theaiunderwriter.substack.com/p/books-that-change-trajectories,3,2025-02-28 14:46:55+00:00
43206174,Write to Escape Your Default Setting,https://kupajo.com/write-to-escape-your-default-setting/,407,2025-02-28 14:45:36+00:00
43206164,Software Experiences Podcast (Proiex),https://www.youtube.com/channel/UCjQgGMF32NNvhPvXLmBct5w,1,2025-02-28 14:45:03+00:00
43206147,We're All Just Looking for Connection – Engineering at Slack,https://slack.engineering/were-all-just-looking-for-connection/,1,2025-02-28 14:43:36+00:00
43206126,"How we evolve our code: Notion's ""ratcheting"" system using custom ESLint rules",https://www.notion.com/blog/how-we-evolved-our-code-notions-ratcheting-system-using-custom-eslint-rules,2,2025-02-28 14:41:22+00:00
43206117,AMD Radeon RX 9070 Series Technical Deep Dive,https://www.techpowerup.com/review/amd-radeon-rx-9070-series-technical-deep-dive/,11,2025-02-28 14:40:23+00:00
43206083,Let's Hold Hands,https://untested.sonnet.io/notes/lets-hold-hands/,2,2025-02-28 14:37:37+00:00
43206075,New Financial AI Tool Competing with Bloomberg,https://www.youtube.com/watch?v=qxJCTxq5frI,2,2025-02-28 14:36:22+00:00
43206059,A Solution of the Kakeya Conjecture,https://arxiv.org/abs/2502.17655,2,2025-02-28 14:34:55+00:00
43206054,Links for February 2025,https://www.astralcodexten.com/p/links-for-february-2025,1,2025-02-28 14:34:41+00:00
43206044,Show HN: EmailHunter is a minimalistic Ruby wrapper for the Hunter.io API,https://github.com/davidesantangelo/emailhunter,2,2025-02-28 14:33:52+00:00
43206032,Geometric Algebra Books,https://terathon.com/blog/ga-books.html,3,2025-02-28 14:32:58+00:00
43205987,The atypical proteome of mitochondria from mature pollen grains,https://www.sciencedirect.com/science/article/pii/S0960982224017056,2,2025-02-28 14:29:50+00:00
43205979,Code Reviews,https://hfitz.substack.com/p/on-code-reviews,1,2025-02-28 14:29:17+00:00
43205968,Reimagining Fluid Typography,https://www.oddbird.net/2025/02/12/fluid-type/,68,2025-02-28 14:28:26+00:00
43205962,AWS cloudwatch down us-east-1,https://us-east-1.console.aws.amazon.com/cloudwatch/home?region=us-east-1#,2,2025-02-28 14:27:44+00:00
43205941,Sail Simulator on Browser,https://nmanzini.github.io/sail/,4,2025-02-28 14:26:07+00:00
43205932,Getting Caddy Logs into ClickHouse via Vector,https://scottstuff.net/posts/2025/02/27/caddy-logs-in-clickhouse-via-vector/,3,2025-02-28 14:25:34+00:00
43205914,Cloudflare Agents,https://developers.cloudflare.com/agents/,22,2025-02-28 14:23:34+00:00
43205909,"541,000 paid driverless Waymo rides in California last month",https://twitter.com/natbullard/status/1895015814715027783,5,2025-02-28 14:23:07+00:00
43205891,AdGuard launches nightly version of first Linux ad blocker,https://adguard.com/en/blog/adguard-for-linux-nightly.html,2,2025-02-28 14:22:02+00:00
43205863,"Hydrogen becomes a superfluid at nanoscale, confirming 50-year-old prediction",https://phys.org/news/2025-02-hydrogen-superfluid-nanoscale-year.html,45,2025-02-28 14:19:05+00:00
43205852,Model Context Protocol vs. Programmatic Workflows,https://apichangelog.substack.com/p/model-context-protocol-vs-programmatic-workflows,2,2025-02-28 14:18:05+00:00
43205841,Michigan TypeScript Founder Successfully Runs Doom Inside TypeScript's Type,https://socket.dev/blog/typescript-types-running-doom,2,2025-02-28 14:17:11+00:00
43205833,Microsoft is shutting down Skype in favor of Teams,https://www.theverge.com/news/621353/microsoft-skype-shutting-down-retirement-may-2025,31,2025-02-28 14:16:22+00:00
43205827,Scientists discover low-cost way to trap carbon using common rocks,https://news.stanford.edu/stories/2025/02/new-process-gets-common-rocks-to-trap-carbon-rapidly-cheaply,2,2025-02-28 14:15:49+00:00
43205792,Skill dependencies uncover nested human capital,https://www.nature.com/articles/s41562-024-02093-2,3,2025-02-28 14:12:14+00:00
43205783,Canvas Fingerprinting in the Wild,https://blog.castle.io/canvas-fingerprinting-in-the-wild/,3,2025-02-28 14:11:10+00:00
43205762,NixOS Amazon Images / Amis,https://nixos.github.io/amis/,1,2025-02-28 14:09:28+00:00
43205755,Towards an AI Co-Scientist,https://arxiv.org/abs/2502.18864,47,2025-02-28 14:09:19+00:00
43205730,14 Years of Systemd,https://lwn.net/Articles/1008721/,3,2025-02-28 14:07:21+00:00
43205728,Show HN: Marketing Agents – for Founders who suck at marketing,https://marketingagents.net/,1,2025-02-28 14:07:15+00:00
43205727,SmartPulse – Ultimate Data Insights · Streamlit,https://smartpulse-nwrkb9xdsnebmnhczyt76s.streamlit.app,1,2025-02-28 14:07:14+00:00
43205708,Mullvad Browser,https://mullvad.net/en/browser,1,2025-02-28 14:06:01+00:00
43205701,Allies Assess What Intelligence They Can Still Share with Trump,https://foreignpolicy.com/2025/02/27/trump-cia-allies-intelligence-sharing-five-eyes-trust/,9,2025-02-28 14:05:31+00:00
43205677,"May 5, Microsoft's Skype will shut down for good",https://arstechnica.com/gadgets/2025/02/on-may-5-microsofts-skype-will-shut-down-for-good/,109,2025-02-28 14:03:57+00:00
43205620,Why Amazon Hired a Car Mechanic to Run Its Cloud Empire (2013),https://www.wired.com/2013/02/james-hamilton-amazon/,1,2025-02-28 13:58:12+00:00
43205618,OpenAI Launches GPT-4.5 but Limits to Priciest Tiers After Running Out of GPUs,https://www.pcmag.com/news/openai-launches-gpt-45-but-limits-it-to-priciest-tiers-after-running-out,2,2025-02-28 13:58:06+00:00
43205615,Pokémon boss believes series can last another 50 to 100 years,https://www.bbc.com/news/articles/c5y0v3gd5e5o,1,2025-02-28 13:57:47+00:00
43205610,Open Confidential Computing Conference on March 27 Hybrid from Berlin,https://www.oc3.dev/,1,2025-02-28 13:57:24+00:00
43205609,Let's Hold Hands,https://hands.sonnet.io/,1,2025-02-28 13:57:22+00:00
43205601,"UK government's cloud strategy: Pay more, get less, blame vendor lock-in?",https://www.theregister.com/2025/02/28/uk_government_cloud_strategy/,3,2025-02-28 13:56:40+00:00
43205598,Microsoft Copilot just helped me pirate Windows 11,https://www.laptopmag.com/ai/microsoft-copilot-is-actively-helping-users-pirate-windows-heres-proof,2,2025-02-28 13:56:17+00:00
43205593,Oak Origins: From Acorns to Species and the Tree of Life,https://www.metafilter.com/207770/Oak-Origins-From-Acorns-to-Species-and-the-Tree-of-Life,1,2025-02-28 13:55:36+00:00
43205591,Interdiff review with git range-diff,https://blog.gitbutler.com/interdiff-review-with-git-range-diff/,3,2025-02-28 13:55:25+00:00
43205588,Calling all Ruby developers and crypto builders,https://rubystacknews.com/2025/02/28/exploring-crypto-apis-with-ruby-fetching-prices-wallet-data/,2,2025-02-28 13:55:14+00:00
43205585,Show HN: SenseFeedback – AI-powered social media sentiment analysis,https://sensefeedback.com,3,2025-02-28 13:55:07+00:00
43205582,AI Must Be Decentralized – A Call for Sovereign Intelligence [pdf],https://github.com/OpenIntelligenceCollective/decentralized-ai-whitepaper/blob/main/Decentralized_AI_White_Paper.pdf,1,2025-02-28 13:55:01+00:00
43205581,Show HN: I build the tool that create the drawing area for website,https://github.com/ianthefish/simple-canvas-tool,1,2025-02-28 13:54:58+00:00
43205569,Can Language Models Falsify? Testing Algorithmic Reasoning via Counterexamples,https://falsifiers.github.io/,2,2025-02-28 13:53:22+00:00
43205563,"Bernd das Brot, a depressed German loaf of bread",https://apnews.com/article/bernd-das-brot-germany-582397aa7e741b56f0228feeece35a0d,119,2025-02-28 13:52:53+00:00
43205541,We crossed $2M ARR with a Bootstrapped Team of 5,https://blog.tally.so/we-crossed-2m-arr-with-a-bootstrapped-team-of-5/,1,2025-02-28 13:50:44+00:00
43205532,Plant-Lore – Collecting the folklore and uses of plants,https://www.plant-lore.com/,1,2025-02-28 13:49:07+00:00
43205527,'Destiny 2' Reveals Its 'Content Shredder' as a Result of Recent Lawsuit,https://www.forbes.com/sites/paultassi/2025/02/27/destiny-2-reveals-its-content-shredder-as-a-result-of-recent-lawsuit/,27,2025-02-28 13:48:35+00:00
43205518,The flight plan that brought UK airspace to its knees – incident.io,https://incident.io/hubs/learning-from-other-fields/the-flight-plan-that-brought-uk-airspace-to-its-knees,4,2025-02-28 13:47:16+00:00
43205514,"How to Handle Sudden Bursts of Traffic or ""Thundering Herd Problem""?",https://newsletter.scalablethread.com/p/how-to-handle-sudden-bursts-of-traffic,2,2025-02-28 13:47:02+00:00
43205512,CouchDB Prevents Data Corruption: Fsync,https://neighbourhood.ie/blog/2025/02/26/how-couchdb-prevents-data-corruption-fsync,26,2025-02-28 13:46:49+00:00
43205502,How to Build a Mentorship Culture,https://www.nathanbroslawsky.com/p/how-to-build-a-mentorship-culture-not-just-another-program/,4,2025-02-28 13:46:08+00:00
43205498,Basic design pattern examples in JavaScript,https://github.com/AllThingsSmitty/basic-design-patterns,2,2025-02-28 13:45:56+00:00
43205481,Options for Passwordless Django Authentication,https://www.honeybadger.io/blog/options-for-passwordless-authentication-in-django/,2,2025-02-28 13:44:25+00:00
43205457,"EA Just Open Sourced Command and Conquer, Red Alert, Renegade and Generals",https://www.gamingonlinux.com/2025/02/ea-just-open-sourced-command-conquer-red-alert-renegade-and-generals/,2,2025-02-28 13:41:34+00:00
43205437,There Will Not Be Official ROCm Support for Radeon RX 9070 Series on Launch Day,https://www.phoronix.com/news/AMD-ROCm-RX-9070-Launch-Day,4,2025-02-28 13:39:22+00:00
43205436,Show HN: AICruiter – Top Talent Delivered by AI,https://aicruiter.io/,1,2025-02-28 13:39:19+00:00
43205435,Starlink to take over $2.4B contract to overhaul air traffic control comms,https://www.theverge.com/news/620777/starlink-verizon-contract-faa-communication-musk,138,2025-02-28 13:39:18+00:00
43205434,Leader Election with S3 and If-Match,https://quanttype.net/posts/2025-02-25-leader-election-with-s3-and-if-match.html,2,2025-02-28 13:39:16+00:00
43205415,Emergent Misalignment,https://thezvi.substack.com/p/on-emergent-misalignment,2,2025-02-28 13:37:39+00:00
43205410,Show HN: Grift Club tracks celebrity crypto schemes,https://grift.club,5,2025-02-28 13:37:07+00:00
43205407,[Dupe] New Zealand Team Prepares to Test Electric Propulsion System,https://spectrum.ieee.org/electric-propulsion-thruster,1,2025-02-28 13:36:46+00:00
43205381,Key Takeaways of the PQC Conference in Austin,https://pkic.org/2025/01/30/key-takeaways-of-the-pqc-conference-in-austin/,1,2025-02-28 13:33:57+00:00
43205364,Autoped,https://en.wikipedia.org/wiki/Autoped,1,2025-02-28 13:32:12+00:00
43205359,Money Is the Map,https://geohot.github.io//blog/jekyll/update/2025/02/24/money-is-the-map.html,1,2025-02-28 13:31:39+00:00
43205335,NASA Installs Heat Shield on First Private Spacecraft Bound for Venus,https://www.nasa.gov/image-article/nasa-installs-heat-shield-on-first-private-spacecraft-bound-for-venus/,29,2025-02-28 13:28:13+00:00
43205307,Up and to the Right,https://www.jordandipietro.com/article/up-and-to-the-right,2,2025-02-28 13:25:00+00:00
43205306,Quantum Computing Companies Focus on Modular Set Ups,https://spectrum.ieee.org/quantum-computers,2,2025-02-28 13:24:57+00:00
43205284,"My stupidly simple TODO ""system""",https://monogreen.home.blog/2020/09/01/my-stupidly-simple-todo-system/,3,2025-02-28 13:22:07+00:00
43205282,Traditional unions struggle to understand tech sector,https://bianet.org/haber/traditional-unions-struggle-to-understand-tech-sector-304922,2,2025-02-28 13:21:59+00:00
43205277,Chintai Tokenizes $570M Real Estate Cash-Flow for RealNOI,https://www.coindesk.com/business/2025/02/24/chintai-tokenizes-usd570m-real-estate-cash-flow-for-realnoi,2,2025-02-28 13:21:22+00:00
43205273,Cellebrite USB zero-day exploit used to target phone of Serbian student activist,https://securitylab.amnesty.org/latest/2025/02/cellebrite-zero-day-exploit-used-to-target-phone-of-serbian-student-activist/,9,2025-02-28 13:20:58+00:00
43205269,Creating a Sense of Stability,https://newsletter.canopy.is/p/creating-a-sense-of-stability,1,2025-02-28 13:20:14+00:00
43205266,Vulkanised 2025 session videos available,https://www.youtube.com/playlist?list=PLMLurvdlOpWO_jDP_l0ix1hz0BXEBwAFc,1,2025-02-28 13:19:52+00:00
43205252,Comparison of the Chernobyl and Fukushima nuclear accidents,https://en.wikipedia.org/wiki/Comparison_of_the_Chernobyl_and_Fukushima_nuclear_accidents,2,2025-02-28 13:18:02+00:00
43205227,Why it's so hard to build a jet engine,https://www.construction-physics.com/p/why-its-so-hard-to-build-a-jet-engine,5,2025-02-28 13:14:39+00:00
43205221,Elon Musk fans believe he can make Dogecoin the currency of Earth,https://arstechnica.com/tech-policy/2025/02/elon-musk-fans-truly-believe-he-can-make-dogecoin-the-currency-of-earth/,10,2025-02-28 13:13:17+00:00
43205209,Show HN: Free Kindle Scribe Weekly Planner Creator,https://tools.docgenie.co.uk/,19,2025-02-28 13:12:25+00:00
