id,title,url,points,created_at
44425630,Predicting average IMDB movie ratings using text embeddings of movie metadata,https://minimaxir.com/2025/06/movie-embeddings/,3,2025-06-30 17:09:42+00:00
44425621,My favourite German word,https://vurt.org/articles/my-favourite-german-word/,1,2025-06-30 17:09:02+00:00
44425607,A.I. Is Starting to Wear Down Democracy,https://www.nytimes.com/2025/06/26/technology/ai-elections-democracy.html,13,2025-06-30 17:07:02+00:00
44425598,Just Speak the Truth,https://drewdevault.com/2025/06/30/Speak-the-truth.html,9,2025-06-30 17:06:15+00:00
44425580,Arm Morello Program,https://www.arm.com/architecture/cpu/morello,2,2025-06-30 17:04:21+00:00
44425566,"Pironman 5 Max, A fancy Raspberry Pi 5 Tower PC enclosure with dual M.2",https://www.cnx-software.com/2025/06/29/pironman-5-max-review-a-fancy-raspberry-pi-5-tower-pc-enclosure-with-dual-m-2-pci-sockets-for-ssd-and-or-ai-accelerator/,3,2025-06-30 17:03:23+00:00
44425564,Show HN: Dittofeed – Embed Messaging Features in Your App,,14,2025-06-30 17:03:00+00:00
44425545,"Future of post-open-source? Considering a ""source-visible, non-runnable"" license",,1,2025-06-30 17:01:25+00:00
44425539,Show HN: TenZorro – AI Model Gateway for private generations,https://tenzorro.com/en,1,2025-06-30 17:01:11+00:00
44425502,Data-Parallel Types – A First Example,https://www.modernescpp.com/index.php/data-parallel-types-a-first-example/,1,2025-06-30 16:58:03+00:00
44425499,Show HN: Weather AI – Fast AI Forecasts,https://brzzy.co/ask-brzzy,3,2025-06-30 16:57:43+00:00
44425461,I write type-safe generic data structures in C,https://danielchasehooper.com/posts/typechecked-generic-c-data-structures/,412,2025-06-30 16:55:20+00:00
44425454,Show HN: Flutter Course 3.0: A Browser IDE,https://www.hungrimind.com/articles/flutter-course-30,3,2025-06-30 16:55:00+00:00
44425439,Execution Outcomes of LLM-Generated versus Human Research Ideas,https://arxiv.org/abs/2506.20803,1,2025-06-30 16:54:16+00:00
44425434,Asteroid Day – UN-sanctioned global awareness campaign,https://asteroidday.org/,2,2025-06-30 16:53:53+00:00
44425423,Show HN: UniLinkPay – One smart link to get paid from anywhere,https://unilinkpay.com,1,2025-06-30 16:52:54+00:00
44425418,Cyberattack on Radix: Federal Administration data also affected,https://www.news.admin.ch/en/newnsb/T5AZeWNEPFGe,5,2025-06-30 16:52:36+00:00
44425405,The Digital Antiquarian,https://www.filfre.net/,2,2025-06-30 16:51:15+00:00
44425394,Underestimated Methane Emissions from Non-Producing Oil and Gas Wells in Canada,https://pubs.acs.org/doi/10.1021/acs.est.4c05602,4,2025-06-30 16:50:45+00:00
44425388,Make Fun of Them,https://www.wheresyoured.at/make-fun-of-themy/,3,2025-06-30 16:50:32+00:00
44425355,Surprising but True,https://quarter--mile.com/surprising-but-true,1,2025-06-30 16:48:24+00:00
44425354,PI(M)P Your Clock,https://blog.broulik.de/2025/06/pimp-your-clock/,1,2025-06-30 16:48:23+00:00
44425326,Scribble-based forecasting and AI 2027,https://dynomight.substack.com/p/scribbles,1,2025-06-30 16:45:33+00:00
44425315,Wrote this in a 48-hour hackathon last weekend. AI is so enabling and empowering,https://old.reddit.com/r/IndieDev/comments/1locahd/wrote_this_in_a_48hour_hackathon_last_weekend_so/,1,2025-06-30 16:44:38+00:00
44425307,A Review of Alpha School,https://www.astralcodexten.com/p/your-review-alpha-school,1,2025-06-30 16:43:38+00:00
44425291,Microsoft Authenticator Will Stop Supporting Passwords,https://it.slashdot.org/story/25/06/30/1631240/microsoft-authenticator-will-stop-supporting-passwords,1,2025-06-30 16:42:18+00:00
44425288,Bans on gas-powered leaf blowers are spreading around the US,https://www.usatoday.com/story/news/nation/2025/05/31/gas-powered-leaf-blowers-banned/83966488007/,23,2025-06-30 16:42:16+00:00
44425269,Show HN: Human-Readable Privacy Policy Summaries Powered by LLMs,https://www.privana.org/,2,2025-06-30 16:40:17+00:00
44425260,Why does everyone hate WebP?,https://mattsayar.com/why-does-everyone-hate-webp/,4,2025-06-30 16:39:41+00:00
44425253,A CarFax for Used PCs; Hewlett Packard wants to give old laptops new life,https://spectrum.ieee.org/carmax-used-pcs,98,2025-06-30 16:38:43+00:00
44425235,RFK Jr.'S Vaccine Panel Is Turning Misinformation into Policy,https://www.bloomberg.com/opinion/articles/2025-06-30/rfk-jr-s-vaccine-advisory-panel-turns-misinformation-into-policy,8,2025-06-30 16:37:12+00:00
44425233,Corporate best practices for upstream open source contributions,https://optimizedbyotto.com/post/best-practices-corporate-open-source-contributions/,3,2025-06-30 16:37:02+00:00
44425213,Dory – An app switcher for people who can't remember shortcuts,https://apps.apple.com/us/app/dory-app-switcher/id6746273626?mt=12,1,2025-06-30 16:35:33+00:00
44425205,Every Level of Wealth in 13 Minutes [video],https://www.youtube.com/watch?v=9t2TQ8-mf5w,2,2025-06-30 16:34:54+00:00
44425191,Amazon starts blocking piracy apps on Fire TV,https://www.flatpanelshd.com/news.php?subaction=showfull&id=1751008189,6,2025-06-30 16:33:59+00:00
44425184,DOJ issues directive to strip naturalized US citizens for criminal offenses,https://www.theguardian.com/us-news/2025/jun/30/trump-birthright-citizenship-naturalized-citizens,22,2025-06-30 16:33:37+00:00
44425177,Chai-2: Zero-shot antibody design in a 24-well plate,https://www.chaidiscovery.com/news/introducing-chai-2,8,2025-06-30 16:33:09+00:00
44425161,Node.js LGBTQIA+ Stories: Emelia Smith,https://nodejs.org/en/blog/community/2025-06-28-Emelia-Smith,2,2025-06-30 16:31:43+00:00
44425145,KDE's KClock is getting Wayland PiP support for pop-out timers,https://www.neowin.net/news/kdes-kclock-is-getting-wayland-picture-in-picture-support/,1,2025-06-30 16:30:05+00:00
44425140,Why Can't Americans Sleep?,https://www.theatlantic.com/magazine/archive/2025/08/insomnia-health-cognitive-behavioral-therapy/683257/,5,2025-06-30 16:29:22+00:00
44425136,The Nobel Prize in Literature (1958),https://www.nobelprize.org/prizes/literature/1958/summary/,1,2025-06-30 16:29:11+00:00
44425128,Fireball flies across the sky and causes sonic boom,https://www.cnn.com/2025/06/26/weather/video/fireball-causes-sonic-boom-digvid,5,2025-06-30 16:28:36+00:00
44425127,Tumblr's move to WordPress and Fediverse integration is 'on hold',https://www.theverge.com/news/695124/tumblr-wordpress-automattic-fediverse-integration-on-hold-decoder,16,2025-06-30 16:28:12+00:00
44425125,The role of the University is to resist AI,https://www.danmcquillan.org/cpct_seminar.html,67,2025-06-30 16:27:56+00:00
44425124,Ask HN: Safe Fundraising for Hardware Startup,,2,2025-06-30 16:27:42+00:00
44425106,Strangler Fig Pattern,https://learn.microsoft.com/en-us/azure/architecture/patterns/strangler-fig,1,2025-06-30 16:25:55+00:00
44425094,Exherbo,https://www.exherbo.org/,10,2025-06-30 16:24:32+00:00
44425028,What to know about online age verification laws,https://apnews.com/article/internet-age-verification-supreme-court-def346d7bf299566a3687d8c4f224fec,3,2025-06-30 16:18:18+00:00
44425026,A web tool extracting vocabulary from any web page in minutes,https://anyvocabulary.com/en/blog/extract-vocabulary-from-web-page,1,2025-06-30 16:17:38+00:00
44425025,A New Rust Packaging Model,https://guix.gnu.org/en/blog/2025/a-new-rust-packaging-model/,3,2025-06-30 16:17:32+00:00
44425018,Open Source AI Editor: First Milestone,https://code.visualstudio.com/blogs/2025/06/30/openSourceAIEditorFirstMilestone,3,2025-06-30 16:17:00+00:00
44425016,Peripheral cues may amplify distress in individuals with depressive symptoms,https://medicalxpress.com/news/2025-06-peripheral-cues-amplify-emotional-distress.html,1,2025-06-30 16:16:31+00:00
44425008,The Silence,https://www.newyorker.com/magazine/2025/07/07/the-silence-fiction-zadie-smith,2,2025-06-30 16:16:05+00:00
44424997,Make an AI video platform – based on Google Veo3,https://www.vo3ai.com,2,2025-06-30 16:15:33+00:00
44424996,Scribble-based forecasting and AI 2027,https://dynomight.net/scribbles/,55,2025-06-30 16:15:29+00:00
44424993,Show HN: We gave AI a mouse and keyboard,https://www.tryshiplo.com/,1,2025-06-30 16:15:14+00:00
44424981,Ageing is linked to inflammation – but only in the industrialized world,https://www.nature.com/articles/d41586-025-02085-w,3,2025-06-30 16:14:29+00:00
44424966,Inside a plan to use AI to amplify doubts about the dangers of pollutants,https://www.theguardian.com/technology/ng-interactive/2025/jun/27/tony-cox-epidemiology-risk-assessment-chatgpt-ai,3,2025-06-30 16:11:54+00:00
44424960,I became a full time indie developer [video],https://www.youtube.com/watch?v=_JXcQD9k2ag,1,2025-06-30 16:11:23+00:00
44424920,"Detecting Major World Events Using Osint, Through Google Maps and Pizza",https://signalslice.sebastianalexis.com/,10,2025-06-30 16:07:51+00:00
44424917,The business of making the trains to Auschwitz run on time (2002),https://www.sfgate.com/opinion/article/The-business-of-making-the-trains-to-Auschwitz-2821685.php,3,2025-06-30 16:07:27+00:00
44424888,Reading problems aren't a willpower issue – your brain got rewired,,2,2025-06-30 16:05:17+00:00
44424886,Scientists Launch Wild New Project to Build a Human Genome from Scratch,https://gizmodo.com/scientists-launch-wild-new-project-to-build-a-human-genome-from-scratch-2000620762,2,2025-06-30 16:05:14+00:00
44424872,They're Tiny. They're Slow. and People Are Obsessed,https://nytimes.com/2025/06/29/style/kei-trucks-cars-japan.html,1,2025-06-30 16:04:11+00:00
44424862,Houten: The Best-Designed Town in the Netherlands [video],https://www.youtube.com/watch?v=r-TuGAHR78w,4,2025-06-30 16:03:22+00:00
44424853,Ask HN: When will YC do a batch in Europe and/or Asia?,,1,2025-06-30 16:02:39+00:00
44424843,Code Ages Like Milk,https://elijahpotter.dev/articles/code_ages_like_milk,1,2025-06-30 16:01:50+00:00
44424841,Show HN: Cogeol – Align your projects Python versions by cog and endoflife.date,https://github.com/open-nudge/cogeol,1,2025-06-30 16:01:38+00:00
44424834,The Case for Apple Buying OpenAI for $500B,https://www.suffsyed.com/Future(memo)/the-case-for-apple-buying-openai-for-500b,2,2025-06-30 16:01:18+00:00
44424815,Make your JavaScript functions smarter and cleaner with default parameters,https://allthingssmitty.com/2025/06/29/default-parameters-your-code-just-got-smarter/,2,2025-06-30 15:58:50+00:00
44424767,Exploring Datapacks,https://www.joshbeckman.org/blog/exploring-datapacks,1,2025-06-30 15:54:43+00:00
44424755,"Polychain made over $80M from staking, sparking criticism over insider tokens",https://unchainedcrypto.com/polychain-made-80-million-from-selling-celestia-staking-rewards/,2,2025-06-30 15:53:13+00:00
44424751,Show HN: SendMeYourIP – Send a unique link to ask someone share their IP,https://www.sendmeyourip.com/,2,2025-06-30 15:53:04+00:00
44424747,There's no such thing as a tree (phylogenetically) (2021),https://eukaryotewritesblog.com/2021/05/02/theres-no-such-thing-as-a-tree/,47,2025-06-30 15:52:22+00:00
44424738,Ask HN: Has anyone made a self-hosted Pocket from the source code yet?,,3,2025-06-30 15:51:18+00:00
44424732,Mental Models and Potemkin Understanding in LLMs,https://alangrow.com/blog/mental-models-and-potemkin-understanding-in-llms,1,2025-06-30 15:50:57+00:00
44424730,Ask HN: What Inference Server do you use to host TTS Models?,,1,2025-06-30 15:50:46+00:00
44424718,The Georgist Roots of American Libertarianism,https://asteriskmag.com/issues/10/the-georgist-roots-of-american-libertarianism,13,2025-06-30 15:49:37+00:00
44424712,The Academic Pipeline Stall: Why Industry Must Stand for Academia,https://www.sigops.org/2025/the-academic-pipeline-stall-why-industry-must-stand-for-academia/,77,2025-06-30 15:48:45+00:00
44424710,Making Rails Delegated_type's Clearer,https://kaspth.com/posts/making-rails-delegated_types-clearer,2,2025-06-30 15:48:26+00:00
44424703,The Discreet Charm of the Infrastructureless,https://blog.jgc.org/2025/06/the-discreet-charm-of-infrastructureless.html,2,2025-06-30 15:47:59+00:00
44424683,Show HN: Qwiz – Building a daily global quiz app with synchronised leaderboards,https://apps.apple.com/gb/app/qwiz-daily-quiz-trivia-fun/id6747268704,1,2025-06-30 15:45:45+00:00
44424649,"Windows loses 400M users as mobile, Linux, and Mac use grows",https://www.techspot.com/news/108494-windows-loses-400-million-users-mobile-linux-mac.html,10,2025-06-30 15:42:34+00:00
44424639,A U.S. plan to use immigrants in Latin America as WWII bartering chips,https://www.npr.org/2025/06/27/nx-s1-5431719/immigration-deported-wwii-internment,4,2025-06-30 15:41:42+00:00
44424635,The Evolution of Caching Libraries in Go,https://maypok86.github.io/otter/blog/cache-evolution/,2,2025-06-30 15:41:11+00:00
44424627,OpenFLOW - Isometric Diagramming Tool,https://github.com/stan-smith/OpenFLOW,6,2025-06-30 15:40:45+00:00
44424624,New details emerge on Meta's $14.3B deal for Scale,https://techcrunch.com/2025/06/13/new-details-emerge-on-metas-14-3b-deal-for-scale/,1,2025-06-30 15:40:17+00:00
44424620,Car Hacking Is the Next Big Cyber Threat – and Nobody's Ready,https://www.carsandhorsepower.com/featured/car-hacking-is-the-next-big-cyber-threat-and-nobody-s-ready,5,2025-06-30 15:39:33+00:00
44424597,"Show HN: Collaborative, AI-powered trip planning with friends",https://tripjam.app/,1,2025-06-30 15:37:01+00:00
44424588,"CIXI – PERS, chainless and beltless electronic cranksets",https://www.cixi.life/pers-technology,1,2025-06-30 15:36:11+00:00
44424580,Ubisoft Support Gave My 2-Factor Authenticated Siege Account to a Hacker,https://old.reddit.com/r/Rainbow6/comments/1ln9x36/ubisoft_support_gave_my_2factor_authenticated/,9,2025-06-30 15:35:32+00:00
44424577,Nearly half of ransomware victims still pay out,https://www.theregister.com/2025/06/30/information_security_in_brief/,2,2025-06-30 15:35:25+00:00
44424562,LyteNyte Grid: A React Data Table That Doesn't Break at Scale (1M Row Demo),,1,2025-06-30 15:34:08+00:00
44424554,Raspberry Pi Radio Module 2,https://www.raspberrypi.com/news/raspberry-pi-radio-module-2-available-now-at-4/,10,2025-06-30 15:33:31+00:00
44424537,Show HN: Heap – save full-page local archives of webpages with just one click,https://apps.apple.com/ca/app/heap-website-full-page-image/id6747727830?mt=12,6,2025-06-30 15:32:06+00:00
44424511,Show HN: PolySpin – a daily polygon rotation puzzle game,https://polyspin.vercel.app/,1,2025-06-30 15:29:42+00:00
44424505,Cloudflare blocks largest DDoS attack,https://www.zdnet.com/article/cloudflare-blocks-largest-ddos-attack-heres-how-to-protect-yourself/,3,2025-06-30 15:29:19+00:00
44424491,A Software Architect's Level-Headed Take on Vibe Coding,,1,2025-06-30 15:28:16+00:00
44424479,VMware must support crucial Dutch govt agency as it migrates off the platform,https://www.theregister.com/2025/06/30/dutch_agency_wins_right_to/,1,2025-06-30 15:27:03+00:00
44424468,claude is faster than a Google engineer? [video],https://www.youtube.com/watch?v=EXGOJcMJ2pU,3,2025-06-30 15:26:09+00:00
44424467,Cursor is now available on Mobile and web,https://twitter.com/cursor_ai/status/1939702194863026504,3,2025-06-30 15:26:03+00:00
44424463,I built a tool that helps you launch on Product Hunt,,1,2025-06-30 15:25:40+00:00
44424456,Make Fun of Them,https://www.wheresyoured.at/make-fun-of-them/,56,2025-06-30 15:25:03+00:00
44424420,Quantum computers just beat classical ones – Exponentially and unconditionally,https://www.sciencedaily.com/releases/2025/06/250629033459.htm,2,2025-06-30 15:20:48+00:00
44424405,How often is the query plan optimal?,https://vondra.me/posts/how-often-is-the-query-plan-optimal/,32,2025-06-30 15:19:27+00:00
44424393,Cursor launches a web app to manage AI coding agents,https://techcrunch.com/2025/06/30/cursor-launches-a-web-app-to-manage-ai-coding-agents/,3,2025-06-30 15:17:59+00:00
44424380,Hybrid Aerial and Underwater Drone Propulsion [video],https://www.youtube.com/watch?v=g7vmPFZrYAk,1,2025-06-30 15:16:41+00:00
44424364,Dual-light technique enables seamless blending of flexible and rigid materials,https://techxplore.com/news/2025-06-dual-3d-technique-enables-seamless.html,1,2025-06-30 15:15:32+00:00
44424353,Space Elevators Could Work–If Earth Days Were Much Shorter,https://www.wired.com/story/space-elevators-could-work-if-the-days-were-shorter/,1,2025-06-30 15:14:38+00:00
44424341,AI Makes Research Easy. Maybe Too Easy,https://www.wsj.com/tech/ai/ai-learning-research-understanding-05fe0fde,2,2025-06-30 15:13:38+00:00
44424333,Nth Cycle is bringing critical metals refining to the U.S.,https://news.mit.edu/2025/nth-cycle-brings-critical-metals-refining-0627,2,2025-06-30 15:12:54+00:00
44424329,Daily SaaS Ideas from Reddit,https://saasprint.dev,1,2025-06-30 15:12:49+00:00
44424318,"AI/LLMs Can Help, Hinder Developers",https://cacm.acm.org/blogcacm/how-ai-llms-can-help-hinder-developers/,1,2025-06-30 15:11:45+00:00
44424308,"Apple to Delay Some Feature Rollouts in EU, Citing Regulatory Hurdles",https://www.wsj.com/tech/apple-to-delay-some-feature-rollouts-in-eu-citing-regulatory-hurdles-f2965097,3,2025-06-30 15:10:52+00:00
44424297,New MacBook with A18 Pro Chip Spotted in Apple Code,https://www.macrumors.com/2025/06/30/new-macbook-with-a18-chip-spotted/,17,2025-06-30 15:10:03+00:00
44424296,What's stopping America from going all-in on heat pumps?,https://climatedrift.substack.com/p/whats-stopping-america-from-going,19,2025-06-30 15:10:00+00:00
44424295,The Worst Bill in History,https://robertreich.substack.com/p/the-three-myths-of-trickle-down-economics,8,2025-06-30 15:10:00+00:00
44424289,Cursor on Web and Mobile,https://www.cursor.com/en/blog/agent-web,2,2025-06-30 15:09:23+00:00
44424278,Compatibilized R-Pet/R-HDPE Blends for Pellet Extrusion 3D Printing,https://www.mdpi.com/2073-4360/17/12/1638,1,2025-06-30 15:08:03+00:00
44424272,It's the Moustache That Matters (1980),https://folklore.org/Moustache.html,3,2025-06-30 15:07:13+00:00
44424271,Ask HN: What Are Your Hobbies?,,3,2025-06-30 15:07:05+00:00
44424256,Auth for B2B SaaS: it's not like auth for consumer software,https://tesseral.com/blog/b2b-auth-isnt-that-similar-to-b2c-auth,75,2025-06-30 15:06:14+00:00
44424251,The GraphQL Asterisk Problem: When Benefits Come with Caveats,https://jovidecroock.com/blog/graphql-asterisk-problem/,3,2025-06-30 15:05:36+00:00
44424248,Tail Latency Might Matter More Than You Think (2021),https://brooker.co.za/blog/2021/04/19/latency.html,3,2025-06-30 15:05:31+00:00
44424239,A neural brain implant provides near instantaneous speech,https://arstechnica.com/science/2025/06/a-neural-brain-implant-provides-near-instantaneous-speech/,3,2025-06-30 15:04:54+00:00
44424234,How Oracle Is Winning the AI Compute Market,https://semianalysis.com/2025/06/30/how-oracle-is-winning-the-ai-compute-market/,4,2025-06-30 15:04:14+00:00
44424231,Show HN: Quoth – Semantic search for quotes using pgvector and OpenAI embeddings,https://quoth.app/main,3,2025-06-30 15:03:51+00:00
44424227,Inside LA's WeWork for Stoners,https://www.sfgate.com/la/article/cannabis-consumption-lounge-members-only-la-20373059.php,1,2025-06-30 15:03:35+00:00
44424194,Donkey Kong Country 2 and Open Bus,https://jsgroth.dev/blog/posts/dkc2-open-bus/,265,2025-06-30 15:01:12+00:00
44424173,Losing Sales to Cart Abandonment? AI Can Boost Conversions 3x,https://www.techolution.com/blog/cart-abandonment-hurting-sales-use-ai-to-recover-lost-sales-and-boost-conversions-3x/,1,2025-06-30 14:59:31+00:00
44424162,The AI Memory Wallet Fallacy,https://blog.getzep.com/the-ai-memory-wallet-fallacy/,4,2025-06-30 14:58:46+00:00
44424160,Create a Folder Bookmarking System in Bash with Goto and Bookmark Commands,https://blog.msar.me/create-a-folder-bookmarking-system-in-bash-with-goto-and-bookmark-commands,1,2025-06-30 14:58:42+00:00
44424155,Show HN: FoundersAround – See which founders live near you,https://www.foundersaround.com/,4,2025-06-30 14:57:50+00:00
44424136,Ask HN: What's Your Car?,,11,2025-06-30 14:56:41+00:00
44424114,Why AI will eat McKinsey's lunch – but not today,https://techcrunch.com/2025/06/29/why-ai-will-eat-mckinseys-lunch-but-not-today/,2,2025-06-30 14:54:43+00:00
44424112,Good Metaphors,https://www.doc.cc/articles/good-metaphors,3,2025-06-30 14:54:39+00:00
44424093,Local Privilege Escalation via host option,https://www.sudo.ws/security/advisories/host_any/,2,2025-06-30 14:52:20+00:00
44424087,"Nano-engineered thermoelectrics enable scalable, compressor-free cooling",https://www.jhuapl.edu/news/news-releases/250521-apl-thermoelectrics-enable-compressor-free-cooling,122,2025-06-30 14:51:38+00:00
44424082,Show HN: MailMap – Turn emails into interactive stories on Google Maps,https://mailmap.site,6,2025-06-30 14:51:15+00:00
44424075,Show HN: Private real-time dictation app for Mac,https://github.com/aviaryan/Very-Fast-Dictation,23,2025-06-30 14:50:51+00:00
44424070,What Happens to Leftover Hotel Soap?,https://reasonstobecheerful.world/upcycling-leftover-hotel-soap/,3,2025-06-30 14:50:30+00:00
44424060,Ask HN: Why does STM32 (or embedded generally) development suck?,,6,2025-06-30 14:49:36+00:00
44424041,Airbnb has locked payment on my account for 8 weeks and still no follow-up email,,2,2025-06-30 14:48:30+00:00
44424036,"The Software Engineering ""Squeeze""",https://newsletter.manager.dev/p/the-software-engineering-squeeze,4,2025-06-30 14:47:59+00:00
44424035,Accuracy-obsessed weather app does one thing oh so well,https://www.fastcompany.com/91356159/this-accuracy-obsessed-weather-app-does-one-thing-oh-so-well,5,2025-06-30 14:47:47+00:00
44424024,Chrono Odyssey: A Grand Vision Hindered by Technical Rough Edges,https://medium.com/@barbararobinson2p1u3/chrono-odyssey-review-a-gorgeous-promise-marred-by-rough-execution-9b94ad9872f1,1,2025-06-30 14:46:36+00:00
44423995,That boolean should probably be something else,https://ntietz.com/blog/that-boolean-should-probably-be-something-else/,5,2025-06-30 14:44:34+00:00
44423987,Tool Calling with Local LLMs: A Practical Evaluation,https://www.docker.com/blog/local-llm-tool-calling-a-practical-evaluation/,3,2025-06-30 14:44:09+00:00
44423983,"There are no new ideas in AI, only new datasets",https://blog.jxmo.io/p/there-are-no-new-ideas-in-ai-only,490,2025-06-30 14:43:46+00:00
44423976,Show HN: Emoji Tags (VSCode) Tag any keyword with an emoji for clarity and style,https://marketplace.visualstudio.com/items?itemName=Alaadel.emoji-tags,1,2025-06-30 14:43:29+00:00
44423965,Ubuntu: Introducing Debcrafters,https://discourse.ubuntu.com/t/introducing-debcrafters/63674,59,2025-06-30 14:42:43+00:00
44423956,UK Online Safety Act Notes for Small Sites (2024),https://russ.garrett.co.uk/2024/12/17/online-safety-act-guide/,2,2025-06-30 14:42:04+00:00
44423942,Sequential Diagnosis with Language Models,https://arxiv.org/abs/2506.22405,2,2025-06-30 14:40:52+00:00
44423910,Coffee Berry anomaly detection using colour and shape separation via L-systems [pdf],https://www.bio-conferences.org/articles/bioconf/pdf/2025/18/bioconf_icosia2024_05003.pdf,2,2025-06-30 14:37:49+00:00
44423905,Accelerating Scientific Discovery with AI,https://news.mit.edu/2025/futurehouse-accelerates-scientific-discovery-with-ai-0630,2,2025-06-30 14:37:24+00:00
44423897,The Birth-Rate Crisis Isn't as Bad as You've Heard–It's Worse,https://www.theatlantic.com/ideas/archive/2025/06/birth-rate-population-decline/683333/,16,2025-06-30 14:36:57+00:00
44423894,Self-hosting Trigger.dev v4 using Docker,https://trigger.dev/blog/self-hosting-trigger-dev-v4-docker,1,2025-06-30 14:36:38+00:00
44423889,Cut the Chit-Chat with Artifacts,http://arcturus-labs.com/blog/2024/11/11/cut-the-chit-chat-with-artifacts/,1,2025-06-30 14:36:20+00:00
44423877,Wikipedia: WikiProject AI Cleanup/AI Catchphrases,https://en.wikipedia.org/wiki/Wikipedia:WikiProject_AI_Cleanup/AI_catchphrases,4,2025-06-30 14:35:30+00:00
44423865,The cosmic distance ladder with Terence Tao: part two [video],https://aeon.co/videos/how-we-came-to-know-the-size-of-the-universe-and-what-mysteries-remain,1,2025-06-30 14:34:55+00:00
44423860,Godot Community Poll 2025,https://godotengine.org/article/godot-community-poll-2025/,2,2025-06-30 14:34:35+00:00
44423851,Natural-Language Agents: MongoDB Text-to-MQL and LangChain,https://www.mongodb.com/blog/post/technical/natural-language-agents-mongodb-text-mql-langchain,1,2025-06-30 14:33:55+00:00
44423846,"Honda Recalls More Than 259,000 Cars in the US Due to Brake Pedal Issue",https://www.insurancejournal.com/news/national/2025/06/20/828633.htm,1,2025-06-30 14:33:26+00:00
44423832,Be on the Lookout for 'Scattered Spider' Hackers,https://www.insurancejournal.com/news/national/2025/06/23/828749.htm,1,2025-06-30 14:32:31+00:00
44423827,"How do you ""effortlessly reply"" from any-email AT your_domain.tld?",,1,2025-06-30 14:32:12+00:00
44423824,The Story of Building Milvus from Scratch,https://milvus.io/blog/journey-to-35k-github-stars-story-of-building-milvus-from-scratch.md,2,2025-06-30 14:32:03+00:00
44423823,"Weeks Later, Erie and Philadelphia Insurance Still Working to Restore Networks",https://www.insurancejournal.com/news/east/2025/06/24/828919.htm,1,2025-06-30 14:31:41+00:00
44423819,Building Replication-Safe LSM Trees in Postgres,https://www.paradedb.com/blog/lsm_trees_in_postgres,3,2025-06-30 14:31:11+00:00
44423812,How urea forms spontaneously,https://ethz.ch/en/news-and-events/eth-news/news/2025/06/how-urea-forms-spontaneously.html,26,2025-06-30 14:30:42+00:00
44423810,Show HN: Turn your boarding pass into a bald JD Vance for airport checkin,https://vance.darefail.com/,3,2025-06-30 14:30:39+00:00
44423807,The Path to Medical Superintelligence,https://microsoft.ai/new/the-path-to-medical-superintelligence/,10,2025-06-30 14:30:29+00:00
44423785,Pretrained Transformers as Universal Computation Engines,https://arxiv.org/abs/2103.05247,2,2025-06-30 14:29:08+00:00
44423748,Microsoft: AI system better than doctors at diagnosing complex health conditions,https://www.theguardian.com/technology/2025/jun/30/microsoft-ai-system-better-doctors-diagnosing-health-conditions-research,2,2025-06-30 14:27:13+00:00
