id,title,url,points,created_at
44427217,Ukrainians Built a Jammer That Tells Russian Drones They're in Peru,https://daxe.substack.com/p/a-ukrainian-team-built-a-radio-jammer,7,2025-06-30 20:00:23+00:00
44427213,Economic Nihilism,https://www.palladiummag.com/2025/06/30/economic-nihilism/,10,2025-06-30 20:00:15+00:00
44427181,Microsoft AI tool outperforms doctors in diagnosing complex medical cases,https://www.geekwire.com/2025/ai-vs-mds-microsoft-ai-tool-outperforms-doctors-in-diagnosing-complex-medical-cases/,10,2025-06-30 19:57:07+00:00
44427173,I still choose no-code vs. vibe code,https://twitter.com/marinatrajk/status/1939774832431780069,3,2025-06-30 19:56:26+00:00
44427172,Perplexity Is Doomed,https://medium.com/utopian/perplexity-is-doomed-721abbca1228,7,2025-06-30 19:56:21+00:00
44427171,How to Opt Out of Your Car's Surveillance State,https://www.carsandhorsepower.com/featured/how-to-opt-out-of-your-car-s-surveillance-state-before-it-s-too-late,6,2025-06-30 19:56:20+00:00
44427169,Why Don't AI Agents Work (Yet)? [video],https://www.youtube.com/watch?v=kpOWmwA6tJc,1,2025-06-30 19:56:20+00:00
44427157,Want to stand out in IT job interviews? a home lab can help,https://www.zdnet.com/home-and-office/want-to-stand-out-in-it-job-interviews-10-ways-a-home-lab-can-help/,3,2025-06-30 19:55:11+00:00
44427152,Space Emerges from Time? Groundbreaking Theory Upends Einstein,https://scitechdaily.com/space-emerges-from-time-groundbreaking-theory-upends-einstein/,5,2025-06-30 19:54:51+00:00
44427147,Price of rice in Japan falls below ¥4k per 5kg,https://www.japantimes.co.jp/news/2025/06/24/japan/japan-rice-price-falls-below-4000/,127,2025-06-30 19:54:11+00:00
44427139,Japan's Midget Submarine Attack on Pearl Harbor Was a Suicide Mission,https://daxe.substack.com/p/japans-midget-submarine-attack-on,3,2025-06-30 19:53:13+00:00
44427134,Public Signal Backups Testing,https://community.signalusers.org/t/public-signal-backups-testing/69984,78,2025-06-30 19:52:19+00:00
44427116,"The Power of ""and"": At Bloomberg, Open Source and Corporate Philanthropy",https://www.bloomberg.com/company/stories/the-power-of-and-at-bloomberg-open-source-and-corporate-philanthropy-work-hand-in-hand/,4,2025-06-30 19:49:22+00:00
44427092,Is AI eating your coding skills?,https://jpreagan.com/blog/generative-ai-for-coding/,3,2025-06-30 19:45:30+00:00
44427078,A simple PWA Hacker News client for desktop,https://hnreader.netlify.app/,3,2025-06-30 19:43:19+00:00
44427062,Bolivia's Last-Ditch Currency Bet: Spare Change Becomes Crypto Lifeline,https://latinamericanpost.com/economy-en/bolivias-last-ditch-currency-bet-when-spare-change-becomes-crypto-lifeline/,2,2025-06-30 19:42:15+00:00
44427052,"Show HN: ""Computer use"" mcp for webapps and Electron apps",https://github.com/snowfort-ai/circuit-mcp,2,2025-06-30 19:40:17+00:00
44427042,Building Accurate Address Matching Systems,https://www.robinlinacre.com/address_matching/,13,2025-06-30 19:38:50+00:00
44427041,Ring Convolution Networks – Novel neural architecture achieves 90.1% on MNIST,,5,2025-06-30 19:38:49+00:00
44427023,Show HN: Bard – An Experiment in Robot Poetry,https://muffinman.io/bard/,5,2025-06-30 19:36:49+00:00
44427022,PewDiePie quits all Google products [video],https://www.youtube.com/watch?v=u_Lxkt50xOg,23,2025-06-30 19:36:37+00:00
44427020,There is no private Email [video],https://www.youtube.com/watch?v=iH626CXyNtE,3,2025-06-30 19:36:17+00:00
44427005,Back end For Front end Authentication in FusionAuth,https://fusionauth.io/blog/backend-for-frontend,2,2025-06-30 19:34:26+00:00
44426987,Can you spot reduce body fat?,https://macrofactorapp.com/spot-reduce/,2,2025-06-30 19:32:18+00:00
44426986,"Show HN: Audiopipe – Pipeline for audio diarization, denoising and transcription",https://github.com/nullwiz/audiopipe,7,2025-06-30 19:32:09+00:00
44426985,"Next month, saved passwords will no longer be in Microsoft’s Authenticator app",https://www.cnet.com/tech/microsoft-will-delete-your-passwords-in-one-month-do-this-asap/,186,2025-06-30 19:31:32+00:00
44426972,'Generali' sign atop insurer's skyscraper offices collapses in Milan,https://www.reuters.com/en/generali-sign-atop-insurers-skyscraper-offices-collapses-milan-2025-06-30/,16,2025-06-30 19:29:50+00:00
44426970,Designing with Dataclasses,https://anderspoirel.net/posts/designing-with-dataclasses/,2,2025-06-30 19:29:39+00:00
44426965,NASA will start livestreaming content on Netflix later this summer,https://www.engadget.com/science/space/nasa-will-start-livestreaming-content-on-netflix-later-this-summer-184314711.html,5,2025-06-30 19:29:19+00:00
44426948,NASA's next frontier: A Netflix streaming deal,https://www.latimes.com/entertainment-arts/business/story/2025-06-30/nasa-netflix-streaming,3,2025-06-30 19:27:33+00:00
44426942,"OpenAI Researcher Jason Wei: It's obvious that it will not be a ""fast takeoff""",https://twitter.com/_jasonwei/status/1939762496757539297,36,2025-06-30 19:26:58+00:00
44426936,You don't need a grand life to blog,https://tala.bearblog.dev/you-dont-need-a-grand-life-to-blog-new/,4,2025-06-30 19:26:22+00:00
44426929,A Primer on Russian Cognitive Warfare,https://www.understandingwar.org/backgrounder/primer-russian-cognitive-warfare,8,2025-06-30 19:25:45+00:00
44426924,The Dumbest Move in Tech: Laying Off Developers Because of AI,https://ppaolo.substack.com/p/the-dumbest-move-in-tech-right-now,5,2025-06-30 19:25:22+00:00
44426896,Brad Feld – Is AI Just Software?,https://feld.com/archives/2025/06/is-ai-just-software/,1,2025-06-30 19:22:47+00:00
44426886,China hosts first autonomous AI robot football match,https://www.theguardian.com/technology/2025/jun/30/china-hosts-first-fully-autonomous-ai-robot-football-match,3,2025-06-30 19:21:45+00:00
44426864,The original LZEXE (A.K.A. Kosinski) compressor source code has been released,https://clownacy.wordpress.com/2025/05/24/the-original-lzexe-a-k-a-kosinski-compressor-source-code-has-been-released/,124,2025-06-30 19:19:52+00:00
44426854,"Monkeys, Typewriters, and Busy Beavers",https://lcamtuf.substack.com/p/monkeys-typewriters-and-busy-beavers,3,2025-06-30 19:18:08+00:00
44426848,'smart toilet' started as a joke – now it's gaining momentum – The Hustle,https://thehustle.co/news/this-smart-toilet-started-as-a-joke-now-its-gaining-momentum,2,2025-06-30 19:17:47+00:00
44426845,End of an Era,https://www.erasmatazz.com/personal/self/end-of-an-era.html,215,2025-06-30 19:17:11+00:00
44426837,You're doing quarterly planning wrong,https://newsletter.posthog.com/p/youre-doing-quarterly-planning-wrong,4,2025-06-30 19:16:24+00:00
44426832,Climate change anxiety: A meta-analysis,https://www.sciencedirect.com/science/article/pii/S0959378025000524,2,2025-06-30 19:15:55+00:00
44426826,Oldest Rocks Dated to 4.16B Years Old,https://www.iflscience.com/new-claim-for-worlds-oldest-rocks-dates-back-a-whopping-416-billion-years-79765,3,2025-06-30 19:14:34+00:00
44426823,China Builds New Large Jet-Powered Ekranoplan,https://www.navalnews.com/naval-news/2025/06/china-builds-new-jet-powered-large-ekranoplan/,21,2025-06-30 19:14:10+00:00
44426822,Show HN: I built a minimal site to quickly check Excel formulas,https://www.excelformulas.co,1,2025-06-30 19:14:00+00:00
44426821,Everyone Mark Zuckerberg has hired so far for Meta's 'superintelligence' team,https://www.wired.com/story/mark-zuckerberg-welcomes-superintelligence-team/,58,2025-06-30 19:13:51+00:00
44426791,Questions Asked on YC Interviews,https://ottic.ai/blog/list-of-yc-interview-questions/,1,2025-06-30 19:10:21+00:00
44426782,Accounts peddling CSAM content flood some X hashtags as safety partner cuts ties,https://www.nbcnews.com/tech/tech-news/x-accounts-peddle-child-abuse-musk-material-thorn-cuts-ties-rcna212107,3,2025-06-30 19:09:01+00:00
44426777,NASA plans to stream rocket launches on Netflix this summer,https://www.nasa.gov/news-release/nasa-is-coming-to-netflix-this-summer/,1,2025-06-30 19:08:36+00:00
44426768,Show HN: DXT registry (one-click MCP install),https://github.com/trypeggy/awesome-dxt-servers,1,2025-06-30 19:07:43+00:00
44426767,Iran Threatens to Flog Elon Musk's Starlink Users,https://www.newsweek.com/iran-ban-starlink-elon-musk-spies-arrests-2092435,5,2025-06-30 19:07:41+00:00
44426754,Learning to unlearn – an essay on revisiting mental models,https://ezzeriesa.notion.site/Learning-to-unlearn-1cf1308b420480edab1dde76922f50c8,1,2025-06-30 19:06:51+00:00
44426744,Apple weighs using Anthropic or OpenAI to power Siri in major reversal,https://www.reuters.com/business/apple-weighs-using-anthropic-or-openai-power-siri-major-reversal-bloomberg-news-2025-06-30/,5,2025-06-30 19:05:44+00:00
44426730,Anthropic Releases .dxt for one click MCP server installation,https://www.anthropic.com/engineering/desktop-extensions,1,2025-06-30 19:04:10+00:00
44426726,Xfinity using WiFi signals in your house to detect motion,https://www.xfinity.com/support/articles/wifi-motion,668,2025-06-30 19:03:50+00:00
44426724,Excavating a Language at the End of the World (2024),https://nautil.us/excavating-a-language-at-the-end-of-the-world-747254/,2,2025-06-30 19:03:41+00:00
44426720,"Debcraft: Easy, fast and secure way to build Debian packages",https://salsa.debian.org/debian/debcraft/-/blob/main/README.md,5,2025-06-30 19:03:21+00:00
44426708,"Anything between exploratory testing and ""traditional"" testing?",,1,2025-06-30 19:02:25+00:00
44426699,Norwegian lotto mistakenly told thousands they were filthy rich after math error,https://www.theregister.com/2025/06/30/norwegian_lotto_error/,2,2025-06-30 19:01:28+00:00
44426695,Django Joins Curl in Pushing Back on AI Slop Security Reports,https://socket.dev/blog/django-joins-curl-in-pushing-back-on-ai-slop-security-reports,6,2025-06-30 19:01:14+00:00
44426685,PyTorch and VLLM,https://pytorch.org/blog/pytorch-vllm-%e2%99%a5%ef%b8%8f/,1,2025-06-30 19:00:30+00:00
44426681,Library for better colors on eInk displays,https://github.com/Utzel-Butzel/epdoptimize,7,2025-06-30 19:00:14+00:00
44426643,Apple weighs using Anthropic or OpenAI to power Siri,https://www.bloomberg.com/news/articles/2025-06-30/apple-weighs-replacing-siri-s-ai-llms-with-anthropic-claude-or-openai-chatgpt,97,2025-06-30 18:56:40+00:00
44426641,"Caching is an Abstraction, not an Optimization",https://buttondown.com/jaffray/archive/caching-is-an-abstraction-not-an-optimization/,2,2025-06-30 18:56:33+00:00
44426630,Technology and Courage (Sutherland) [pdf],https://cseweb.ucsd.edu/~wgg/smli_ps-1.pdf,3,2025-06-30 18:55:39+00:00
44426622,How Copilot supercharged my last CTF and where it fell short,https://dev.to/doctolib/cracking-the-code-how-copilot-supercharged-my-last-ctf-and-where-it-fell-short-5g1i,3,2025-06-30 18:54:56+00:00
44426611,Computer-vision research powers surveillance technology,https://www.nature.com/articles/s41586-025-08972-6,2,2025-06-30 18:54:15+00:00
44426604,Is chat a good UI for AI? A Socratic dialogue,https://www.geoffreylitt.com/2025/06/29/chat-ai-dialogue,2,2025-06-30 18:53:27+00:00
44426585,Mammals could regenerate damaged tissue by turning on 'genetic switch',https://www.scmp.com/news/china/science/article/3316131/mammals-could-regenerate-damaged-tissue-turning-genetic-switch-chinese-team,3,2025-06-30 18:50:27+00:00
44426584,Show HN: Git Pocket – a read it later app on your GitHub,https://github.com/smoqadam/git-pocket-ui/blob/main/Howto.md,3,2025-06-30 18:50:21+00:00
44426583,Ask HN: Is it possible to 2D-print a radio?,,2,2025-06-30 18:50:20+00:00
44426536,Our latest bet on a fusion-powered future,https://blog.google/outreach-initiatives/sustainability/our-latest-bet-on-a-fusion-powered-future/,3,2025-06-30 18:45:55+00:00
44426532,Why Microsoft's next Xbox should just run Windows already,https://arstechnica.com/gaming/2025/06/why-microsofts-next-xbox-should-just-run-windows-already/,1,2025-06-30 18:45:42+00:00
44426517,XML External Entity (XXE) Injection in Akamai CloudTest,https://xbow.com/blog/xbow-akamai-cloudtest-xxe/,7,2025-06-30 18:43:10+00:00
44426492,"Show HN: Snippet Curator, Evernote alternative and SingleFile viewer for notes",https://curator.krxiang.com,2,2025-06-30 18:40:36+00:00
44426483,Kuo: Apple to release cheaper MacBook powered by iPhone processor,https://9to5mac.com/2025/06/30/cheaper-macbook-iphone-chip-kuo/,7,2025-06-30 18:39:37+00:00
44426476,Show HN: We're two coffee nerds who built an AI app to track beans and recipes,https://beanbook.app,60,2025-06-30 18:38:47+00:00
44426475,Pets Allowed (2014),https://www.newyorker.com/magazine/2014/10/20/pets-allowed,2,2025-06-30 18:38:42+00:00
44426473,JetBrains announces price hike for YouTrack,https://www.neowin.net/news/jetbrains-is-increasing-youtrack-prices-starting-this-october/,1,2025-06-30 18:38:26+00:00
44426452,Show HN: Chrome DevTools MCP Server,https://github.com/benjaminr/chrome-devtools-mcp,1,2025-06-30 18:36:47+00:00
44426450,The Anatomy of Quick Wins,https://ottic.ai/blog/marketing-quick-wins-with-examples/,3,2025-06-30 18:36:43+00:00
44426449,Workflows 1.0: A Lightweight Framework for Agentic systems,https://www.llamaindex.ai/blog/announcing-workflows-1-0-a-lightweight-framework-for-agentic-systems,10,2025-06-30 18:36:40+00:00
44426428,The hidden JTAG in a Qualcomm/Snapdragon device’s USB port,https://www.linaro.org/blog/hidden-jtag-qualcomm-snapdragon-usb/,242,2025-06-30 18:34:27+00:00
44426406,Mechanistic Interpretability of Emotion Inference in Large Language Models,https://arxiv.org/abs/2502.05489,3,2025-06-30 18:31:45+00:00
44426403,Why are AI agents not allowed to roam freely on the internet?,https://potent-menu-ea7.notion.site/Why-are-AI-agents-not-allowed-to-roam-freely-on-the-internet-like-humans-222903aa31ef8053a1b9dc5da51e0770,1,2025-06-30 18:31:25+00:00
44426399,Datadog's $65M/year customer mystery solved,https://blog.pragmaticengineer.com/datadog-65m-year-customer-mystery/,152,2025-06-30 18:31:09+00:00
44426374,"OpenTelemetry Is Great, but Who the Hell Is Going to Pay for It?",https://www.adatosystems.com/2025/02/10/who-the-hell-is-going-to-pay-for-this/,59,2025-06-30 18:28:12+00:00
44426366,How Long Contexts Fail,https://www.dbreunig.com/2025/06/22/how-contexts-fail-and-how-to-fix-them.html,10,2025-06-30 18:26:53+00:00
44426355,Brain rot isn't new – but now we're all talking about it,https://www.theguardian.com/books/2025/jun/30/brain-rot-isnt-new-but-now-were-all-talking-about-it,8,2025-06-30 18:25:44+00:00
44426338,"The AI Paradox: If machines do all the work, who buys the products?",https://claude.ai/share/dbefc4de-5ba3-4f0a-9e38-e33e2a15903b,3,2025-06-30 18:23:36+00:00
44426307,Meta Joins Kotlin Foundation,https://engineering.fb.com/2025/06/30/android/meta-joins-kotlin-foundation/,51,2025-06-30 18:21:01+00:00
44426306,Ask HN: How have you shared computers with your young child (~3 to 5),,18,2025-06-30 18:21:00+00:00
44426287,"Don't Be Ashamed to Say ""I Don't Know""",https://www.thecoder.cafe/p/i-dont-know,6,2025-06-30 18:17:56+00:00
44426277,I'm a software engineer – what next?,https://whatnext.dev/,3,2025-06-30 18:16:17+00:00
44426255,Rubik's Cube Solver,https://rubiks-cube-solver.com/,2,2025-06-30 18:14:08+00:00
44426241,Show HN: Validated Daily SaaS Ideas,https://www.dailysaasideas.com/,2,2025-06-30 18:11:44+00:00
44426240,What's the difference between bio and non bio detergent? (2022),https://smol.com/uk/stories/whats-the-difference-between-bio-vs-non-bio-detergent,4,2025-06-30 18:11:42+00:00
44426236,"Amateurs Talk Algorithms, Professionals Talk Data Cleaning",https://progressandpoverty.substack.com/p/amateurs-talk-algorithms-professionals,4,2025-06-30 18:11:05+00:00
44426234,Show HN: BugBlaze – a CLI tool that explains your code errors using AI,https://github.com/MatthewTheCoder1218/bugblaze,1,2025-06-30 18:10:58+00:00
44426233,Ask HN: What's the 2025 stack for a self-hosted photo library with local AI?,,230,2025-06-30 18:10:50+00:00
44426232,The Bear Manifesto – Herman's Blog,https://herman.bearblog.dev/manifesto/,1,2025-06-30 18:10:49+00:00
44426227,"Alex Trebek Stamps, Sheet of 20",https://store.usps.com/store/product/alex-trebek-stamps-S_485304,1,2025-06-30 18:10:13+00:00
44426212,Show HN: Kichan.ai a free Chrome extension to generate and inject scripts,https://kichan.ai/,3,2025-06-30 18:08:50+00:00
44426210,Show HN: Attach Gateway – one-command OIDC/DID auth for local LLMs,https://github.com/attach-dev/attach-gateway,7,2025-06-30 18:08:23+00:00
44426205,Zig Community Mirrors,https://ziglang.org/download/community-mirrors/,13,2025-06-30 18:07:31+00:00
44426186,The Simple Math Problem We Still Can't Solve,https://www.quantamagazine.org/why-mathematicians-still-cant-solve-the-collatz-conjecture-20200922/,3,2025-06-30 18:05:00+00:00
44426171,Sony DTC-700 audio DAT player/recorder,https://kevinboone.me/dtc-700.html,116,2025-06-30 18:03:26+00:00
44426168,User-friendly and privacy-friendly LLM experience?,https://tildes.net/~comp/1orz/user_friendly_and_privacy_friendly_llm_experience,1,2025-06-30 18:03:21+00:00
44426157,Ask HN: Stock Android tablet free of bloatware?,,12,2025-06-30 18:02:17+00:00
44426153,Alice's Adventures in a Differentiable Wonderland,https://arxiv.org/abs/2404.17625,157,2025-06-30 18:02:06+00:00
44426144,Why we should care about this war over the future of money,https://gizmodo.com/why-you-should-care-about-this-war-over-the-future-of-money-2000622009,18,2025-06-30 18:00:40+00:00
44426136,Lua 5.5.0 (Beta) Released,https://www.lua.org/work/#5.5.0,10,2025-06-30 17:59:48+00:00
44426128,Proton joins suit against Apple for practices that harm developers and consumers,https://proton.me/blog/apple-lawsuit,673,2025-06-30 17:58:38+00:00
44426127,Writing Code to Be Read at a Glance,https://jelv.is/blog/Writing-Code-To-Be-Read-at-a-Glance/,3,2025-06-30 17:58:37+00:00
44426126,Fake AI-made videos about Diddy trial are raking in millions of views on YouTube,https://www.theguardian.com/technology/2025/jun/29/fake-diddy-ai-videos-youtube,3,2025-06-30 17:58:27+00:00
44426124,"Operation Gold Rush, largest health care fraud bust in U.S. history",https://www.washingtonpost.com/health/2025/06/30/health-care-fraud-bust-largest-in-us-history/,29,2025-06-30 17:58:17+00:00
44426119,Satellites are fueling a space-based internet gold rush,https://restofworld.org/2025/satellites-space-based-internet/,1,2025-06-30 17:57:42+00:00
44426117,Hit songs are getting shorter,https://www.economist.com/culture/2025/06/02/hit-songs-are-getting-shorter,3,2025-06-30 17:57:31+00:00
44426114,Trump Vowed to Dismantle MS-13. His Deal with Bukele Threatens That Effort,https://www.nytimes.com/2025/06/30/us/politics/trump-bukele-ms-13-immigrants.html,3,2025-06-30 17:57:23+00:00
44426106,iOverlander's Pivot Shows the Cost of Community-Driven Tech,https://www.hereandthere.club/post/ioverlanders-pivot-shows-the-cost-of-community-driven-tech,1,2025-06-30 17:55:59+00:00
44426104,Fil-C,https://github.com/pizlonator/llvm-project-deluge,2,2025-06-30 17:55:51+00:00
44426085,A vision researcher's guide to some RL stuff: PPO and GRPO,https://yugeten.github.io/posts/2025/01/ppogrpo/,1,2025-06-30 17:52:59+00:00
44426081,Insider Trading on SEC Filings,https://www.bloomberg.com/opinion/newsletters/2025-06-30/insider-trading-on-sec-filings,2,2025-06-30 17:52:45+00:00
44426049,High-Severity Vulnerability in Notepad++,https://www.csa.gov.sg/alerts-and-advisories/alerts/al-2025-063,39,2025-06-30 17:49:12+00:00
44426027,"Therapy dogs: stop crafting loopholes to fair, reasonable laws",https://dirtamericana.com/2025/04/therapy-dogs-business-interior-violations/,63,2025-06-30 17:47:25+00:00
44426008,Show HN: FastPitchDeck – AI to generate VC-ready pitch decks,https://fastpitchdeckai.vercel.app/,1,2025-06-30 17:45:23+00:00
44425980,Writing a Little Gosh,https://flak.tedunangst.com/post/writing-a-gosh,2,2025-06-30 17:42:33+00:00
44425978,Martech Engineer,,1,2025-06-30 17:42:06+00:00
44425976,Can we ever understand our dogs?,https://www.vox.com/explain-it-to-me/418008/dog-pets-perception-science-research-animal-smell,3,2025-06-30 17:41:52+00:00
44425965,GenAI – Will Workers Disappear?,https://www.nominalnews.com/p/ai-labor-workers-economy,2,2025-06-30 17:40:56+00:00
44425949,Iran's Internet Blackout Accidentally Revealed Coordinated Narrative in the West,,7,2025-06-30 17:39:52+00:00
44425941,Resources for Disaster Preparedness in Heritage (2024),https://conserv.io/blog/7-resources-for-disaster-preparedness-in-heritage/,1,2025-06-30 17:39:11+00:00
44425940,Senator Chides FBI for Weak Advice on Mobile Security,https://krebsonsecurity.com/2025/06/senator-chides-fbi-for-weak-advice-on-mobile-security/,4,2025-06-30 17:39:11+00:00
44425933,"20 years on, Max Payne is as stylish as ever (2021)",https://www.eurogamer.net/20-years-on-max-payne-is-as-stylish-as-ever,27,2025-06-30 17:38:29+00:00
44425899,"Ask HN: Is ""ethical AI"" possible, or is there a catch?",,1,2025-06-30 17:34:43+00:00
44425893,Nvidia Gr00T - An Improved Open Foundation Model for Generalist Humanoid Robots,https://research.nvidia.com/labs/gear/gr00t-n1_5/,1,2025-06-30 17:34:04+00:00
44425888,"Zuckerberg Announces Meta 'Superintelligence' Effort, More Hires",https://www.bloomberg.com/news/articles/2025-06-30/zuckerberg-announces-meta-superintelligence-effort-more-hires,9,2025-06-30 17:33:29+00:00
44425886,Screenshot guide to check AI Search traffic in 2 minutes,https://ottic.ai/blog/how-to-check-your-chatgpt-traffic/,1,2025-06-30 17:33:13+00:00
44425883,He Thought an Employee Stole Crypto. The FBI Says It Was a North Korean Scammer,https://www.wsj.com/business/he-thought-an-employee-stole-crypto-the-fbi-says-it-was-a-north-korean-scammer-8aa533a8,5,2025-06-30 17:33:03+00:00
44425882,Show HN: Lunova – Custom rule-based SMS/email alerts for QuickBooks,https://uselunova.com/,1,2025-06-30 17:32:58+00:00
44425880,That XOR Trick (2020),https://florian.github.io//xor-trick/,320,2025-06-30 17:32:41+00:00
44425878,Using Machine Learning to Detect Vault (Anti-Forensic) Apps,https://www.mdpi.com/1999-5903/17/5/186,1,2025-06-30 17:32:27+00:00
44425873,Books of Bowie,http://www.bowiebookclub.com/david-bowies-100-most-influential-books,1,2025-06-30 17:31:38+00:00
44425866,Building Scalable Systems While Paying the Bills,https://eric.mann.blog/finding-balance-building-scalable-systems-while-paying-the-bills/,1,2025-06-30 17:30:58+00:00
44425862,Show HN: ArcFont – Font Embedding Model,https://github.com/JErnestoMtz/ArcFont,5,2025-06-30 17:30:33+00:00
44425826,LLMs and Artists,https://blog.brokk.ai/llms-and-artists/,2,2025-06-30 17:27:43+00:00
44425822,Cincinnati's Grand Hall Recreated in PlayCanvas Using 3D Gaussian Splatting,https://www.ryanfellers.com/oldmain/,2,2025-06-30 17:27:19+00:00
44425815,Giant plankton could help coral fight climate change,https://phys.org/news/2025-06-giant-plankton-coral-climate.html,3,2025-06-30 17:27:03+00:00
44425809,Vulnerability Advisory: Sudo Chroot Elevation of Privilege,https://www.stratascale.com/vulnerability-alert-CVE-2025-32463-sudo-chroot,23,2025-06-30 17:26:13+00:00
44425806,What's it like to be Batfished? A new word for mistaking LLMs for true subjects,https://partiallyexaminedlife.com/2025/06/30/what-is-it-like-to-be-batfished/,1,2025-06-30 17:26:09+00:00
44425804,"Trip June 2025 ISO C++ standards meeting (Sofia, Bulgaria)",https://herbsutter.com/2025/06/21/trip-report-june-2025-iso-c-standards-meeting-sofia-bulgaria/,2,2025-06-30 17:25:56+00:00
44425799,"Microsoft AI CEO: AI can provide complex medical support, diagnoses",https://finance.yahoo.com/news/microsoft-ai-ceo-mustafa-suleyman-ai-can-provide-complex-medical-support-diagnoses-143458485.html,1,2025-06-30 17:25:05+00:00
44425786,A Molecule with a Ring to It,https://www.nature.com/articles/nchem.2136.epdf?sharing_token=hRx0lE9vx6IFSD8RNjlkt9RgN0jAjWel9jnR3ZoTv0NkK8XuUq3ovPVrg0CNW6qYCGw36QcUXFlo2avOxUtCSNAsbMSBPX8wFBlZv8P860KSW4WO92WlnMeaFn-hvLogqvIMMh4rfXEfTbGiPDApjw%3D%3D,14,2025-06-30 17:24:03+00:00
44425771,"Why are lefties more creative? Turns out, they're not",https://phys.org/news/2025-06-lefties-creative-theyre.html,19,2025-06-30 17:22:12+00:00
44425765,My most frequently used Jujutsu VCS commands,https://danverbraganza.com/writings/most-frequent-jj-commands,2,2025-06-30 17:21:27+00:00
44425753,Tech Firms Warn 'Scattered Spider' Hacks Are Targeting Aviation Sector,https://www.insurancejournal.com/news/national/2025/06/30/829496.htm,1,2025-06-30 17:19:57+00:00
44425748,Update: Curved Text Generator Is Free and Online,https://www.mockofun.com/tutorials/curved-text-generator/,1,2025-06-30 17:19:29+00:00
44425738,'Pill-on-a-thread' may replace endoscopies for this with oesophageal cancer risk,https://www.cam.ac.uk/stories/capsule-sponge-patient-stratification,2,2025-06-30 17:18:34+00:00
44425735,AI: Not Just Autocomplete,https://www.youtube.com/watch?v=acD9F8dzjik,1,2025-06-30 17:18:15+00:00
44425729,Supreme Court to decide whether ISPs must disconnect users accused of piracy,https://arstechnica.com/tech-policy/2025/06/supreme-court-to-decide-whether-isps-must-disconnect-users-accused-of-piracy/,10,2025-06-30 17:17:45+00:00
44425723,Apple Fumbled the Marketing of the iPhone 16 and 16 Pro,https://volatileinputs.com/2025/06/apple-fumbled-the-marketing-of-the-iphone-16-and-16-pro/,2,2025-06-30 17:17:26+00:00
44425713,"Show HN: QuizKnit, an open source quiz creator",https://quizknit.com,10,2025-06-30 17:16:39+00:00
44425697,How Do You Teach Computer Science in the A.I. Era?,https://www.nytimes.com/2025/06/30/technology/computer-science-education-ai.html,5,2025-06-30 17:15:25+00:00
44425658,There's a Race to Power the Future. China Is Pulling Away,https://www.nytimes.com/interactive/2025/06/30/climate/china-clean-energy-power.html,13,2025-06-30 17:12:14+00:00
44425633,Ways large-scale infrastructure is reshaping AI's future,https://siliconangle.com/2025/06/25/10-ways-large-scale-infrastructure-reshaping-ais-future-roboticsaiinfrastructure/,1,2025-06-30 17:09:56+00:00
44425631,"Quickly and easily send REST, SOAP, GraphQL and gRPC requests",https://httpyac.github.io/,2,2025-06-30 17:09:44+00:00
