id,title,url,points,created_at
44744503,Bitter fight over 2020 Microsoft quantum paper both resolved and unresolved,https://www.theregister.com/2025/07/31/microsoft_quantum_paper_science/,5,2025-07-31 11:27:26+00:00
44744492,CC Signals: A New Social Contract for the Age of AI,https://creativecommons.org/ai-and-the-commons/cc-signals/,1,2025-07-31 11:24:53+00:00
44744456,Hitler Took on Germany's Central Banker,https://www.theatlantic.com/ideas/archive/2025/07/hitler-attacked-central-banker/683545/,7,2025-07-31 11:19:58+00:00
44744454,How was the Universal Pictures 1936 opening logo created?,https://movies.stackexchange.com/questions/128020/how-was-the-universal-pictures-1936-opening-logo-created,535,2025-07-31 11:19:54+00:00
44744445,Encrypted Client Hello Approved for Publication,https://www.feistyduck.com/newsletter/issue_127_encrypted_client_hello_approved_for_publication,11,2025-07-31 11:18:04+00:00
44744430,JVM Language Summit 2025 – Agenda,https://openjdk.org/projects/mlvm/jvmlangsummit/agenda.html,2,2025-07-31 11:16:21+00:00
44744428,Cool Ideas for a Hot Planet: Rethinking Air Conditioning,https://worldsensorium.com/cool-ideas-for-a-hot-planet-rethinking-air-conditioning-with-sebastian-clark-koch/,2,2025-07-31 11:15:53+00:00
44744426,Node Deletion Theorem: a precise rule for pruning nodes in recursive data types,https://papers.ssrn.com/sol3/papers.cfm?abstract_id=5349705,2,2025-07-31 11:15:50+00:00
44744422,What Poseidon Is Telling Us,https://nautil.us/what-poseidon-is-telling-us-1227766/,2,2025-07-31 11:14:36+00:00
44744372,Induction of a torpor-like state with ultrasound,https://engineering.washu.edu/news/2023/Induction-of-a-torpor-like-state-with-ultrasound.html,2,2025-07-31 11:05:05+00:00
44744371,YouTube loosens profanity rules for monetized videos,https://techcrunch.com/2025/07/30/youtube-loosens-profanity-rules-for-monetized-videos/,5,2025-07-31 11:04:24+00:00
44744354,Coding agents provide fast data visualization tools,https://mnky9800n.substack.com/p/coding-agents-provide-lightning-fast,2,2025-07-31 11:01:29+00:00
44744353,What Future Awaits for Software? AI First vs. AI Augmented,https://docsify-this.net/?basePath=https://gist.githubusercontent.com/joelewis/6859a7dc0ee18d39db41448e29fa76e1/raw/0cc574abdbf87ea472ae0ea5616a6b962a9f1282&homepage=what-future-awaits-for-software.md#/?id=what-future-awaits-for-software-ai-first-vs-ai-augmented,2,2025-07-31 11:01:12+00:00
44744336,Unintended AI consequence: the return of status markers,https://www.bostonglobe.com/2025/07/28/opinion/ai-college-admissions-personal-statements/,2,2025-07-31 10:58:30+00:00
44744331,GEPA: Reflective prompt evolution can outperform reinforcement learning,https://arxiviq.substack.com/p/gepa-reflective-prompt-evolution,92,2025-07-31 10:57:58+00:00
44744324,I tried Servo,https://www.spacebar.news/servo-undercover-web-browser-engine/,356,2025-07-31 10:56:21+00:00
44744318,Show HN: I got my first customer,https://www.superfa.st/,1,2025-07-31 10:55:00+00:00
44744313,Round Up and Reflections for Ennie Award for Best Adventure,https://tasker.land/2025/07/31/ennie-award-for-best-adventure-short-form-round-up-and-reflections/,1,2025-07-31 10:54:44+00:00
44744308,Sync primitives are Functionally Complete,http://kprotty.me/2025/07/31/sync-primitives-are-functionally-complete.html,3,2025-07-31 10:53:36+00:00
44744304,What Can a Cell Remember?,https://www.quantamagazine.org/what-can-a-cell-remember-20250730/,3,2025-07-31 10:52:07+00:00
44744287,Meetingco.st – How much does that meeting cost?,https://meetingco.st/,2,2025-07-31 10:47:08+00:00
44744268,Marvel: Laser-Driven Fusion,https://marvelfusion.com/,5,2025-07-31 10:42:23+00:00
44744258,Google could be reading your ChatGPT conversations,https://www.fastcompany.com/91376687/google-indexing-chatgpt-conversations,4,2025-07-31 10:40:39+00:00
44744255,Banning VPNs to protect kids? Good luck with that,https://www.theregister.com/2025/07/31/banning_vpns_to_protect_kids/,6,2025-07-31 10:40:23+00:00
44744253,The 1912 War on Fake Photos,https://www.bunkhistory.org/resources/the-1912-war-on-fake-photos,3,2025-07-31 10:39:46+00:00
44744251,Proxima and Hugging Face Announce the ConStellaration Challenge,https://www.proximafusion.com/press-news/proxima-and-hugging-face-announce-the-constellaration-challenge-help-us-optimize-the-future-of-fusion-energy-with-machine-learning,1,2025-07-31 10:39:39+00:00
44744229,Bret Victor – The Future of Programming [video],https://vimeo.com/71278954,2,2025-07-31 10:36:27+00:00
44744210,My Journey to Pure No-Code Addition (Spoiler: Plot Twist Ending),,4,2025-07-31 10:31:16+00:00
44744209,Arab states call on Hamas to disarm and relinquish power in unprecedented move,https://www.cnn.com/2025/07/30/middleeast/arab-league-hamas-gaza-israel-intl,18,2025-07-31 10:31:11+00:00
44744202,GDAL: Geospatial Data Abstraction Library,https://gdal.org/en/stable/index.html,11,2025-07-31 10:29:24+00:00
44744195,The Bull Market for Economists Is Over. It's an Ominous Sign for the Economy,https://www.nytimes.com/2025/07/28/business/economics-jobs-hiring.html,3,2025-07-31 10:27:23+00:00
44744161,Proton Authenticator – new free 2FA app by Proton,https://proton.me/blog/authenticator-app,14,2025-07-31 10:19:11+00:00
44744143,Show HN: Winamp Style Web Audio Visualizer,https://audio-viz.soundshed.com/,2,2025-07-31 10:15:24+00:00
44744121,Why leather is best motorcycle protection [video],https://www.youtube.com/watch?v=xwuRUcAGIEU,219,2025-07-31 10:10:52+00:00
44744119,Top Anti-Tracking Extensions,https://addons.mozilla.org/blog/top-anti-tracking-extensions/,3,2025-07-31 10:10:01+00:00
44744108,Show HN: Built a daily trivia challenge: Same 10 questions worldwide daily,https://apps.apple.com/gb/app/qwiz-daily-quiz-trivia-game/id6747268704,1,2025-07-31 10:09:04+00:00
44744096,Hawley and Democrats vote to advance congressional stock trading ban,https://www.cbsnews.com/news/hawley-democrats-vote-stock-trading-ban-committee/,191,2025-07-31 10:07:19+00:00
44744079,How to trigger a command on Linux when power switches from AC to battery,https://dataswamp.org/~solene/2025-05-31-linux-killswitch-on-power-disconnect.html,81,2025-07-31 10:03:54+00:00
44744075,Neko: Open-source self-hosted virtual browser,https://github.com/m1k1o/neko,2,2025-07-31 10:02:40+00:00
44744064,Why Vikunja is moving from Gitea to GitHub,https://vikunja.io/changelog/moving-to-github/,1,2025-07-31 10:00:07+00:00
44744050,The Mechanical Transmission of Power: Endless Rope Drives,https://solar.lowtechmagazine.com/2013/03/the-mechanical-transmission-of-power-3-endless-rope-drives/,4,2025-07-31 09:58:19+00:00
44744041,Show HN: I built an extension that let AI controls my web browser,https://browserfly.app/,2,2025-07-31 09:57:08+00:00
44744028,Helsinki goes a full year without a traffic death,https://yle.fi/a/74-20174831,6,2025-07-31 09:54:30+00:00
44744027,Show HN: I built a structured directory to compare AI coding tools,https://aiforcode.io/,1,2025-07-31 09:53:16+00:00
44744025,Ask HN: Am I wasting my time applying for jobs in the US?,,2,2025-07-31 09:53:09+00:00
44744020,The relentless race for AI capacity (ft.com),https://ig.ft.com/ai-data-centres/,1,2025-07-31 09:51:33+00:00
44744010,Precompiled React Native for iOS: Faster builds are coming in 0.81,https://expo.dev/blog/precompiled-react-native-for-ios,1,2025-07-31 09:49:55+00:00
44744004,The weight-loss drug that also shrinks breast tumors in mice,https://www.sciencedaily.com/releases/2025/07/250713031436.htm,2,2025-07-31 09:48:42+00:00
44744003,1984 Hudson Valley UFO Sightings,https://en.wikipedia.org/wiki/1984_Hudson_Valley_UFO_sightings,1,2025-07-31 09:48:29+00:00
44744001,Why Elon launched app companions,https://twitter.com/cyanblot/status/1950202900736569807,1,2025-07-31 09:48:14+00:00
44743972,Manifesto: Rules for Standards-Makers (2017),http://scripting.com/2017/05/09/rulesForStandardsmakers.html,1,2025-07-31 09:42:34+00:00
44743966,Did pihole mail donation list got leaked?,https://discourse.pi-hole.net/t/did-pihole-mail-donation-list-got-leaked/81441,4,2025-07-31 09:41:55+00:00
44743947,Chesterton's Fence: A Lesson in Thinking (2022),https://fs.blog/chestertons-fence/,1,2025-07-31 09:38:48+00:00
44743923,Hard reality about AI mobile app developers,https://substack.com/home/post/p-169651454,1,2025-07-31 09:35:03+00:00
44743915,The Design and Implementation of Extensible Variants for Rust in CGP,https://contextgeneric.dev/blog/extensible-datatypes-part-4/,5,2025-07-31 09:33:16+00:00
44743909,Show HN: Open-source self-hosted LLM comparison tool for your own prompt,https://github.com/stashlabs/duelr,2,2025-07-31 09:31:33+00:00
44743902,Show HN: When Intelligence Becomes a Trap: A Wake-Up Call for the AI Industry,https://everydayai.top/,1,2025-07-31 09:29:41+00:00
44743894,Load Balancing AI/ML API with Apache Apisix,https://apisix.apache.org/blog/2025/07/31/load-balancing-between-ai-ml-api-with-apisix/,5,2025-07-31 09:26:44+00:00
44743888,"Public Perspectives on AI Governance: Survey of Adults in CA, Illinois, and NY",https://zenodo.org/records/16566059,1,2025-07-31 09:25:01+00:00
44743883,Claude Code and Tinder = 10 Dates in a Week,https://www.reddit.com/r/ClaudeCode/s/4FNn4ftdLj,6,2025-07-31 09:24:35+00:00
44743867,I built a design studio for people who can't design (like me),https://glowupshot.com,2,2025-07-31 09:21:54+00:00
44743865,Supply-chain attacks on open source software are getting out of hand,https://arstechnica.com/security/2025/07/open-source-repositories-are-seeing-a-rash-of-supply-chain-attacks/,5,2025-07-31 09:21:37+00:00
44743856,Agentic Coding Things That Didn't Work,https://lucumr.pocoo.org/2025/7/30/things-that-didnt-work/,3,2025-07-31 09:20:08+00:00
44743818,RIP Amazon QLDB,https://news.alvaroduran.com/p/if-amazon-cant-figure-out-how-to,2,2025-07-31 09:15:01+00:00
44743817,General availability of Amazon EC2 G6f instances with fractional GPUs,https://aws.amazon.com/about-aws/whats-new/2025/07/amazon-ec2-g6f-instances-fractional-gpus/,4,2025-07-31 09:14:58+00:00
44743789,Show HN: Add Travel Time – Auto Travel Time in Google Calendar,https://www.addtraveltime.com,2,2025-07-31 09:08:37+00:00
44743785,Show HN: Handelsregister.ai – Dev-friendly API for the German business registry,https://handelsregister.ai/de,2,2025-07-31 09:07:25+00:00
44743754,AI-Designed Enzymes Break Down Plastic in Hours,https://earth.org/plastic-eating-enzyme/,3,2025-07-31 09:00:45+00:00
44743729,Sharding Postgres at Network Speed,https://pgdog.dev/blog/sharding-postgres-at-network-speed,2,2025-07-31 08:56:15+00:00
44743720,KIRA project launches Germany's first autonomous public transport shuttles,https://urban-mobility-observatory.transport.ec.europa.eu/news-events/news/kira-project-launches-germanys-first-autonomous-public-transport-shuttles-2025-06-13_en,2,2025-07-31 08:54:15+00:00
44743713,Claude Code: My Most Trusted Coworker and My Worst Enemy,https://lopezb.com/articles/claude-code-my-most-trusted-coworker-and-my-worst-enemy,3,2025-07-31 08:53:34+00:00
44743687,Lethal Cambodia-Thailand border clash linked to cyber-scam slave camps,https://www.theregister.com/2025/07/31/thai_cambodia_war_cyberscam_links/,7,2025-07-31 08:48:31+00:00
44743686,"Ask HN: How do you measure ""AI slop""?",,4,2025-07-31 08:48:29+00:00
44743673,Agntcy: Building Infrastructure for the Internet of Agents,https://agntcy.org,3,2025-07-31 08:45:34+00:00
44743652,Gödel: The Limits of Logic and the Foundations of Modern Mathematics,https://quantumzeitgeist.com/godels-incompleteness-theorems/,2,2025-07-31 08:41:03+00:00
44743643,Categorising My Daily Todo List with Deepseek-R1,https://www.bentasker.co.uk/posts/blog/software-development/ai-todo-list-categorisation.html,2,2025-07-31 08:39:15+00:00
44743641,Dine and dash mental health toll on restaurant staff,https://www.bbc.co.uk/news/articles/cjd24ky4818o,1,2025-07-31 08:38:54+00:00
44743640,LangExtract: A Gemini powered information extraction library,https://developers.googleblog.com/en/introducing-langextract-a-gemini-powered-information-extraction-library/,2,2025-07-31 08:38:48+00:00
44743631,"C++: ""model of the hardware"" vs. ""model of the compiler"" (2018)",http://ithare.com/c-model-of-the-hardware-vs-model-of-the-compiler/,32,2025-07-31 08:36:36+00:00
44743624,If the Coronation of Charles II Had Event Marketing,https://www.youtube.com/watch?v=MtJvrjiSmds,1,2025-07-31 08:35:11+00:00
44743609,Dificulties with development of anonymous location bsed chat App,http://158.101.167.252/dificulties-with-development-of-anonymous-location-bsed-chat-app/,2,2025-07-31 08:31:36+00:00
44743603,I Built a Modern CSS Formatter to Replace CSSComb,https://n8d.at/old-fashioned-css-formatter-a-modern-successor-to-csscomb/,2,2025-07-31 08:31:16+00:00
44743588,Leaving LinkedIn,https://www.onepict.com/20250730-linkedin.html,2,2025-07-31 08:28:22+00:00
44743587,Printer Tracking Dots,https://en.wikipedia.org/wiki/Printer_tracking_dots,4,2025-07-31 08:28:20+00:00
44743543,Requests for Startups F25,https://www.ycombinator.com/rfs,3,2025-07-31 08:21:11+00:00
44743542,Web Scraping Challenges: 12 Barriers and How to Beat Them,https://whoerip.com/blog/web-scraping-challenges/,1,2025-07-31 08:21:05+00:00
44743538,Our Small Agency Generated 11 Tons of CO2 Using AI–Here's Our Next Step,https://www.davidlambauer.de/how-discovering-our-ais-co2-impact-changed-my-perspective/,1,2025-07-31 08:20:33+00:00
44743524,Invincible Title Card Generator,https://www.invincibletitlecardgenerator.com/,2,2025-07-31 08:19:10+00:00
44743516,MyUniverse,https://myuniverse-zche.onrender.com/,1,2025-07-31 08:17:50+00:00
44743513,Woman Who Died of Heart Disease in ICE Custody Wasn't Allowed to See Doctor,https://reason.com/2025/07/30/woman-who-died-of-heart-disease-in-ice-custody-reportedly-told-son-she-wasnt-allowed-to-see-doctor-for-chest-pains/,20,2025-07-31 08:17:10+00:00
44743494,Zigzag Number Spiral,https://susam.net/zigzag-number-spiral.html,1,2025-07-31 08:12:47+00:00
44743481,Trump Administration Pushes for Clear Crypto Rules in New Report,,1,2025-07-31 08:09:55+00:00
44743479,Labubu,https://en.wikipedia.org/wiki/Labubu,2,2025-07-31 08:09:43+00:00
44743474,Gerald Jay Sussman on Flexible Systems (2021) [video],https://www.youtube.com/watch?v=JbyAcZf6tds,1,2025-07-31 08:08:12+00:00
44743464,Show HN: VibeTree – Parallel Claude coding with Git worktrees,https://github.com/sahithvibudhi/vibe-tree,2,2025-07-31 08:05:51+00:00
44743461,A5 Geospatial Index,https://github.com/felixpalmer/a5-py,2,2025-07-31 08:05:16+00:00
44743456,Mounting the Atmosphere,https://oppi.li/posts/mounting_the_atmosphere/,3,2025-07-31 08:04:25+00:00
44743437,AWS and Meta launching startup program for open-source LLMs (Llama),https://aws.amazon.com/startups/lp/llama-for-aws-startups,3,2025-07-31 08:00:43+00:00
44743435,"Raspberry Pi RP2350 fixes E9, glitching, introduces 2MB flash variant",https://www.cnx-software.com/2025/07/29/raspberry-pi-rp2350-a4-stepping-fixes-e9-gpio-erratum-9-glitching-bugs-introduces-2mb-flash-variants/,8,2025-07-31 08:00:30+00:00
44743432,Double-slit experiment holds up when stripped to its quantum essentials,https://news.mit.edu/2025/famous-double-slit-experiment-holds-when-stripped-to-quantum-essentials-0728,96,2025-07-31 08:00:19+00:00
44743424,From zero to RAG engineer: 1200 hours of lessons so you don't repeat my mistakes,https://bytevagabond.com/post/how-to-build-enterprise-ai-rag,7,2025-07-31 07:59:09+00:00
44743423,Amazon has invested in an AI startup that lets people make TV episodes,https://variety.com/2025/digital/news/netflix-of-ai-amazon-invests-fable-showrunner-launch-1236471989/,2,2025-07-31 07:59:08+00:00
44743409,"A World of Misery, from 200 Miles Up",https://www.nytimes.com/2025/07/29/world/middleeast/gaza-satellite-aid-truck-famine.html,3,2025-07-31 07:54:59+00:00
44743403,Xi Jinping is the main thing holding China back,https://www.noahpinion.blog/p/xi-jinping-is-the-main-thing-holding,3,2025-07-31 07:53:49+00:00
44743399,GuideToDocs – Auto-generate step-by-step Google Docs guides from user actions,https://chromewebstore.google.com/detail/step-by-step-instructions/chbmbnnlhmhmlipoeghildpfhhlehfpm,2,2025-07-31 07:53:45+00:00
44743398,Army Secretary forces West Point to rescind appointment given to Easterly,https://cyberscoop.com/jen-easterly-west-point-mcdermott-chair-laura-loomer-dan-driscoll-army/,3,2025-07-31 07:53:42+00:00
44743397,Decant,https://www.benpickles.com/articles/95-introducing-decant,3,2025-07-31 07:53:29+00:00
44743393,Getting Started with Jax for ML,https://docs.jaxstack.ai/en/latest/getting_started.html,1,2025-07-31 07:51:52+00:00
44743392,Laravel Multidomain Package for Multi-Tenancy [video],https://www.youtube.com/watch?v=6kMM072Wxq0,1,2025-07-31 07:51:44+00:00
44743389,Figma-S-1,https://www.sec.gov/Archives/edgar/data/1579878/000162828025033742/figma-sx1.htm,2,2025-07-31 07:51:17+00:00
44743384,Redue: It can be unscrambled to form 18 valid words,https://wordsdescrambler.com/unscramble/redue/,2,2025-07-31 07:49:43+00:00
44743375,AI Background Removal and Change – Aichangebackground,https://aichangebackground.com,1,2025-07-31 07:48:24+00:00
44743372,Ask HN: How do you use your work computer in times of Crowdsrtrike?,,1,2025-07-31 07:47:40+00:00
44743362,The Criminal Enterprise Run by Monkeys,https://www.wsj.com/lifestyle/monkeys-thieves-bali-temple-0b63a432,2,2025-07-31 07:43:44+00:00
44743341,Supersized stick insect discovered in high-altitude trees in Australia,https://www.theguardian.com/environment/2025/jul/31/big-stick-insect-acrophylla-alta-found-north-queensland-trees,6,2025-07-31 07:40:39+00:00
44743328,I built my blog with C preprocessor macros,https://wheybags.com/blog/macroblog.html,3,2025-07-31 07:39:15+00:00
44743306,Decoding Zuck's Superintelligence Memo,https://om.co/2025/07/30/decoding-zucks-superintelligence-memo/,4,2025-07-31 07:34:46+00:00
44743289,Startup? More Like Standup,,1,2025-07-31 07:30:16+00:00
44743280,How to Bypass Yandex Smart Captcha Easily? Find Out Now,https://whoerip.com/blog/how-to-bypass-yandex-smart-captcha/,2,2025-07-31 07:27:07+00:00
44743273,Teach AI your name through someone it trusts,https://lauradecastro.substack.com/p/teach-ai-your-name-through-someone,1,2025-07-31 07:26:01+00:00
44743253,Windows 7 God Mode,https://learn.microsoft.com/en-us/answers/questions/2447533/windows-7-god-mode,2,2025-07-31 07:20:49+00:00
44743249,EES digital border checks: start date officially confirmed,https://www.connexionfrance.com/news/ees-digital-border-checks-start-date-officially-confirmed/737190,2,2025-07-31 07:20:21+00:00
44743235,Pi-hole – Compromised Donor Emails: A post-mortem,https://pi-hole.net/blog/2025/07/30/compromised-donor-emails-a-post-mortem/,5,2025-07-31 07:17:38+00:00
44743225,First NHS AI-run physio clinic in England halves back-pain waiting list,https://www.theguardian.com/society/2025/jul/31/nhs-first-ai-run-physio-clinic-in-england-halves-back-pain-waiting-list,3,2025-07-31 07:16:28+00:00
44743217,Files Are Living Rent-Free in Someone's Cloud Forever (and That's Weird),https://medium.com/@jenni_emeka/your-files-are-living-rent-free-in-someones-cloud-forever-and-that-s-weird-315899277e81,1,2025-07-31 07:15:26+00:00
44743213,Delta's AI-based price-gouging,https://pluralistic.net/2025/07/30/efficiency-washing/#medallion-clubbed,3,2025-07-31 07:15:02+00:00
44743207,Psychologists simulate ghosting–and reveal why it's so damaging,https://www.psypost.org/psychologists-simulate-ghosting-and-reveal-why-its-so-damaging/,8,2025-07-31 07:14:23+00:00
44743202,Build Your Own Minisforum N5 Inspired Mini NAS: A Comprehensive Guide,https://jackharvest.com/index.php/2025/07/27/build-your-own-minisforum-n5-inspired-mini-nas-a-comprehensive-guide/,2,2025-07-31 07:13:47+00:00
44743163,Meta brought AI to rural Colombia. Now students are failing exams,https://restofworld.org/2025/colombia-meta-ai-education/,11,2025-07-31 07:07:06+00:00
44743151,Takotsubo Cardiomyopathy,https://en.wikipedia.org/wiki/Takotsubo_cardiomyopathy,2,2025-07-31 07:04:24+00:00
44743134,Confirmed that OpenRouter's new stealth model originates from OpenAI,https://old.reddit.com/r/RooCode/comments/1mduo94/confirmed_that_openrouters_new_stealth_model/,1,2025-07-31 07:01:49+00:00
44743132,Formal Inertia,https://daedeluskite.com/2025/07/31/formal-inertia/,1,2025-07-31 07:01:36+00:00
44743128,Vibe Coding but not what you think,https://amritpandey.io/vibe-coding-but-not-what-you-think/,2,2025-07-31 07:00:19+00:00
44743127,Customer guidance for SharePoint vulnerability CVE-2025-53770,https://msrc.microsoft.com/blog/2025/07/customer-guidance-for-sharepoint-vulnerability-cve-2025-53770/,2,2025-07-31 07:00:17+00:00
44743126,Areweloongyet.com – Tracking Software Support for Loongson's LoongArch ISA,https://areweloongyet.com/,6,2025-07-31 06:59:59+00:00
44743115,Has AI coding gone too far? I feel like I'm losing control of my own projects,,14,2025-07-31 06:58:12+00:00
44743107,"New Hidden State of Matter Could Make Computers 1,000x Faster",https://www.popularmechanics.com/science/a65531679/hidden-metallic-state/,6,2025-07-31 06:57:14+00:00
44743068,Matryoshka Representation Learning,https://arxiv.org/abs/2205.13147,6,2025-07-31 06:50:35+00:00
44743058,How Science may help us smell the past (2017),https://cen.acs.org/articles/95/i47/science-help-us-smell-past.html,2,2025-07-31 06:49:13+00:00
44743056,Turkish social media platform is breaching Mastodon's open source license,https://twitter.com/joinmastodon/status/1950153599108919717,4,2025-07-31 06:49:08+00:00
44743040,The Edge of Competence,https://ordep.dev/posts/circle-of-competence,2,2025-07-31 06:46:18+00:00
44743035,Working with AI: Measuring the Occupational Implications of Generative AI,https://arxiv.org/abs/2507.07935,1,2025-07-31 06:45:04+00:00
44743034,Caches: LRU vs. Random,https://danluu.com/2choices-eviction/,112,2025-07-31 06:45:02+00:00
44743015,Oikon brings leading bird protection technologies to wind farms in SE Europe,https://oikon.hr/oikon-brings-world-leading-bird-protection-technologies-to-wind-farms-in-southeast-europe/,2,2025-07-31 06:42:44+00:00
44743010,Show HN: Fine tuning and RLHF mistralai 7B using DeepSpeed,https://github.com/genji970/mistralai-7B_training_using_DeepSpeed,1,2025-07-31 06:40:59+00:00
44743008,The tiny mouse lemur could make for a mighty model organism,https://www.nature.com/articles/d41586-025-01584-0,7,2025-07-31 06:40:19+00:00
44742980,Notes on Coding in 2025,https://alexanderweichart.de/5_Archive/1.-Projects/Notes/Notes-on-Coding-in-2025,2,2025-07-31 06:35:27+00:00
44742976,We built a browser extension for local LLMs with Ollama,https://github.com/NativeMindBrowser/NativeMindExtension,4,2025-07-31 06:35:15+00:00
44742943,Alive AI,,4,2025-07-31 06:31:10+00:00
44742937,Trump Announces Plan T Launch Private Health Tracking System with Big Tech Firms,https://time.com/7306647/trump-health-data-medical-records/,1,2025-07-31 06:29:59+00:00
44742901,Coldwire Post-Quantum Messenger,,1,2025-07-31 06:24:13+00:00
44742873,ChironX: Open-Source AI Guitar Coach Using Gemini Vision and TTS (Github.com),https://github.com/saurabh-yergattikar/ChironX,1,2025-07-31 06:20:50+00:00
44742871,The ArmSoM Forge1,https://taoofmac.com/space/reviews/2025/07/26/2145,2,2025-07-31 06:20:37+00:00
44742868,Do We Have Data to Train New AI?,https://labs.adaline.ai/p/do-we-have-data-to-train-new-ai,1,2025-07-31 06:20:29+00:00
44742863,My Take on the iPadOS 26 Beta,https://taoofmac.com/space/blog/2025/07/25/2200,4,2025-07-31 06:20:08+00:00
44742853,An Open Source Stack for AI Compute: Kubernetes and Ray and PyTorch and VLLM,https://www.anyscale.com/blog/ai-compute-open-source-stack-kubernetes-ray-pytorch-vllm,1,2025-07-31 06:18:13+00:00
44742818,Harnessing Large Language Models to Overcome Challenges in Recommender Systems,https://old.reddit.com/r/LLMDevs/comments/1mdtfnm/survey_how_llms_are_transforming_recommender/,1,2025-07-31 06:12:48+00:00
44742801,Warner Bros. Lays Off 10% of Motion Picture Group,https://variety.com/2025/film/news/warner-bros-layoffs-motion-picture-group-1236474652/,5,2025-07-31 06:09:35+00:00
44742793,YouTube to gauge US users' ages with AI after UK and Australia add age checks,https://www.theguardian.com/technology/2025/jul/30/youtube-google-ai-age-verification,4,2025-07-31 06:08:16+00:00
44742784,SO_KEEPALIVE Slow (?) on macOS,https://defn.io/2025/07/31/so-keepalive-slow-on-macos/,3,2025-07-31 06:06:34+00:00
44742780,Building Query Compilers [pdf],https://pi3.informatik.uni-mannheim.de/~moer/querycompiler.pdf,2,2025-07-31 06:06:01+00:00
44742779,Wall Street delighted with Microsoft as it spends $100B on AI,https://www.theguardian.com/technology/2025/jul/30/microsoft-q2-2025-earnings,3,2025-07-31 06:05:48+00:00
44742768,Zuckerberg: 'superintelligence is now in sight' as Meta lavishes billions on AI,https://www.theguardian.com/technology/2025/jul/30/zuckerberg-superintelligence-meta-ai,9,2025-07-31 06:03:54+00:00
44742743,Safe Object-Oriented Software: The Verified Design-by-Contract Paradigm [pdf],https://www.eschertech.com/papers/safe_oo_software.pdf,2,2025-07-31 05:58:36+00:00
44742736,Show HN: DevNotify – Track Your Starred GitHub Repos and Issues (Open Source),https://devnotify.in,4,2025-07-31 05:58:17+00:00
44742734,32-bit float audio recording is not a panacea,https://wadetregaskis.com/32-bit-float-audio-recording-is-not-a-panacea/,2,2025-07-31 05:58:17+00:00
44742725,Sneaking into the Spy Museum's New Vault,https://www.nytimes.com/2025/07/31/arts/international-spy-museum-vault-washington.html,2,2025-07-31 05:57:28+00:00
44742720,The dirty tricks of reputation management: from PI to sabotaging Google Search,https://jackpoulson.substack.com/p/dirty-tricks-reputation-management-blackman,14,2025-07-31 05:56:17+00:00
44742710,Show HN: AgentGuard – Auto-kill AI agents before they burn through your budget,https://github.com/dipampaul17/AgentGuard,47,2025-07-31 05:54:04+00:00
