id,title,url,points,created_at
43202642,The 'Elegant' Math Model That Could Help Rescue Coral Reefs,https://www.quantamagazine.org/the-elegant-math-model-that-could-help-rescue-coral-reefs-20250226/,2,2025-02-28 07:11:23+00:00
43202608,Bring Silent Videos to Life Sounds(Open-Source),https://github.com/open-mmlab/FoleyCrafter,14,2025-02-28 07:05:23+00:00
43202603,AMD in Everything,https://world.hey.com/dhh/amd-in-everything-0ec0cc6e,2,2025-02-28 07:04:31+00:00
43202601,Why Rich People Don't Cover Their Windows,https://www.theatlantic.com/family/archive/2024/01/uncovered-windows-curtains-wealthy-neighborhoods/677204/,8,2025-02-28 07:03:49+00:00
43202581,I use LLMs (Andrej Karpathy) [video],https://www.youtube.com/watch?v=EWvNQjAaOHw,5,2025-02-28 07:01:15+00:00
43202566,Show HN: Skill Path to Run Any Databases on Kubernetes,https://labs.iximiuz.com/skill-paths/kubeblocks-skill-path-1f1a0a29,6,2025-02-28 06:58:33+00:00
43202565,Microsoft is finally adding the ability to show battery percentage on taskbar,https://www.windowscentral.com/software-apps/windows-11/microsoft-is-finally-adding-a-highly-requested-feature-to-the-taskbar-on-windows-11,4,2025-02-28 06:57:54+00:00
43202545,Vector Calculus – Robert Ghrist [Calculus Blue Vol:1] [video],https://www.youtube.com/watch?v=6aoX9rOyw3Y&list=PL8erL0pXF3JYm7VaTdKDaWc8Q3FuP8Sa7&index=2,2,2025-02-28 06:55:32+00:00
43202529,Show HN: Building the First Integrated Reasoning Framework (IRF),https://suada.ai,1,2025-02-28 06:52:40+00:00
43202503,"Show HN: Flappy Ball, my vibecoded game flappybird inspired using Claude 3.5",https://flappyball.sawirstudio.com,1,2025-02-28 06:48:15+00:00
43202491,Speech-to-Code: Vibe Coding with Voice,https://addyo.substack.com/p/speech-to-code-vibe-coding-with-voice,2,2025-02-28 06:46:08+00:00
43202453,What makes marking unfair? Look harder at validity,https://heatherfblog.wordpress.com/2024/10/12/what-makes-marking-unfair-look-harder-at-validity/,1,2025-02-28 06:39:41+00:00
43202447,Pitch Hubert,https://pitchhubert.com/,1,2025-02-28 06:38:44+00:00
43202428,Kagi Small Web (2023),https://blog.kagi.com/small-web,3,2025-02-28 06:35:38+00:00
43202399,"Guardian Interview, 1974: In-demand Gene Hackman resists 'the star thing'",https://www.theguardian.com/film/2025/feb/27/gene-hackman-resists-the-star-thing-interview-1974,1,2025-02-28 06:31:13+00:00
43202384,The Center for US Army Lessons Learned (2007),https://www.thisamericanlife.org/333/the-center-for-lessons-learned,2,2025-02-28 06:28:43+00:00
43202369,"The three-dimensional Kakeya conjecture, after Wang and Zahl",https://terrytao.wordpress.com/2025/02/25/the-three-dimensional-kakeya-conjecture-after-wang-and-zahl/,1,2025-02-28 06:26:27+00:00
43202367,Ask HN: Interactive Demonstration of Video Codec,,1,2025-02-28 06:26:19+00:00
43202355,Docker Registry Outage,,3,2025-02-28 06:24:07+00:00
43202283,Astroscale aced the first rendezvous with a piece of space junk,https://arstechnica.com/space/2025/02/astroscale-aced-the-worlds-first-rendezvous-with-a-piece-of-space-junk/,2,2025-02-28 06:13:14+00:00
43202281,Citigroup credits account with $81tn instead of $280,https://www.ft.com/content/9921925e-5a32-48cc-a3e3-3f77042477d2,37,2025-02-28 06:12:55+00:00
43202279,Belief State Transformer,https://arxiv.org/abs/2410.23506,1,2025-02-28 06:12:32+00:00
43202269,Show HN: Bluesky has no built-in analytics so I created them,https://www.caterpace.blue/index/,3,2025-02-28 06:10:34+00:00
43202203,Ask HN: What's your take on candidates using AI assistants during interviews?,https://www.interviewninja.io/,2,2025-02-28 06:01:46+00:00
43202198,360XSS: Mass Website Exploitation via Virtual Tour Framework for SEO Poisoning,https://olegzay.com/360xss/,4,2025-02-28 06:01:04+00:00
43202186,The Limits of Mathematics – Gregory Chaitin [1994],https://arxiv.org/pdf/chao-dyn/9407003,3,2025-02-28 05:58:37+00:00
43202164,Why aren't there (great) Design to Code tools?,,1,2025-02-28 05:54:51+00:00
43202145,Why US Navy ships are rusty,https://twitter.com/johnkonrad/status/1895297478968160301,1,2025-02-28 05:52:02+00:00
43202128,The Perceptron,https://www.youtube.com/watch?v=l-9ALe3U-Fg,1,2025-02-28 05:49:36+00:00
43202076,How I convinced my k8s team to go AWS serverless,https://medium.com/@dnsearching/how-i-convinced-my-k8s-team-to-go-aws-serverless-5104e880e7a4,1,2025-02-28 05:36:37+00:00
43202072,Grok Predicts Winner of 1976 Steelers vs. 1985 Bears,,1,2025-02-28 05:36:07+00:00
43202067,Kindness Is Achievement: The Surprising Value of GPT-4.5,https://amoy-tech.com/blog/id/5970,2,2025-02-28 05:34:57+00:00
43202061,Tiny script analyizes Google Cloud Storage and applies changes to save $,https://github.com/marclipovsky/GCS-Cost-Optimizer,2,2025-02-28 05:33:56+00:00
43202052,Microsoft is killing Skype,https://www.windowscentral.com/microsoft/microsoft-is-reportedly-killing-skype-after-14-years-of-neglect,751,2025-02-28 05:31:49+00:00
43202017,Instagram Flooded Feeds with Gore. 'Sorry' Doesn't Cut It,https://www.bloomberg.com/opinion/articles/2025-02-27/instagram-flooded-feeds-with-gore-sorry-doesn-t-cut-it,7,2025-02-28 05:26:26+00:00
43201995,Boss Wants You Back in the Office. This Surveillance Tech Could Be Waiting,https://www.wired.com/story/your-boss-wants-you-back-in-the-office-this-surveillance-tech-could-be-waiting-for-you/,5,2025-02-28 05:22:35+00:00
43201974,Microsoft begins turning off uBlock Origin and other extensions in Edge,https://www.neowin.net/news/microsoft-begins-turning-off-ublock-origin-and-other-extensions-in-edge/,787,2025-02-28 05:20:13+00:00
43201950,Google Tweak Creates Crisis for Product-Review Sites,https://www.wsj.com/business/media/google-search-change-product-recommendation-websites-02394b79,1,2025-02-28 05:15:44+00:00
43201938,"FAA targeting Verizon contract in favor of Musk's Starlink, sources say",https://www.washingtonpost.com/business/2025/02/26/musk-starlink-doge-faa-verizon/,4,2025-02-28 05:13:44+00:00
43201933,Command and Conquer Renegade – C&C Steam Workshop Support and Source Code,https://store.steampowered.com/news/app/2229890/view/502818210084553731,2,2025-02-28 05:13:09+00:00
43201904,WordSegments – a daily word challenge game,https://wordsegments.com/,2,2025-02-28 05:07:26+00:00
43201878,Show HN: Second cursor that guides users through any task,https://pointer.so/,7,2025-02-28 05:03:17+00:00
43201869,Mozilla introduces a Terms of Use agreement for Firefox,https://connect.mozilla.org/t5/discussions/information-about-the-new-terms-of-use-and-updated-privacy/m-p/87735#M33600,183,2025-02-28 05:00:44+00:00
43201859,Publish your site to the DWeb and transform it into a dynamic social profile,https://github.com/hyphacoop/distributed-press-cli,1,2025-02-28 04:58:22+00:00
43201851,Sustainable Software: Hacking Energy Waste One Line at a Time,https://devden.raghavan.studio/p/refactoring-for-earth-how-sustainable,1,2025-02-28 04:56:24+00:00
43201844,Show HN: Convert Emails into RSS feeds (open-source),https://github.com/yl8976/Email-to-RSS,2,2025-02-28 04:54:29+00:00
43201840,Fish 4.0.0,https://fishshell.com/docs/current/relnotes.html#fish-4-0-0-released-february-27-2025,2,2025-02-28 04:53:48+00:00
43201837,Mozilla's new Terms of Use causes confusion among Firefox users,https://www.ghacks.net/2025/02/27/mozillas-new-terms-of-use-causes-confusion-among-firefox-users/,32,2025-02-28 04:53:13+00:00
43201829,"Show HN:GoBroker- A Unified Messaging Broker Lib for Go(RabbitMQ,Redis,AmazonMQ)",https://github.com/defensestation/gobroker,3,2025-02-28 04:51:38+00:00
43201790,Firefox changed it's privacy policy; can use all your input royalty-free,https://twitter.com/BrendanEich/status/1895231159040385198,10,2025-02-28 04:45:00+00:00
43201785,Read.cv Is Winding Down,https://read.cv/a-new-chapter,1,2025-02-28 04:44:07+00:00
43201782,US Attorney General Releases First Phase of Declassified Epstein Files,https://www.justice.gov/opa/pr/attorney-general-pamela-bondi-releases-first-phase-declassified-epstein-files,6,2025-02-28 04:43:47+00:00
43201754,FAA Aims to Boost Hiring of Air-Traffic Controllers and Update Its Technology,https://www.wsj.com/business/airlines/faa-aims-to-boost-hiring-of-air-traffic-controllers-update-technology-318f9397,1,2025-02-28 04:40:07+00:00
43201750,Musk Takes $2.4B Contract from Verizon to Give It to Starlink,https://www.jalopnik.com/1800988/elon-musk-takes-2-billion-contract-verizon-starlink/,41,2025-02-28 04:39:08+00:00
43201744,Chain of Draft: Thinking Faster by Writing Less,https://arxiv.org/abs/2502.18600,2,2025-02-28 04:38:11+00:00
43201732,"US authorities can see more than ever, with Big Tech as their eyes",https://proton.me/blog/big-tech-data-requests-surge,224,2025-02-28 04:35:47+00:00
43201724,What to know about the stock market (2007),https://betterexplained.com/articles/what-you-should-know-about-the-stock-market/,3,2025-02-28 04:33:50+00:00
43201720,Video encoding requires using your eyes,https://redvice.org/2025/encoding-requires-eyes/,92,2025-02-28 04:33:26+00:00
43201709,Google's Sergey Brin Asks Workers to Spend More Time in the Office,https://www.nytimes.com/2025/02/27/technology/google-sergey-brin-return-to-office.html,59,2025-02-28 04:31:33+00:00
43201693,Uv and Ray: Pain-Free Python Dependencies in Clusters,https://www.anyscale.com/blog/uv-ray-pain-free-python-dependencies-in-clusters,1,2025-02-28 04:28:14+00:00
43201682,Surgery implants tooth material in eye as scaffolding for lens,https://www.cbc.ca/radio/asithappens/tooth-in-eye-surgery-canada-1.7470626,152,2025-02-28 04:26:52+00:00
43201672,The Complete Guide to SaaS Pricing Strategy,https://tomtunguz.com/pricing-guide/,1,2025-02-28 04:24:31+00:00
43201666,Show HN: Zsh Command Completion for Simon Wilson's LLM CLI,https://github.com/eliyastein/llm-zsh-plugin,1,2025-02-28 04:23:57+00:00
43201656,Sending Signals Like Neurons Do (At the Edge of Chaos) [video],https://www.youtube.com/watch?v=4xE_7QSEQm8,1,2025-02-28 04:21:27+00:00
43201650,This NixOS maintainer's attitude is a great example of how not to behave,https://old.reddit.com/r/NixOS/comments/1izlte0/this_nixos_maintainers_attitude_is_a_great/,2,2025-02-28 04:20:39+00:00
43201634,Yet Another Form Builder,,1,2025-02-28 04:16:59+00:00
43201627,Ask HN: Best LLM Stack for Q&A over Internal PDFs?,,11,2025-02-28 04:16:25+00:00
43201617,Nix pragmatism: Nix-ld and envfs,https://fzakaria.com/2025/02/27/nix-pragmatism-nix-ld-and-envfs.html,1,2025-02-28 04:14:30+00:00
43201587,Mozilla Clarifies Firefox Data Collection with New Terms of Use,https://www.howtogeek.com/mozilla-firefox-terms-of-service-addition/,8,2025-02-28 04:07:09+00:00
43201574,Windows 11 pirates have a new and unlikely ally – Microsoft Copilot,https://www.windowscentral.com/software-apps/windows-11/windows-11-pirates-have-a-new-and-unlikely-ally-microsoft-copilot,9,2025-02-28 04:04:00+00:00
43201555,[dupe] Mount Vesuvius eruption turned a man's brain into glass,https://www.reuters.com/science/mount-vesuvius-eruption-turned-mans-brain-into-glass-heres-how-it-happened-2025-02-27/,1,2025-02-28 04:00:06+00:00
43201537,"A Review of the Quick Python Book, Fourth Edition",https://blog.miguelgrinberg.com/post/a-review-of-the-quick-python-book-fourth-edition,1,2025-02-28 03:56:37+00:00
43201496,The expert guide to taking control of your emotions,https://www.bbc.com/future/article/20250226-the-expert-guide-to-taking-control-of-your-emotions,3,2025-02-28 03:47:43+00:00
43201473,What are your biggest database pains?,,1,2025-02-28 03:42:58+00:00
43201460,Snowflake Launches AI Hub space for startups,,4,2025-02-28 03:41:21+00:00
43201417,macOS Tips and Tricks (2022),https://saurabhs.org/macos-tips,587,2025-02-28 03:34:14+00:00
43201390,Cloudflare Verification Loop Issues,https://forum.palemoon.org/viewtopic.php?t=32045,3,2025-02-28 03:29:46+00:00
43201389,Graph Transformers: What every data scientist should know [video],https://www.youtube.com/watch?v=wAYryx3GjLw,2,2025-02-28 03:29:43+00:00
43201388,Kirc – A tiny IRC client written in POSIX C99,https://github.com/mcpcpc/kirc,4,2025-02-28 03:29:39+00:00
43201372,Using ZFS with Automatic Snapshots,https://gist.github.com/ignaciogutierrez/c4331dc1328f6baa9667e3c9350848e1,2,2025-02-28 03:27:01+00:00
43201311,From Local to Global: How Mercari Japan Expanded to Taiwan in Just 8 Months,https://engineering.mercari.com/en/blog/entry/20250228-from-local-to-global-how-mercari-expanded-to-taiwan-in-just-8-months/,2,2025-02-28 03:16:33+00:00
43201309,Microsoft releases a Copilot app for Mac,https://www.theverge.com/news/621114/microsoft-copilot-app-macos-download,2,2025-02-28 03:16:03+00:00
43201308,Warp – The Intelligent Terminal,https://www.warp.dev,3,2025-02-28 03:15:20+00:00
43201251,A few words about indie app business,https://blog.charliemonroe.net/a-few-words-about-indie-app-business/,84,2025-02-28 02:59:24+00:00
43201209,The line scan video picture,https://writing.leafs.quest/programming-fun/line-scanner,3,2025-02-28 02:53:37+00:00
43201207,"Porting Doom to TypeScript Types Took 3.5T Lines, 90GB of RAM",https://www.tomshardware.com/video-games/porting-doom-to-typescript-types-took-3-5-trillion-lines-90gb-of-ram-and-a-full-year-of-work,5,2025-02-28 02:53:04+00:00
43201175,Mechanical Turk,https://en.wikipedia.org/wiki/Mechanical_Turk,4,2025-02-28 02:47:38+00:00
43201164,Hydrogen cyanide and acetylene detected in a brown dwarf,https://phys.org/news/2025-02-hydrogen-cyanide-acetylene-brown-dwarf.html,43,2025-02-28 02:46:44+00:00
43201159,Deadlock and Resource Leak Free Languages – Jules Jacobs [video],https://www.youtube.com/watch?v=cUUPdE5cz-Q,2,2025-02-28 02:46:02+00:00
43201146,New York City Littoral Common Brick Index,https://www.bricksnyc.com,1,2025-02-28 02:44:42+00:00
43201108,Meta fires around 20 employees for leaking confidential information,https://techcrunch.com/2025/02/27/meta-fires-around-20-employees-for-leaking-confidential-information/,5,2025-02-28 02:38:33+00:00
43201086,America Needs a National Service Program,https://letter.palladiummag.com/p/america-needs-a-national-service,6,2025-02-28 02:34:52+00:00
43201079,Becoming a Beer Sommelier Is Almost Impossible.,https://www.wsj.com/lifestyle/beer-sommelier-master-cicerone-brew-tasting-bd626d19,3,2025-02-28 02:34:07+00:00
43201076,Essential Work-from-Home Advice: Cheap and Easy Ergonomic Setups,https://www.fast.ai/posts/2020-08-06-ergonomics.html,13,2025-02-28 02:33:51+00:00
43201043,"By Deconstructing Buildings with Care, Materials Get a Second Life",https://reasonstobecheerful.world/by-deconstructing-buildings-with-care-materials-get-a-second-life/,2,2025-02-28 02:29:08+00:00
43201039,Nearby Supernova Left Footprints on the Cosmic-Ray Spectrum and Imprints on Life,https://iopscience.iop.org/article/10.3847/2041-8213/ada27a,9,2025-02-28 02:28:42+00:00
43201027,Family Office Wants Double-Digit% for Seed Capital with VC Buyout Clause,,1,2025-02-28 02:27:34+00:00
43201012,"Studio 5, The Stars: The 1961 short story that anticipated the issue of Gen AI",https://aroundscifi.us/en/studio-5-the-stars-ballards-1961-short-that-already-told-the-story-of-text-generating-ais/,2,2025-02-28 02:25:21+00:00
43201008,Think Toggles Are Dumb,https://www.paritybits.me/think-toggles-are-dumb/,2,2025-02-28 02:24:40+00:00
43201001,Putting Andrew Ng's OCR models to the test,https://www.runpulse.com/blog/putting-andrew-ngs-ocr-models-to-the-test,124,2025-02-28 02:24:04+00:00
43200970,Hubris: What are some notable instances of tech leaders exhibiting hubris?,https://www.perplexity.ai/search/define-hubris-what-are-some-no-h4IHvqBER7erJGalkuuoyw,2,2025-02-28 02:20:44+00:00
43200960,"Doc NTIA lead nominee criticizes ""woke"" and ""socialist"" fiber broadband subsidy",https://broadbandbreakfast.com/incoming-ntia-chief-doesnt-like-beads-fiber-preference-low-cost-mandates-2/,42,2025-02-28 02:18:55+00:00
43200956,Defense of FOSS licensing rests on the shoulders of a guy in Virginia,https://www.theregister.com/2025/02/27/adverse_appeals_court_ruling_could/,9,2025-02-28 02:18:43+00:00
43200904,Apple UK Privacy Fight over Encryption Is Noble but Shortsighted,https://www.bloomberg.com/opinion/articles/2025-02-26/apple-uk-privacy-fight-over-encryption-is-noble-but-shortsighted,5,2025-02-28 02:12:14+00:00
43200898,A journey through the hyper-political world of microchips,https://www.theguardian.com/technology/2025/feb/28/inside-the-mind-bending-tin-blasting-and-hyper-political-world-of-microchips,7,2025-02-28 02:11:23+00:00
43200876,A.I. and Vibecoding Helped Me to Create My Own Software,https://www.nytimes.com/2025/02/27/technology/personaltech/vibecoding-ai-software-programming.html,7,2025-02-28 02:08:43+00:00
43200872,"Copilot exposes private GitHub pages, some removed by Microsoft",https://arstechnica.com/information-technology/2025/02/copilot-exposes-private-github-pages-some-removed-by-microsoft/,12,2025-02-28 02:07:57+00:00
43200793,Smallpond – A lightweight data processing framework built on DuckDB and 3FS,https://github.com/deepseek-ai/smallpond,323,2025-02-28 01:56:35+00:00
43200724,Retro Ski Game,https://play.ikonpass.com,2,2025-02-28 01:48:11+00:00
43200705,Abrupt USAID contract terminations costing lives,https://www.nytimes.com/2025/02/27/health/usaid-contract-terminations.html,15,2025-02-28 01:45:31+00:00
43200679,3FS – a parallel file system from DeepSeek,https://twitter.com/deepseek_ai/status/1895279409185390655,18,2025-02-28 01:41:12+00:00
43200659,Why 26.6?,https://lists.nongnu.org/archive/html/freetype/2002-09/msg00076.html,2,2025-02-28 01:38:01+00:00
43200649,Ask HN: Extracting Data from Gmail into Spreadsheet,,1,2025-02-28 01:36:58+00:00
43200624,Judge Grants SEC Request to Halt Fraud Case Against Justin Sun [pdf],https://storage.courtlistener.com/recap/gov.uscourts.nysd.596044/gov.uscourts.nysd.596044.83.0.pdf,3,2025-02-28 01:32:32+00:00
43200611,Unenv – Node.js compatibility for any JavaScript runtime,https://github.com/unjs/unenv,2,2025-02-28 01:30:36+00:00
43200605,Britain advised by US insiders to reduce UK reliance on US military equipment,https://www.thetimes.com/uk/defence/article/6billion-increase-defence-spending-vfdg6kcd7,31,2025-02-28 01:29:51+00:00
43200604,"Welcome to Ladybird, a truly independent web browser",https://github.com/LadybirdBrowser/ladybird,994,2025-02-28 01:29:49+00:00
43200575,New Online LaTeX Editor,https://crixet.com/,4,2025-02-28 01:26:51+00:00
43200572,Fire-Flyer File System (3FS),https://github.com/deepseek-ai/3FS,361,2025-02-28 01:26:26+00:00
43200571,SpaceX: Dying Starlink Satellites Don't Always Burn Up,https://www.pcmag.com/news/spacex-actually-dying-starlink-satellites-dont-always-fully-burn-up,2,2025-02-28 01:26:11+00:00
43200563,How your Mac can update macOS when you don’t want it to,https://eclecticlight.co/2025/02/27/how-your-mac-can-update-macos-when-you-dont-want-it-to/,19,2025-02-28 01:25:04+00:00
43200562,200k weekly Waymo rides and counting,https://twitter.com/Waymo/status/1895189359600771169,1,2025-02-28 01:24:29+00:00
43200536,Show HN: Python micro event loop library (~250 LOC),https://gist.github.com/tarruda/5b8c19779c8ff4e8100f0b37eb5981ea,59,2025-02-28 01:18:58+00:00
43200524,Does iOS have sideloading yet?,https://doesioshavesideloadingyet.com/,129,2025-02-28 01:16:40+00:00
43200464,"Austerity Is Back, and More Dangerous Than Ever",https://www.project-syndicate.org/commentary/new-rationales-for-austerity-in-us-argentina-uk-by-mark-blyth-2025-02,6,2025-02-28 01:05:52+00:00
43200450,Markov Chains Explained Visually (2014),https://setosa.io/ev/markov-chains/,213,2025-02-28 01:03:59+00:00
43200412,APIs for CEX,https://bluvo.co,1,2025-02-28 00:56:46+00:00
43200411,Five-minute cement quality test could replace week-long standard,https://techxplore.com/news/2025-02-minute-cement-quality-week-standard.html,2,2025-02-28 00:56:31+00:00
43200409,"An epic treatise on scheduling, bug tracking, and triage (2017)",https://apenwarr.ca/log/20171213,1,2025-02-28 00:56:19+00:00
43200407,SEC – Staff Statement on Meme Coins,https://www.sec.gov/newsroom/speeches-statements/staff-statement-meme-coins,5,2025-02-28 00:56:13+00:00
43200401,TypeScript code extracted from the official Claude Code package by Anthropic,https://github.com/mandeep511/OpenAGI,2,2025-02-28 00:55:05+00:00
43200400,Crossing the uncanny valley of conversational voice,https://www.sesame.com/research/crossing_the_uncanny_valley_of_voice#demo,82,2025-02-28 00:55:00+00:00
43200396,The B^alpha Language,http://www.genericsinc.info/index.php,1,2025-02-28 00:54:29+00:00
43200395,Blender: Projects to Look Forward to in 2025,https://www.blender.org/development/projects-to-look-forward-to-2025/,1,2025-02-28 00:54:18+00:00
43200375,White House official pushes to axe Canada from Five Eyes intelligence group,https://www.ft.com/content/2dfa3c11-64a7-49f6-83df-939b8d1cfb8e,18,2025-02-28 00:50:57+00:00
43200374,Verizon could lose FAA contract to Elon Musk's Starlink – report,https://seekingalpha.com/news/4414587-verizon-faa-contract-elon-musk-spacex-starlink,9,2025-02-28 00:50:21+00:00
43200361,SEC halts fraud prosecution of Chinese national who sent Trump millions,https://popular.info/p/breaking-sec-halts-fraud-prosecution,20,2025-02-28 00:49:10+00:00
43200359,Fed Epstein's Black Book Names into Grok,https://www.documentcloud.org/documents/1508273-jeffrey-epsteins-little-black-book-redacted/,2,2025-02-28 00:48:48+00:00
43200353,Exploring the World of OTA Scams,https://bfore.ai/threats-on-the-move-exploring-the-world-of-ota-scams/,2,2025-02-28 00:47:51+00:00
43200337,'Cruel and thoughtless': Trump fires hundreds at US climate agency Noaa,https://www.theguardian.com/us-news/2025/feb/27/trump-noaa-cuts-climate,30,2025-02-28 00:45:43+00:00
43200332,"Tensara – Optimize, Benchmark, Repeat",https://tensara.org/,1,2025-02-28 00:44:41+00:00
43200313,"""Free"" Office for Windows is being trialed",https://office-watch.com/2025/free-office-for-windows-is-being-trialed/,16,2025-02-28 00:40:59+00:00
43200270,$1.5B ByBit Hack,https://www.ic3.gov/PSA/2025/PSA250226,2,2025-02-28 00:33:22+00:00
43200247,LyX is 30 years old,https://en.wikipedia.org/wiki/LyX,6,2025-02-28 00:27:48+00:00
43200246,Standup Comedy by Claude,https://gally.net/temp/20250225claudestandup2.html,4,2025-02-28 00:27:33+00:00
43200218,"Jeong Su-il, ex-North Korean spy turned Silk Road scholar, dies at 90",https://www.koreaherald.com/article/10429551,3,2025-02-28 00:24:20+00:00
43200198,0ptikube: Open Source Kubernetes visualization and optimization tool,https://www.0ptikube.dev/,2,2025-02-28 00:22:18+00:00
43200197,Metabase's New Embedded Analytics SDK for React,https://www.metabase.com/blog/introducing-embedded-analytics-sdk-for-react,3,2025-02-28 00:22:15+00:00
43200190,Show HN: Upplai – AI Feedback on Resumes and Cover Letters,https://you.uppl.ai/login?invitation=ycombinator,7,2025-02-28 00:21:21+00:00
43200179,Tesla Powerwall 3 Alternatives,https://www.virtuesolar.com/2025/02/17/tesla-powerwall-3-alternatives/,12,2025-02-28 00:20:29+00:00
43200151,Show HN: Dragondrop – a drag and drop visual UI editor for developers,https://dragondrop.app,3,2025-02-28 00:17:15+00:00
43200148,Mexico extradites 29 drug traffickers to the United States,https://english.elpais.com/international/2025-02-27/mexico-extradites-29-drug-traffickers-to-the-united-states-including-the-leaders-of-los-zetas.html,30,2025-02-28 00:16:40+00:00
43200138,Show HN: Multi-View Stereo Software for Rapid 3D Model Generation from 2D Images,https://github.com/fixstars/cuda-multi-view-stereo,2,2025-02-28 00:16:01+00:00
43200135,Postmortem: Big Games' Rise of Nations,https://web.archive.org/web/20120511073512/http://www.gamasutra.com/view/feature/131242/postmortem_big_huge_games_rise_.php?print=1,2,2025-02-28 00:15:33+00:00
43200110,"Whose liberties need protecting, Jeff?",https://lyz.substack.com/p/whose-liberties-need-protecting-jeff,4,2025-02-28 00:12:10+00:00
43200088,Airbnb founder Joe Gebbia joins DOGE,https://twitter.com/jgebbia/status/1895217230314410144,7,2025-02-28 00:09:18+00:00
43200065,"""When you upload or input information through Firefox, you grant us a license""",https://www.mozilla.org/en-US/about/legal/terms/firefox/,839,2025-02-28 00:05:31+00:00
43200062,DeepSeek's Promise and Peril: A Closer Look at Its AI Dominance,https://blueprinttovalue.substack.com/p/deepseeks-promise-and-peril-a-closer,2,2025-02-28 00:05:08+00:00
43200027,Mission in Nigeria: Protecting the Pangolin,https://english.elpais.com/international/2025-02-02/mission-in-nigeria-protecting-the-pangolin.html,3,2025-02-28 00:00:09+00:00
43200013,Meta is firing about 20 employees for leaking,https://www.theverge.com/labor/621059/meta-fires-20-employee-leakers,11,2025-02-27 23:58:03+00:00
43200012,Musl Libc: input-controlled out-of-bounds write primitive in iconv,https://www.openwall.com/lists/musl/2025/02/13/1,7,2025-02-27 23:57:59+00:00
43199989,Ignite Cookbook for React Native – Ignite Cookbook for React Native,https://ignitecookbook.com/,2,2025-02-27 23:54:56+00:00
43199988,Apple launches 'age assurance' tech as US states mull social media laws,https://www.reuters.com/technology/apple-launches-age-assurance-tech-us-states-mull-social-media-laws-2025-02-27/,3,2025-02-27 23:54:52+00:00
43199966,Deepnight.ai (YC W24) – Next generation of night vision with AI,https://deepnight.ai/,3,2025-02-27 23:51:59+00:00
43199945,'Go-to' anatomy atlas featuring corpses of Nazi victims revamped by cardiologist,https://www.timesofisrael.com/go-to-anatomy-atlas-featuring-corpses-of-nazi-victims-revamped-by-ucla-cardiologist/,2,2025-02-27 23:50:05+00:00
43199869,"Brian May: ""Nobody will be able to afford to make music"" under UK AI copyright",https://www.nme.com/news/music/queens-brian-may-claims-nobody-will-be-able-to-afford-to-make-music-if-monstrously-arrogant-tech-companies-continue-under-uk-governments-ai-copyright-rules-3841766,13,2025-02-27 23:41:47+00:00
43199862,Envisioning the Future of iOS Design,https://iosvisionos.framer.website/,4,2025-02-27 23:41:06+00:00
