id,title,url,points,created_at
44429217,GitHub billionth repo new owner,https://github.com/Red-Killer/shit,1,2025-06-30 23:58:59+00:00
44429192,Importance of context management in AI NPCs,https://walterfreedom.com/post.html?id=ai-context-management,60,2025-06-30 23:55:37+00:00
44429184,"Show HN: CeresAi, Create a Clone of Anyone",https://www.ceresai.xyz/,2,2025-06-30 23:53:53+00:00
44429182,Melbourne man discovers extensive model train network underneath house,https://www.sbs.com.au/news/article/i-was-shocked-melbourne-mans-unbelievable-find-after-buying-house/m4sksfer8,407,2025-06-30 23:53:42+00:00
44429172,Google Developer Search Appliance – Proxmox Port,https://archive.org/details/google-search-appliance-proxmox-40G-image-inside.tar,3,2025-06-30 23:52:57+00:00
44429116,Show HN: Local LLM Notepad – run a GPT-style model from a USB stick,https://github.com/runzhouye/Local_LLM_Notepad,40,2025-06-30 23:43:37+00:00
44429103,Doing My Day Job on Chimera Linux,https://www.wezm.net/v2/posts/2025/daily-driving-chimera-for-work/,10,2025-06-30 23:41:37+00:00
44429040,AI that answers questions without making you hate the internet,,3,2025-06-30 23:32:26+00:00
44429025,How do SO_REUSEADDR and SO_REUSEPORT differ?,https://stackoverflow.com/questions/14388706/how-do-so-reuseaddr-and-so-reuseport-differ,10,2025-06-30 23:30:26+00:00
44429017,Elon Musk says he'll form the 'America Party' if 'insane' spending bill passes,https://www.businessinsider.com/elon-musk-vows-create-america-party-trump-spending-bill-passes-2025-6,44,2025-06-30 23:29:19+00:00
44429009,MTPNet: Multi-Grained Target Perception for Unified Activity Cliff Prediction,https://github.com/ZishanShu/MTPNet,2,2025-06-30 23:27:46+00:00
44429007,Trump officials create searchable national citizenship database,https://www.theguardian.com/us-news/2025/jun/30/trump-citizenship-database,13,2025-06-30 23:27:26+00:00
44428998,"After nine years, Ninja has merged support for the GNU Make jobserver",https://thebrokenrail.com/2025/06/30/ninja-jobserver.html,1,2025-06-30 23:26:15+00:00
44428997,Killer whales groom each other with pieces of kelp,https://www.science.org/content/article/killer-whales-groom-each-other-pieces-kelp,98,2025-06-30 23:26:06+00:00
44428995,UN says infants face death as formula milk runs out,https://www.youtube.com/watch?v=9ZFfUIuFMso,4,2025-06-30 23:25:48+00:00
44428984,The Unseen Fury of Solar Storms,https://www.noemamag.com/the-unseen-fury-of-solar-storms/,3,2025-06-30 23:23:24+00:00
44428979,Saturated Fat and Cardiovascular Disease: Systematic Review (2025),https://www.jmaj.jp/detail.php?id=10.31662%2Fjmaj.2024-0324,1,2025-06-30 23:22:04+00:00
44428957,How to use AspireUpdate to update WordPress and plugins,https://wp-expert.ch/en/2025/06/30/how-to-use-aspireupdate-to-update-wordpress-and-plugins-through-the-repository-of-your-choice/,1,2025-06-30 23:17:57+00:00
44428927,On-Demand GPU Clusters – Spin up TCP clusters across cloud providers easily,https://gpus.exla.ai/,6,2025-06-30 23:13:40+00:00
44428922,"If you're using Microsoft Authenticator to store your passwords, don't",https://www.engadget.com/cybersecurity/if-youre-using-microsoft-authenticator-to-store-your-passwords-dont-225842265.html,11,2025-06-30 23:12:58+00:00
44428919,The Talk Show: 'The Cutting Edge Latest Supermodel',https://daringfireball.net/thetalkshow/2025/06/30/ep-426,1,2025-06-30 23:12:47+00:00
44428904,Honda launches its own reusable rocket,https://www.msn.com/en-us/money/other/honda-launches-and-lands-experimental-reusable-rocket-in-test/vi-AA1HEdER,2,2025-06-30 23:10:49+00:00
44428898,Show HN: Cursor for Fitness,https://apps.apple.com/us/app/forceai-ai-workout-generator/id6745457470,1,2025-06-30 23:09:34+00:00
44428892,Canon selphy cp1500 privacy concerns,,2,2025-06-30 23:09:01+00:00
44428871,Public release of W3C's 2025-2028 strategic objectives initiatives,https://www.w3.org/blog/2025/public-release-of-w3cs-2025-2028-strategic-objectives-initiatives/,5,2025-06-30 23:06:20+00:00
44428864,Supreme Court rebuffs bid to protect Coinbase user data from IRS,https://www.bloomberg.com/news/articles/2025-06-30/supreme-court-rebuffs-bid-to-protect-coinbase-user-data-from-irs,7,2025-06-30 23:05:05+00:00
44428837,Elon Musk Amicus Brief to US Supreme Court in Harper vs. IRS [pdf],https://www.supremecourt.gov/DocketPDF/24/24-922/354291/20250328152757690_Harper%20-%20AC%20Brief_final.pdf,3,2025-06-30 23:01:46+00:00
44428807,Unix Programmer's Manual (1971),http://cm.bell-labs.co/who/dmr/1stEdman.html,4,2025-06-30 22:57:26+00:00
44428788,Ask HN: Which skill do you believe will take the longest to be replaced by AI?,,13,2025-06-30 22:54:15+00:00
44428777,"Accounting maneuver hides $3.8T in red ink from Trump's 'big, beautiful bill'",https://finance.yahoo.com/news/how-a-gop-accounting-maneuver-hides-38-trillion-in-red-ink-from-trumps-big-beautiful-bill-160900268.html,10,2025-06-30 22:52:09+00:00
44428766,Pixelmator Pro Gets First Big Update Since Apple Bought It,https://petapixel.com/2025/06/30/pixelmator-pro-gets-first-big-update-since-apple-bought-it/,2,2025-06-30 22:51:03+00:00
44428749,There's Always a Third Way,https://ironicreality.bearblog.dev/theres-always-a-third-way/,2,2025-06-30 22:48:45+00:00
44428746,The Novelty of the Arpanet,https://twobithistory.org/2021/02/07/arpanet.html,32,2025-06-30 22:48:24+00:00
44428742,IRS defends mass summons of Coinbase financial records at First Circuit (2024),https://www.courthousenews.com/irs-defends-mass-summons-of-coinbase-financial-records-at-first-circuit/,3,2025-06-30 22:47:56+00:00
44428734,Neocambria,https://www.aleksagordic.com/blog/neocambria,3,2025-06-30 22:46:21+00:00
44428731,AI is Anti-Human (and assorted qualifications),https://njump.me/naddr1qqxnzde58yerxv3exycrsdpjqgsf03c2gsmx5ef4c9zmxvlew04gdh7u94afnknp33qvv3c94kvwxgsrqsqqqa28nmz2vk,34,2025-06-30 22:45:57+00:00
44428730,Show HN: Built a simple colour palette generator – would love feedback,https://colorpal-sage.vercel.app/,1,2025-06-30 22:45:55+00:00
44428728,The Zillow Blacklist is officially here,https://www.businessinsider.com/zillow-ban-blacklist-real-estate-listings-what-homebuyers-can-do-2025-6,6,2025-06-30 22:45:23+00:00
44428723,Welcome to the Era of Evals,https://twitter.com/BrendanFoody/status/1939764763485171948,2,2025-06-30 22:44:20+00:00
44428721,Can LA fire-proof itself?,https://www.bbc.com/future/article/20250626-can-la-fire-proof-itself,3,2025-06-30 22:43:43+00:00
44428709,BIG-Bench Extra Hard,https://arxiv.org/abs/2502.19187,1,2025-06-30 22:42:09+00:00
44428702,"SiliconFlow, one-stop AI platform for inference, fine-tune and custom deployment",https://www.siliconflow.com/,1,2025-06-30 22:40:03+00:00
44428674,"GPEmu: A GPU emulator for rapid, low-cost deep learning prototyping [pdf]",https://vldb.org/pvldb/vol18/p1919-wang.pdf,82,2025-06-30 22:37:06+00:00
44428669,Peter Thiel's Palantir poses a grave threat to Americans,https://www.theguardian.com/commentisfree/2025/jun/30/peter-thiel-palantir-threat-to-americans,41,2025-06-30 22:36:12+00:00
44428661,Non-opioid molecule relieves chronic pain for 3 weeks,https://medicalxpress.com/news/2025-06-opioid-molecule-anesthetic-relieving-chronic.html,5,2025-06-30 22:35:23+00:00
44428652,Chile's Queen Bees Take Flight as Global Guardians of Pollination,https://latinamericanpost.com/economy-en/chiles-queen-bees-take-flight-as-global-guardians-of-pollination/,4,2025-06-30 22:33:53+00:00
44428638,Earth Temperature Timeline (2016),https://xkcd.com/1732/,2,2025-06-30 22:31:42+00:00
44428631,The race to make AI as multilingual as Europe,https://thenextweb.com/news/making-multilingual-ai-in-europe,6,2025-06-30 22:30:36+00:00
44428622,Hobby shops: it's game over due to Quebec law [banning sale of EN-only wares],https://www.youtube.com/watch?v=_DyAvq7LE6A,2,2025-06-30 22:29:31+00:00
44428610,DOE Invites Experiments for Marvel Microreactor,https://spectrum.ieee.org/marvel-microreactor-department-of-energy,2,2025-06-30 22:27:45+00:00
44428600,Show HN: Convert Photo to Flat Cartoon Vector,https://vizbull.com/photo-to-cartoon-drawing-flat-painting,1,2025-06-30 22:26:26+00:00
44428573,So It Begins Is This a Real Band or AI? [video],https://www.youtube.com/watch?v=3Nlb-m_vKYM,4,2025-06-30 22:24:05+00:00
44428569,"I got an ambulance ride, CT scan and ER care in Brazil. My bill: $0",https://www.washingtonpost.com/world/2025/06/29/brazil-health-care-sus-hospitals/,19,2025-06-30 22:23:43+00:00
44428563,Bryan Kohberger to plead guilty to all counts in Idaho college murders case,https://abcnews.go.com/US/bryan-kohberger-plead-guilty-counts-idaho-college-murders/story?id=123356808,2,2025-06-30 22:22:47+00:00
44428555,Show HN: I turned Paul Graham's essays into per topic navigable knowledge maps,https://www.proread.ai/pgessays,1,2025-06-30 22:22:19+00:00
44428551,"In 1966, Israeli Intelligence Convinced an Iraqi Pilot to Defect with His MiG-21",https://daxe.substack.com/p/in-1966-israeli-intelligence-convinced,5,2025-06-30 22:21:57+00:00
44428540,"AIs have a favorite number, and it's not 42",https://www.theregister.com/2025/06/30/ai_models_favorite_number_27/,3,2025-06-30 22:20:33+00:00
44428539,Amazon Misses Out on Switch 2 Sales After Nintendo Pulled Products from US Site,https://www.bloomberg.com/news/articles/2025-06-30/amazon-lost-right-to-sell-nintendo-switch-2-amid-sales-dispute,2,2025-06-30 22:20:30+00:00
44428530,Cholesterol and how it fits in with a healthy diet (2023),https://www.heart.org/en/news/2023/08/25/heres-the-latest-on-dietary-cholesterol-and-how-it-fits-in-with-a-healthy-diet,3,2025-06-30 22:19:08+00:00
44428520,Harry Potter and the Anatomy of a Speedrun (2024),https://blog.alexbeals.com/posts/harry-potter-anatomy-speedrun,2,2025-06-30 22:18:15+00:00
44428518,Corruption Database – DJT,https://github.com/codeddarkness/taco_pardons,30,2025-06-30 22:18:01+00:00
44428509,DOJ announces plans to prioritize cases to revoke citizenship,https://www.npr.org/2025/06/30/nx-s1-5445398/denaturalization-trump-immigration-enforcement,20,2025-06-30 22:17:17+00:00
44428501,"For the future of water conservation, look to Los Angeles?",https://www.nytimes.com/2025/06/27/headway/water-conservation-los-angeles.html,2,2025-06-30 22:16:45+00:00
44428500,Cytisine [pdf],https://www.ncsct.co.uk/library/view/pdf/Cytisine.pdf,2,2025-06-30 22:16:01+00:00
44428498,MCP to .dxt Command for Claude Code,https://claudecodecommands.directory/commands/claude-desktop-extension,1,2025-06-30 22:15:57+00:00
44428489,React Still Feels Insane and No One Is Talking About It,https://mbrizic.com/blog/react-is-insane/,65,2025-06-30 22:14:46+00:00
44428479,Query Autocomplete from LLMs,https://old.reddit.com/r/RedditEng/comments/1loewqg/query_autocomplete_from_llms/,1,2025-06-30 22:13:55+00:00
44428447,Judge allows antitrust lawsuit against Apple to proceed,https://www.wsbtv.com/news/judge-allows/GJOMH7CU2BG7XEIN3TGRLWU5EM/,5,2025-06-30 22:09:41+00:00
44428438,Show HN: A continuation of IRS Direct File that can be self-hosted,https://github.com/openfiletax/openfile,244,2025-06-30 22:08:59+00:00
44428429,Regen: Empowering personalized recommendations with natural language,https://research.google/blog/regen-empowering-personalized-recommendations-with-natural-language/,1,2025-06-30 22:07:34+00:00
44428422,US Government takes down major North Korean 'remote IT workers' operation,https://techcrunch.com/2025/06/30/us-government-takes-down-major-north-korean-remote-it-workers-operation/,16,2025-06-30 22:06:54+00:00
44428404,Researchers Uncover Hidden Ingredients Behind AI Creativity,https://www.quantamagazine.org/researchers-uncover-hidden-ingredients-behind-ai-creativity-20250630/,4,2025-06-30 22:05:29+00:00
44428399,Jim Boddie codeveloped the first successful DSP at Bell Labs,https://spectrum.ieee.org/dsp-pioneer-jim-boddie,54,2025-06-30 22:04:53+00:00
44428365,Chronic Denial,https://www.openmindmag.org/articles/going-chronic,4,2025-06-30 22:00:19+00:00
44428334,Ask HN: How Are You Reading HN in June 2025?,,5,2025-06-30 21:55:51+00:00
44428306,SKA-Low simulations for a cosmic dawn/epoch of reionisation deep field,https://arxiv.org/abs/2506.09533,3,2025-06-30 21:53:05+00:00
44428301,The AI-Native Airtable Has Arrived: A Letter from Our CEO,https://www.airtable.com/newsroom/introducing-the-ai-native-airtable,2,2025-06-30 21:52:48+00:00
44428299,Why Generalists Will Lead in the Age of AI,https://opuslabs.substack.com/p/why-generalists-will-lead-in-the,3,2025-06-30 21:52:01+00:00
44428271,Is 2025 the Year of the Linux Desktop – Part I,https://www.lttlabs.com/blog/2025/06/30/is-2025-the-year-of-the-linux-desktop-part-i,5,2025-06-30 21:48:07+00:00
44428270,Show HN: PDFtoLink.app – convert pdf to shareable links,https://pdftolink.app,1,2025-06-30 21:48:05+00:00
44428260,Transformers Are Graph Neural Networks,https://arxiv.org/abs/2506.22084,33,2025-06-30 21:46:56+00:00
44428255,RelaX – Relational Algebra Calculator,https://dbis-uibk.github.io/relax/landing,7,2025-06-30 21:45:51+00:00
44428252,Amazon DynamoDB global tables with multi-Region strong consistency is now GA,https://aws.amazon.com/about-aws/whats-new/2025/06/amazon-dynamo-db-global-tables-multi-region-strong-consistency-generally-available/,3,2025-06-30 21:45:36+00:00
44428245,App Store Services Tiers in the EU,https://developer.apple.com/help/app-store-connect/reference/store-services-tiers/,5,2025-06-30 21:45:07+00:00
44428215,Starlink may be lying about speed,http://www.seriousaboutech.com/2025/06/starlink-may-be-lying-about-speed.html,12,2025-06-30 21:41:42+00:00
44428213,Empeg Car – A Linux Car Stereo from the 90s [video],https://www.youtube.com/watch?v=hYOhvPoD-yU,3,2025-06-30 21:41:38+00:00
44428180,FBI Warning Issued as 2FA Bypass Attacks Surge – Get Prepared,https://www.forbes.com/sites/daveywinder/2025/06/30/fbi-warning-issued-as-2fa-bypass-attacks-surge---act-now/,7,2025-06-30 21:38:39+00:00
44428176,TYPES 2025: The 31st International Conference on Types for Proofs and Programs,https://msp.cis.strath.ac.uk/types2025/programme.html,5,2025-06-30 21:38:10+00:00
44428170,Coros Confirms Substantial Watch Security Vulnerablity: Says Fixes Are Coming,https://www.dcrainmaker.com/2025/06/coros-confirms-substantial-watch-security-vulnerablity-says-fixes-are-coming.html,2,2025-06-30 21:37:54+00:00
44428167,Show HN: Timezone converter that tells you if your meeting time sucks,https://timezig.com,6,2025-06-30 21:37:49+00:00
44428151,"Set fees by currency, location or method in 4 steps using config and events",https://www.youtube.com/watch?v=_4CM3GzXYiM,1,2025-06-30 21:35:56+00:00
44428143,Beyond Code: APIs as the Next OSS Battleground,https://redmonk.com/sogrady/2025/06/09/open-source-apis/,3,2025-06-30 21:35:31+00:00
44428116,Unable to find Pylance in the extension marketplace,https://forum.cursor.com/t/unable-to-find-pylance-in-the-extension-marketplace/105099,2,2025-06-30 21:32:41+00:00
44428103,Show HN: FlowMolio – Connect API to Figma mockups for live content previews,https://www.flowmol.io/,1,2025-06-30 21:30:41+00:00
44428098,Show HN: A one-click random NSFW subreddit button,http://randomnsfwsub.com/,4,2025-06-30 21:30:34+00:00
44428093,How AI on Microcontrollers Works: Operators and Kernels,https://danielmangum.com/posts/ai-microcontrollers-operators-kernels/,4,2025-06-30 21:29:47+00:00
44428074,"I scraped 5k+ pain points from Reddit, G2, Capterra and Upwork",https://www.startupidealab.io/,2,2025-06-30 21:28:17+00:00
44428053,AMC theaters now warning of 25-30 mins of previews after show time,https://old.reddit.com/r/Letterboxd/comments/1lohxuf/amc_theaters_now_warning_of_2530_mins_of_previews/,10,2025-06-30 21:26:15+00:00
44428029,The Slate: America's $20K Answer to China's Cheap EVs [video],https://www.youtube.com/watch?v=Vv0wC_ffAHU,3,2025-06-30 21:23:15+00:00
44428012,Netbook Mania,https://hardcoresoftware.learningbyshipping.com/p/093-netbook-mania,5,2025-06-30 21:21:45+00:00
44427996,Non-Contact Heart Rate Monitoring Method Based on Wi-Fi CSI Signal,https://www.mdpi.com/1424-8220/24/7/2111,3,2025-06-30 21:19:54+00:00
44427991,letting go,https://benexdict.io/p/letting-go,2,2025-06-30 21:19:25+00:00
44427982,Windows seemingly lost 400M users in the past three years,https://www.tomshardware.com/software/windows/windows-seemingly-lost-400-million-users-in-the-past-three-years-official-microsoft-statements-show-hints-of-a-shrinking-user-base,9,2025-06-30 21:18:39+00:00
44427976,How to Borrow Memory (2021),https://www.falsifian.org/blog/2021/06/04/catalytic/,2,2025-06-30 21:17:35+00:00
44427944,Show HN: Git command for creating snapshot commits on a not checked-out branch,https://github.com/meribold/git-snap,2,2025-06-30 21:13:58+00:00
44427942,Philip K Dick FBI file,https://www.spyculture.com/philip-k-dick-fbi-file/,5,2025-06-30 21:13:53+00:00
44427938,TIME100 Most Influential Companies 2025,https://time.com/collections/time100-companies-2025/7289661/google-deepmind/,3,2025-06-30 21:12:52+00:00
44427937,AMD bets on rack-scale compute to boost AI efficiency 20x by 2030,https://www.theregister.com/2025/06/12/amd_20x_30/,2,2025-06-30 21:12:48+00:00
44427932,"GPT4Free: ""educational project"" for free LLM inference from various services",https://github.com/xtekky/gpt4free,2,2025-06-30 21:11:45+00:00
44427929,Entropy of a Mixture,https://cgad.ski/blog/entropy-of-a-mixture.html,54,2025-06-30 21:11:30+00:00
44427924,Embracing the power of the empty set in API design: Requesting zero items,https://devblogs.microsoft.com/oldnewthing/20250630-00/?p=111320,5,2025-06-30 21:10:57+00:00
44427918,A Possible Connection Between Mental Illness and Diet,https://undark.org/2025/06/24/mental-illness-ketogenic-diet/,7,2025-06-30 21:10:37+00:00
44427916,Embodied AI Agents: Modeling the World,https://arxiv.org/abs/2506.22355,3,2025-06-30 21:10:31+00:00
44427915,"Show HN: C.O.R.E – Opensource, user owned, shareable memory for Claude, Cursor",https://github.com/RedPlanetHQ/core,20,2025-06-30 21:10:22+00:00
44427883,ChatGPT intercepts clear cache keyboard shortcut in Brave,,2,2025-06-30 21:06:52+00:00
44427877,LLVM: InstCombine: A PR by Alex Gaynor and Claude Code,https://simonwillison.net/2025/Jun/30/llvm/,3,2025-06-30 21:06:03+00:00
44427871,Skyrocketing HBM Will Push Micron Through $45B and Beyond,https://www.nextplatform.com/2025/06/30/skyrocketing-hbm-will-push-micron-through-10-billion-and-beyond/,5,2025-06-30 21:05:42+00:00
44427864,Connected Gmail mcp to AI voice,https://harmony.com.ai,2,2025-06-30 21:05:15+00:00
44427862,Boeing to Replace CFO Brian West with Former Lockheed Finance Chief,https://www.bloomberg.com/news/articles/2025-06-30/boeing-to-replace-cfo-west-with-former-lockheed-finance-chief,4,2025-06-30 21:05:10+00:00
44427833,Simple low-dimensional computations explain variability in neuronal activity,https://arxiv.org/abs/2504.08637,2,2025-06-30 21:01:35+00:00
44427817,Exploring LLM Evaluation by Using Games,https://lmgame.org,3,2025-06-30 20:59:20+00:00
44427815,The Whole Country Is Starting to Look Like California,https://www.theatlantic.com/economy/archive/2025/06/zoning-sun-belt-housing-shortage/683352/,7,2025-06-30 20:59:09+00:00
44427813,Eigenvalues of Generative Media,https://stackdiver.com/posts/eigenvalues-of-generative-media/,4,2025-06-30 20:59:08+00:00
44427777,Universities Are Making You Look Stupid,https://arealsociety.substack.com/p/universities-are-making-you-look,2,2025-06-30 20:55:50+00:00
44427774,Brazil's Supreme Court clears way to hold social media liable for user content,https://apnews.com/article/brazil-supreme-court-social-media-ruling-324b9d79caa9f9e063da8a4993e382e1,56,2025-06-30 20:55:47+00:00
44427757,"The new skill in AI is not prompting, it's context engineering",https://www.philschmid.de/context-engineering,915,2025-06-30 20:53:55+00:00
44427752,Ask HN: When will YC do a batch in Europe and/or Asia?,,3,2025-06-30 20:53:46+00:00
44427748,Repurposed Materials,https://www.repurposedmaterialsinc.com/view-all-products/,1,2025-06-30 20:53:13+00:00
44427736,"Liberals, you must reclaim Adam Smith",https://davidbrin.blogspot.com/2013/11/liberals-you-must-reclaim-adam-smith.html,7,2025-06-30 20:51:59+00:00
44427730,Symbients on Stage Coming Soon: Autonomous AI Entrepreneurs,https://www.forbes.com/sites/robertwolcott/2025/06/30/symbients-on-stage-coming-soon-autonomous-ai-entrepreneurs/,4,2025-06-30 20:51:18+00:00
44427694,Can Large Language Models Help Students Prove Software Correctness?,https://arxiv.org/abs/2506.22370,1,2025-06-30 20:47:46+00:00
44427688,Developing with GitHub Copilot Agent Mode and MCP,https://austen.info/blog/github-copilot-agent-mcp/,93,2025-06-30 20:47:28+00:00
44427673,I got removed from GitHub for making open source stuff,,2,2025-06-30 20:46:16+00:00
44427658,NASA plans to stream rocket launches on Netflix starting this summer,https://www.cnbc.com/2025/06/30/nasa-rocket-launches-netflix.html,3,2025-06-30 20:45:01+00:00
44427637,Large Language Model-Powered Agent for C to Rust Code Translation,https://arxiv.org/abs/2505.15858,4,2025-06-30 20:43:02+00:00
44427628,Let's create a Tree-sitter grammar,https://www.jonashietala.se/blog/2024/03/19/lets_create_a_tree-sitter_grammar/,5,2025-06-30 20:42:04+00:00
44427621,"Musk said to bet on Tesla delivering Robotaxi in June, those who did lost big",https://electrek.co/2025/06/30/elon-musk-bet-tesla-delivering-robotaxi-june-lost-big/,11,2025-06-30 20:41:42+00:00
44427616,The story how I acquired the domain name Onions.com,https://twitter.com/searchbound/status/1939658564420641064,2,2025-06-30 20:40:39+00:00
44427598,Offline-First AI Platform for Resilient Edge and IoT Applications,https://github.com/GlobalSushrut/mcp-zero,1,2025-06-30 20:38:33+00:00
44427594,Three-Dimensional Time: A Mathematical Framework for Fundamental Physics,https://www.worldscientific.com/doi/10.1142/S2424942425500045,1,2025-06-30 20:38:00+00:00
44427583,Young job applicants fight fire (ATS systems) with fire (AI) – Global trends,https://www.coversentry.com/ai-job-search-statistics,3,2025-06-30 20:37:20+00:00
44427577,Google to buy fusion startup Commonwealth's power- if they can ever make it work,https://www.theregister.com/2025/06/30/google_fusion_commonwealth/,6,2025-06-30 20:36:15+00:00
44427567,"Apple Execs on what went wrong with Siri, iOS 26 and more [video]",https://www.youtube.com/watch?v=wCEkK1YzqBo,2,2025-06-30 20:35:23+00:00
44427508,Adding Text-to-Speech to Your Blog with OpenAI's TTS API,https://econoben.dev/posts/adding-text-to-speech-to-your-blog-openai-tts-pipeline,2,2025-06-30 20:30:06+00:00
44427470,Do Car Buyers Care Which Engine Is Under the Hood? A Ford Exec Doesn't Think So,https://www.thedrive.com/news/do-car-buyers-care-which-engine-is-under-the-hood-a-ford-exec-doesnt-think-so,4,2025-06-30 20:26:25+00:00
44427452,CertMate – SSL Certificate Management System,https://github.com/fabriziosalmi/certmate,39,2025-06-30 20:24:53+00:00
44427434,Ask HN: How to build a LifeOS using vibe coding?,,1,2025-06-30 20:24:03+00:00
44427432,Show HN: On-chain Fund Administration Protocol,https://www.fume.finance/,1,2025-06-30 20:23:45+00:00
44427417,"Portal, for the C64",https://www.jamiefuller.com/portal/,21,2025-06-30 20:22:20+00:00
44427370,Defending Savannah from DDoS Attacks,https://www.fsf.org/bulletin/2025/spring/defending-savannah-from-ddos-attacks,24,2025-06-30 20:17:21+00:00
44427352,Beltabol: An eager functional esolang based on the Expanse,https://github.com/demaere-oiie/beltabol,2,2025-06-30 20:15:05+00:00
44427337,Show HN: Transform handwritten chess notation to Lichess or chess.com instantly,https://chess-notation.com,2,2025-06-30 20:12:26+00:00
44427332,Dias on the Web – Pandas Rewriter,https://www.pandas-rewriter.com/,2,2025-06-30 20:12:09+00:00
44427331,Bulk Lots of DB-19s for Sale,https://www.bigmessowires.com/2025/06/30/bulk-lots-of-db-19s-for-sale/,39,2025-06-30 20:12:05+00:00
44427315,The Impact of Early Galaxy Formation on the Cosmic Microwave Background,https://arxiv.org/abs/2505.04687,6,2025-06-30 20:10:31+00:00
44427278,My Database Is My Application: Rethinking Webhook Logic with DuckDB and SQL,https://www.hey.earth/posts/duckdb-webhook-gateway,31,2025-06-30 20:06:11+00:00
44427275,Jony Ive's AI gadget might be a pen,https://www.bloomberg.com/opinion/articles/2025-06-30/jony-ive-s-first-ai-gadget-clues-point-to-a-pen,3,2025-06-30 20:06:00+00:00
44427266,"""Fuck the algorithm""?: What to learn from the UK's A-level grading fiasco (2020)",https://blogs.lse.ac.uk/impactofsocialsciences/2020/08/26/fk-the-algorithm-what-the-world-can-learn-from-the-uks-a-level-grading-fiasco/,2,2025-06-30 20:05:03+00:00
44427262,Senate GOP budget bill has little-noticed provision that could hurt your Wi-Fi,https://arstechnica.com/tech-policy/2025/06/senate-gop-budget-bill-has-little-noticed-provision-that-could-hurt-your-wi-fi/,41,2025-06-30 20:04:44+00:00
44427259,iOS Dev Weekly: Swift Everywhere: Bringing Swift Packages to Android,https://iosdevweekly.com/issues/697/,2,2025-06-30 20:04:17+00:00
44427252,Nuclear Matters Handbook [pdf],https://www.acq.osd.mil/ncbdp/nm/NMHB2020rev/docs/NMHB2020rev.pdf,1,2025-06-30 20:03:40+00:00
44427244,"Ted Chiang on Superintelligence in ""The Hampdenshire Wonder""",https://lithub.com/ted-chiang-on-superintelligence-and-its-discontents-in-j-d-beresfords-innovative-work-of-early-20th-century-science-fiction/,29,2025-06-30 20:02:37+00:00
44427236,Apple Loses Bid to Dismiss US Smartphone Monopoly Case,https://www.reuters.com/sustainability/boards-policy-regulation/apple-loses-bid-dismiss-us-smartphone-monopoly-case-2025-06-30/,11,2025-06-30 20:01:53+00:00
44427229,"New band surges to 500k listeners on Spotify, but turns out it's AI slop",https://arstechnica.com/ai/2025/06/half-a-million-spotify-users-are-unknowingly-grooving-to-an-ai-generated-band/,30,2025-06-30 20:01:31+00:00
44427223,Mechanism shrinks when pulled [video],https://www.youtube.com/watch?v=-QTkPfq7w1A,6,2025-06-30 20:00:56+00:00
