id,title,url,points,created_at
44747727,"AI-Powered Trading, Algorithmic Collusion, and Price Efficiency 2023 [U:2025]",https://papers.ssrn.com/sol3/papers.cfm?abstract_id=4452704,1,2025-07-31 17:10:01+00:00
44747721,"Real milk proteins, no cows: Engineered bacteria for vegan cheese and yogurt",https://phys.org/news/2025-07-real-proteins-cows-bacteria-pave.html,26,2025-07-31 17:09:29+00:00
44747699,Show HN: Astro dev blog template with interactive colorschemes,https://multiterm.stelclementine.com,31,2025-07-31 17:08:10+00:00
44747695,Microsoft ends tradition of naming competitors in regulatory filings,https://www.cnbc.com/2025/07/31/microsoft-competitors-filings.html,5,2025-07-31 17:07:38+00:00
44747692,Ask HN: We Need More Librarians,,2,2025-07-31 17:07:06+00:00
44747683,I wrote a Kalaha solver and got my mind blown in the process,https://vlaaad.github.io/kalaha,2,2025-07-31 17:06:41+00:00
44747682,YouTube's Lofi Girl Graduates After Studying for 7 Years,https://www.eonline.com/news/1420565/youtubes-lofi-girl-graduates-after-studying-for-7-years,1,2025-07-31 17:06:34+00:00
44747662,Introducing: UniFi OS Server for Managed Service Providers [video],https://www.youtube.com/watch?v=3bAy5KNBXYw,1,2025-07-31 17:04:25+00:00
44747655,Codestral 25.08,https://mistral.ai/news/codestral-25-08,19,2025-07-31 17:03:43+00:00
44747645,"Flyte 2.0: Dynamic, Crash-Proof, Resource-Aware AI Orchestration",https://www.union.ai/blog-post/introducing-flyte-2-0-dynamic-crash-proof-resource-aware-ai-orchestration,13,2025-07-31 17:02:41+00:00
44747634,"AI is a floor raiser, not a ceiling raiser",https://elroy.bot/blog/2025/07/29/ai-is-a-floor-raiser-not-a-ceiling-raiser.html,370,2025-07-31 17:01:37+00:00
44747613,PyPI Phishing Attack: Incident Report,https://blog.pypi.org/posts/2025-07-31-incident-report-phishing-attack/,8,2025-07-31 17:00:16+00:00
44747597,Ask HN: Would you use a self-hostable pastebin with AI and team features?,https://sniptide.com,1,2025-07-31 16:59:08+00:00
44747589,"Portal, but the portal surfaces are inverted [video]",https://www.youtube.com/watch?v=gTGDQrVmPVs,4,2025-07-31 16:58:15+00:00
44747578,What's an OSS Vulnerability Janitor?,https://infosecwriteups.com/what-is-a-oss-vulnerability-janitor-b7ab176bdd3f,1,2025-07-31 16:57:22+00:00
44747577,Ask HN: Small Utility App Monetization,,5,2025-07-31 16:57:20+00:00
44747547,Corsair Launches AI Workstation 300,https://finance.yahoo.com/news/corsair-launches-ai-workstation-300-100000282.html,2,2025-07-31 16:54:29+00:00
44747542,OpenAI's New Agent Clicked Through Cloudflare Turnstile. We Just Lost Captcha,https://verify-humanity.com/,2,2025-07-31 16:53:41+00:00
44747509,"Iceberg I/O performance comparison at scale (Bodo vs. PyIceberg, Spark, Daft)",https://www.bodo.ai/blog/iceberg-i-o-performance-comparison-at-scale-bodo-vs-pyiceberg-spark-daft,6,2025-07-31 16:51:01+00:00
44747505,Street smarts: a remarkable adaptation in a city-wintering raptor,https://www.frontiersin.org/journals/ethology/articles/10.3389/fetho.2025.1539103/full,2,2025-07-31 16:50:45+00:00
44747499,Ask HN: Local LLM agents on Jetson/RPi without a heavy runtime,,3,2025-07-31 16:50:21+00:00
44747457,Gemini Embedding: Powering RAG and context engineering,https://developers.googleblog.com/en/gemini-embedding-powering-rag-context-engineering/,278,2025-07-31 16:47:54+00:00
44747453,Apple slams DOJ lawsuit: 'threatens the principles that set iPhone apart',https://9to5mac.com/2025/07/29/apple-doj-lawsuit-answer-iphone/,9,2025-07-31 16:47:37+00:00
44747446,The Vibe Code Fallacy: Why Playing It Safe Is the Riskiest Strategy,https://www.derekneighbors.com/2025/07/31/the-vibe-code-fallacy-why-playing-it-safe-is-the-riskiest-strategy,6,2025-07-31 16:47:09+00:00
44747441,Webflow RCA Incident [pdf],https://cdn.prod.website-files.com/6220f3e30d60ec3ef9a240d3/688b9826671ccaa24c912c7c_Webflow%20RCA%20Incident%20829%20-%20July%2028%202025.pdf,3,2025-07-31 16:46:35+00:00
44747436,Rustree: Visualize Rust ASTs in the Browser,https://rustree.snprajwal.com,6,2025-07-31 16:46:07+00:00
44747428,Ron Cobb's semiotic standards for the film Alien (1979),https://twitter.com/computerlove_/status/1950724744908603708,3,2025-07-31 16:45:18+00:00
44747426,Watching Grass Grow,https://www.watching-grass-grow.com/,3,2025-07-31 16:45:10+00:00
44747410,What happens when line between authentic and artificial is impossible to draw?,https://syntheticauth.ai/posts/synthetic-auth-report-issue-004,1,2025-07-31 16:43:54+00:00
44747372,Show HN: I made an AI powered SEO tool so that you never launch to 0 users again,https://www.seolabs.app/,2,2025-07-31 16:40:02+00:00
44747359,"Show HN: If you smoke, this app helps you quit (no shame)",https://quitdate.app,1,2025-07-31 16:38:28+00:00
44747355,The renewable energy revolution is a feat of technology,https://www.theguardian.com/commentisfree/ng-interactive/2025/jul/30/renewable-energy-revolution-technology,5,2025-07-31 16:38:14+00:00
44747338,Water's molecular disorder helps turn carbon waste into valuable fuel products,https://phys.org/news/2025-07-molecular-disorder-carbon-valuable-fuel.html,2,2025-07-31 16:36:09+00:00
44747335,People Have Disappeared in Mexico. Scientists Are Using Dead Pigs to Find Them,https://www.popularmechanics.com/science/a65546567/dead-pigs-human-graves/,14,2025-07-31 16:35:59+00:00
44747320,Transformers at the Edge: Efficient LLM Deployment,https://semiengineering.com/transformers-at-the-edge-efficient-llm-deployment/,1,2025-07-31 16:35:15+00:00
44747317,I made public my React components for anyone to enjoy,https://www.deplo.yt/comp_library,2,2025-07-31 16:34:53+00:00
44747314,Singapore was named the best city for AI in the 2025 AI City Index,https://www.counterpointresearch.com/insight/singapore-named-worlds-top-ai-city-in-counterpoint-researchs-2025-ai-city-index/,2,2025-07-31 16:34:36+00:00
44747310,"As AI Booms, Data Centers Threaten Energy Grid and Water Supplies",https://www.newswise.com/articles/as-ai-booms-data-centers-threaten-energy-grid-and-water-supplies-expert-says,3,2025-07-31 16:34:26+00:00
44747306,The AI Company Capitalizing on Our Obsession with Excel,https://www.wsj.com/articles/the-ai-company-capitalizing-on-our-obsession-with-excel-adf19e09,2,2025-07-31 16:34:07+00:00
44747273,Apple Is Selling iPad Repair Parts for Astronomical Prices,https://www.404media.co/apple-is-selling-ipad-repair-parts-for-astronomical-prices/,35,2025-07-31 16:30:22+00:00
44747267,Erys: Run Jupyter Notebooks in Terminal,https://github.com/natibek/erys,3,2025-07-31 16:29:34+00:00
44747247,"The smallest embeddable scripting language, part 1",https://log.schemescape.com/posts/static-site-generators/smallest-scripting-language.html,5,2025-07-31 16:27:42+00:00
44747241,The Chrome Speculation Rules API allows the browser to preload and prerender,https://www.docuseal.com/blog/make-any-website-load-faster-with-6-lines-html,104,2025-07-31 16:27:10+00:00
44747229,Show HN: Mcp-use – Connect any LLM to any MCP,https://github.com/mcp-use/mcp-use,155,2025-07-31 16:25:51+00:00
44747204,Launch HN: Gecko Security (YC F24) – AI That Finds Vulnerabilities in Code,,66,2025-07-31 16:23:09+00:00
44747202,The Iconfactory seeking buyers for some of its apps,https://blog.iconfactory.com/2025/07/apps-up-for-sale/,1,2025-07-31 16:22:45+00:00
44747197,I Built an Vibe Coding Misalignment Detector (and Used It to Build Itself),https://github.com/conikeec/sniff,2,2025-07-31 16:22:23+00:00
44747195,Three Months with Cursor: A Developer's Summer 2025 Retrospective,https://tvedeane.bearblog.dev/three-months-with-cursor-a-developers-summer-2025-retrospective/,1,2025-07-31 16:22:19+00:00
44747193,"Open source PDF reader built with Rust, Dioxus and PDFium",https://github.com/lailogue/rust-pdf-viewer,2,2025-07-31 16:22:03+00:00
44747192,AI SDK 5,https://vercel.com/blog/ai-sdk-5,3,2025-07-31 16:21:44+00:00
44747181,Restaurant Industry Report from Square,https://squareup.com/us/en/press/summer-restaurant-report-2025,15,2025-07-31 16:20:34+00:00
44747170,Curate your own newspaper with RSS,https://www.citationneeded.news/curate-with-rss/,9,2025-07-31 16:19:21+00:00
44747156,Qwen3-30B-A3B-Thinking-2507 has been released,https://huggingface.co/Qwen/Qwen3-30B-A3B-Thinking-2507,2,2025-07-31 16:18:27+00:00
44747140,Frozen in transit: Secret Blizzard's AiTM campaign against diplomats,https://www.microsoft.com/en-us/security/blog/2025/07/31/frozen-in-transit-secret-blizzards-aitm-campaign-against-diplomats/,6,2025-07-31 16:17:17+00:00
44747116,GPU Memory Snapshots: fast container cold boots,https://modal.com/blog/gpu-mem-snapshots,9,2025-07-31 16:14:16+00:00
44747111,Show HN: Code Beacon – filter files and show call graphs in Ruby,https://marketplace.visualstudio.com/items?itemName=bitfiddle.code-beacon,1,2025-07-31 16:13:51+00:00
44747099,Show HN: Synapse – Multi-model AI combining LLMs and humans for marketing output,,1,2025-07-31 16:12:49+00:00
44747091,Hundreds of agencies tap Atherton surveillance system for feds; Fails own rules,https://www.almanacnews.com/investigative-story/2025/07/30/hundreds-of-agencies-tap-athertons-surveillance-system-for-feds-town-fails-to-follow-own-rules/,46,2025-07-31 16:11:29+00:00
44747089,China summons Nvidia over backdoor security concerns with AI chips,https://www.washingtonpost.com/world/2025/07/31/china-nvidia-ai-chip-security/,3,2025-07-31 16:11:13+00:00
44747088,She Wanted to Save the World from A.I. Then the Killings Started,https://www.nytimes.com/2025/07/06/business/ziz-lasota-zizians-rationalists.html,1,2025-07-31 16:11:00+00:00
44747052,The Shameless Impropriety of Joshua Weissman,https://www.richardeaglespoon.com/articles/weissman,4,2025-07-31 16:07:13+00:00
44747027,"Kremlin caught abusing ISPs to spy on Moscow-based diplomats, Microsoft says",https://www.theregister.com/2025/07/31/kremlin_goons_caught_abusing_isps/,13,2025-07-31 16:05:04+00:00
44747024,Platform security is not what you think it is,https://www.tirreno.com/bat/?post=2025-07-31,2,2025-07-31 16:04:56+00:00
44747023,Brilliant Labs launches Halo: AI smartglasses that last all day,https://skarredghost.com/2025/07/31/brilliant-labs-halo/,2,2025-07-31 16:04:40+00:00
44747022,How to win the AI talent war,https://www.getflack.com/p/how-to-win-the-ai-talent-war,3,2025-07-31 16:04:34+00:00
44747017,The easiest way to scrape Google Hotels data,https://serpapi.com/blog/scraping-google-hotels-and-google-hotels-autocomplete-guide-how-to-get-precious-data-from-google-hotels/,12,2025-07-31 16:04:16+00:00
44747004,How Not to Study a Disease (2023),https://neurofrontiers.blog/book-review-how-not-to-study-a-disease/,14,2025-07-31 16:03:16+00:00
44747000,A 3D model of the human airways via a digital light processing bioprinter,https://analyticalsciencejournals.onlinelibrary.wiley.com/doi/10.1002/bit.29013,29,2025-07-31 16:03:01+00:00
44746999,Show HN: Fiblet- We replaced chaotic inbox into smart tabs,,1,2025-07-31 16:03:00+00:00
44746981,Senate legislation would direct agencies to fortify against quantum threats,https://cyberscoop.com/quantum-cybersecurity-migration-act-federal-encryption-legislation/,6,2025-07-31 16:00:53+00:00
44746977,New Single Megaflash Lightning Record Distance: 829 Km,https://journals.ametsoc.org/view/journals/bams/aop/BAMS-D-25-0037.1/BAMS-D-25-0037.1.xml,3,2025-07-31 16:00:12+00:00
44746951,Maybe the Fastest Disk Usage Program on macOS,https://healeycodes.com/maybe-the-fastest-disk-usage-program-on-macos,3,2025-07-31 15:57:52+00:00
44746950,"Honey, AI Capex Keeps Eating Everything",https://paulkedrosky.com/honey-ai-capex-keeps-eating-everything/,5,2025-07-31 15:57:47+00:00
44746948,QUIC for the kernel,https://lwn.net/Articles/1029851/,335,2025-07-31 15:57:32+00:00
44746940,Achieving the lowest operating voltage yet for white organic LEDs,https://www.isct.ac.jp/en/news/h8x8kh6jsi5s,2,2025-07-31 15:56:23+00:00
44746936,Some low-grade prostate cancers carry higher risks than biopsy suggests,https://medicalxpress.com/news/2025-07-grade-prostate-cancers-higher-biopsy.html,2,2025-07-31 15:55:16+00:00
44746915,Amap launches low-altitude navigation with 3D digital mapping in Shenzhen,https://technode.com/2025/07/31/amap-launches-low-altitude-navigation-with-3d-digital-mapping-in-shenzhen/,2,2025-07-31 15:53:22+00:00
44746900,A 515-Mile Lightning Flash Is Longest on Record,https://e360.yale.edu/digest/record-lightning-flash,5,2025-07-31 15:51:34+00:00
44746897,What Searching for Aliens Reveals About Ourselves,https://www.noemamag.com/what-searching-for-aliens-reveals-about-ourselves/,7,2025-07-31 15:51:21+00:00
44746887,Using a fan can make older adults hotter in a dry heat,https://medicalxpress.com/news/2025-07-fan-older-adults-hotter-dry.html,7,2025-07-31 15:50:39+00:00
44746865,Configserver.com will be closing down on 31 August 2025,https://configserver.com/announcement/,3,2025-07-31 15:47:59+00:00
44746845,Anticommandeering doctrine stands in the way of Trump's immigration crackdown,https://reason.com/2025/07/31/on-sanctuary-cities-its-trump-vs-the-10th-amendment/,2,2025-07-31 15:46:21+00:00
44746838,"A record: Lightning bolt stretched 515 miles, crossed three states",https://www.nbcnews.com/science/science-news/shocking-record-lightning-bolt-stretched-515-miles-crossed-three-state-rcna221993,10,2025-07-31 15:45:47+00:00
44746827,Polish Train Maker Is Suing the Hackers Who Exposed Its Anti-Repair Tricks,https://www.ifixit.com/News/112008/polish-train-maker-is-suing-the-hackers-who-exposed-its-anti-repair-tricks,10,2025-07-31 15:45:00+00:00
44746825,Show HN: Contestit.app – Social media giveaways with games,https://www.contestit.app/,1,2025-07-31 15:44:30+00:00
44746821,The Future of Programming (2013),https://worrydream.com/dbx/,39,2025-07-31 15:43:38+00:00
44746815,Spotify Threatens to Delete Accounts That Fail Digital ID Checks,https://reclaimthenet.org/spotify-threatens-to-delete-accounts-that-fail-digital-id-checks,2,2025-07-31 15:42:44+00:00
44746780,Show HN: Learn Blockchain History – Simple and Fun,https://theblockchainhistory.com,1,2025-07-31 15:39:46+00:00
44746772,"Cross-Architecture Parallel Algorithms from a Unified, Transpiled Codebase",https://arxiv.org/abs/2507.16710,1,2025-07-31 15:39:19+00:00
44746769,Vibe-Coded sites are bad at SEO – and a way to fix it,https://www.rivalsee.com/blog/free-prompt-fix-vibe-coding-seo-blind-spot,3,2025-07-31 15:38:55+00:00
44746761,Show HN: StaticSearch – a simple search engine for static sites,https://github.com/craigbuckler/staticsearch,3,2025-07-31 15:37:55+00:00
44746737,"Show HN: CoderScreen, an open-source alternative to CoderPad and HackerRank",https://github.com/CoderScreen/coderscreen,1,2025-07-31 15:35:37+00:00
44746733,Show HN: Made a tool that let customer retrieve live data and action on website,https://www.instein.ai/,1,2025-07-31 15:35:27+00:00
44746727,Characteristics of Good and Bad Opinions (Updated for 2025),https://greyenlightenment.com/2021/11/19/characteristics-of-good-and-bad-opinions/,3,2025-07-31 15:34:46+00:00
44746718,I sold my DevTool. ft Paul Anthony Williams from ittybit [audio],https://scalingdevtools.com/podcast/episodes/i-sold-my-devtool-ft-paul-anthony-williams-from-ittybit,4,2025-07-31 15:34:06+00:00
44746712,Show HN: Publican – an HTML-first static site generator for Node.js,https://publican.dev/,4,2025-07-31 15:33:22+00:00
44746695,We Will Sign the EU AI Code of Practice,https://blog.google/around-the-globe/google-europe/eu-ai-code-practice/,6,2025-07-31 15:31:33+00:00
44746687,You Are the Bios Now: Building a Hypervisor in Rust with KVM,https://yeet.cx/blog/you-are-the-bios-now,3,2025-07-31 15:30:55+00:00
44746686,"Katie Martin's ""Magnificent Seven"" Today",https://braddelong.substack.com/p/note-to-self-on-katie-martins-magificent,1,2025-07-31 15:30:50+00:00
44746685,Biodegradable fiber electronics offer solution to e-waste and textile pollution,https://techxplore.com/news/2025-07-electronics-biodegradable-fiber-solution-textile.html,2,2025-07-31 15:30:48+00:00
44746681,The long hard stupid way (2024),https://christowski.de/blog/2024/04/012024-the-long-hard-stupid-way/,2,2025-07-31 15:29:55+00:00
44746670,Showrunner,https://www.showrunner.xyz,1,2025-07-31 15:29:10+00:00
44746655,Vibe [XYZ] Anything = Glorified Hobby,https://bigthink.com/starts-with-a-bang/vibe-physics-ai-slop/,4,2025-07-31 15:27:56+00:00
44746629,"Mapping political connections with web automation, LLMs and Obsidian",https://adu.autonomy.work/posts/2025_07_31_corkboard/,3,2025-07-31 15:26:14+00:00
44746621,6 weeks of Claude Code,https://blog.puzzmo.com/posts/2025/07/30/six-weeks-of-claude-code/,581,2025-07-31 15:25:49+00:00
44746620,Meta to spend up to $72B on AI infrastructure in 2025,https://techcrunch.com/2025/07/30/meta-to-spend-up-to-72b-on-ai-infrastructure-in-2025-as-compute-arms-race-escalates/,9,2025-07-31 15:25:36+00:00
44746605,The State of Post-Quantum Cryptography in Rust: The Belt Is Vacant,https://blog.projecteleven.com/posts/the-state-of-post-quantum-cryptography-in-rust-the-belt-is-vacant,1,2025-07-31 15:24:09+00:00
44746603,Ubiquiti launches UniFi OS Server for self-hosting,https://lazyadmin.nl/home-network/unifi-os-server/,396,2025-07-31 15:24:05+00:00
44746600,China claims Nvidia built backdoor into H20 chip designed for Chinese market,https://arstechnica.com/gadgets/2025/07/china-claims-nvidia-built-backdoor-into-h20-chip-designed-for-chinese-market/,9,2025-07-31 15:23:49+00:00
44746588,OnlyHuman – An uBlock filter list that hides AI generated junk across the web,https://github.com/FranklyRocks/OnlyHuman,3,2025-07-31 15:22:28+00:00
44746583,PixiEditor 2.0 – A FOSS universal 2D graphics editor,https://pixieditor.net/blog/2025/07/30/20-release/,405,2025-07-31 15:21:31+00:00
44746581,What the CHIPS Act Looks Like Now,https://spectrum.ieee.org/chips-act-map,2,2025-07-31 15:21:09+00:00
44746579,Meta brought AI to rural Colombia. Now students are failing exams,https://restofworld.org/2025/colombia-meta-ai-education/,9,2025-07-31 15:21:01+00:00
44746577,Losing Money Is the Point,https://zachholman.com/posts/losing-money-is-the-point,14,2025-07-31 15:20:39+00:00
44746575,The Tim Cook Era Is Fully Cemented,https://pxlnv.com/linklog/cook-era/,3,2025-07-31 15:20:04+00:00
44746566,Agrivoltaics provide mutual benefits across food–energy–water in drylands (2019),https://www.researchgate.net/publication/335583033_Agrivoltaics_provide_mutual_benefits_across_the_food-energy-water_nexus_in_drylands,2,2025-07-31 15:19:11+00:00
44746559,Ask HN: Advise for technical solo founders trying to secure venture capital?,,5,2025-07-31 15:18:03+00:00
44746557,Flipping Bits in the World,https://opuslabs.substack.com/p/how-to-flip-bits-in-the-world,2,2025-07-31 15:18:01+00:00
44746554,Mamachari: A Guide to Japanese Utility Bicycles,https://savvytokyo.com/mamachari-a-guide-to-japanese-utility-bicycles/,1,2025-07-31 15:17:50+00:00
44746551,How I Made the Front Page of Hacker News with AI Slop,https://www.taylor.gl/blog/30,8,2025-07-31 15:17:23+00:00
44746539,Show HN: Haven – Selfhost a private blog instead of using Facebook,https://github.com/havenweb/haven,2,2025-07-31 15:15:44+00:00
44746529,I tried living on IPv6 for a day,https://www.xda-developers.com/the-internet-isnt-fully-ipv6-ready/,107,2025-07-31 15:15:03+00:00
44746523,The two people shaping the future of OpenAI's research,https://www.technologyreview.com/2025/07/31/1120885/the-two-people-shaping-the-future-of-openais-research/,3,2025-07-31 15:14:47+00:00
44746512,From Frustration to Power: What We Learned at Nixcademy,https://niteo.co/blog/from-frustration-to-power-what-we-learned-at-nixcademy/,9,2025-07-31 15:13:06+00:00
44746507,"Zuckerberg claims AI systems ""improving themselves""",https://www.theguardian.com/technology/2025/jul/30/zuckerberg-superintelligence-meta-ai,4,2025-07-31 15:12:52+00:00
44746505,"Silk Typhoon spun a web of patents for offensive cyber tools, report says",https://www.theregister.com/2025/07/31/silk_typhoon_attack_patents/,1,2025-07-31 15:12:44+00:00
44746503,Software's Blog Era,https://world.hey.com/akumar/software-s-blog-era-2812c56c,3,2025-07-31 15:12:20+00:00
44746497,"Show HN: Legal–Markdown-JS, Git-friendly legal docs with Markdown and helpers",https://github.com/petalo/legal-markdown-js,10,2025-07-31 15:11:33+00:00
44746487,Zero Downtime Schema Changes with Vercel and Xata,https://xata.io/blog/zero-downtime-schema-changes-with-vercel-and-xata,2,2025-07-31 15:10:06+00:00
44746477,Google Indexing Shared ChatGPT Conversations,https://dataconomy.com/2025/07/31/chatgpt-conversations-are-showing-up-in-google-search/,2,2025-07-31 15:08:46+00:00
44746445,Help Us Build the Tool You've Always Wanted for Recon,https://bugseekers.com/,2,2025-07-31 15:04:28+00:00
44746438,Do LLMs consider security? Empirical study on responses to programming questions,https://link.springer.com/article/10.1007/s10664-025-10658-6,2,2025-07-31 15:03:56+00:00
44746436,AGI Might Come to Be,https://www.levroai.com/blog/why-agi-is-around-the-corner-07-30-2025,4,2025-07-31 15:03:40+00:00
44746427,Perchlorate brine formation from frost at the Viking 2 landing site,https://www.nature.com/articles/s43247-025-02411-0,2,2025-07-31 15:02:35+00:00
44746415,"Ursa: A leaderless, object storage–based alternative to Kafka",https://streamnative.io/products/ursa,98,2025-07-31 15:01:08+00:00
44746393,Age and Technology,https://www.cybershow.uk/blog/posts/ageoftech/,2,2025-07-31 14:59:58+00:00
44746376,Djangonaut Space is looking for contributors to be mentors,https://www.djangoproject.com/weblog/2025/jul/31/djangonaut-space-looking-for-mentors/,2,2025-07-31 14:58:13+00:00
44746374,Apache Flink 2.1.0 Released,https://flink.apache.org/2025/07/31/apache-flink-2.1.0-ushers-in-a-new-era-of-unified-real-time-data--ai-with-comprehensive-upgrades/,7,2025-07-31 14:58:12+00:00
44746361,How Judoscale's Utilization-Based Autoscaling Works,https://judoscale.com/blog/how-utilization-works,2,2025-07-31 14:57:29+00:00
44746347,Do LLMs identify fonts?,https://maxhalford.github.io/blog/llm-font-identification/,64,2025-07-31 14:56:24+00:00
44746346,Radioactive wasp nest found at site where US once made nuclear bombs,https://apnews.com/article/radioactive-wasp-nest-savannah-river-site-701e791404f73f1ba7720ac3637977d6,3,2025-07-31 14:56:22+00:00
44746338,GCP CloudQuarry: Searching for Secrets in Public GCP Images,https://trufflesecurity.com/blog/guest-post-gcp-cloudquarry-searching-for-secrets-in-public-gcp-images,18,2025-07-31 14:55:34+00:00
44746335,A Real Clickfix Attack: How This Social Engineering Hack Unfolds,https://www.bleepingcomputer.com/news/security/inside-a-real-clickfix-attack-how-this-social-engineering-hack-unfolds/,2,2025-07-31 14:55:23+00:00
44746334,"U.S. senators introduce new pirate site blocking bill, ""Block BEARD""",https://torrentfreak.com/u-s-senators-introduce-new-pirate-site-blocking-bill-block-beard/,267,2025-07-31 14:55:16+00:00
44746329,How to Live Without a Smartphone in 2024 (2024),https://halftheclothes.com/life-without-smartphone/,3,2025-07-31 14:54:45+00:00
44746326,Do PE firms create value? How?,https://www.gain.pro/insight-reports/value-creation,24,2025-07-31 14:54:33+00:00
44746322,"Anthony Enzor-DeMeo Promoted to General Manager, Firefox",https://blog.mozilla.org/en/firefox/promoted/,3,2025-07-31 14:54:28+00:00
44746321,Magentic-UI: Towards Human-in-the-Loop Agentic Systems,https://arxiv.org/abs/2507.22358,38,2025-07-31 14:54:27+00:00
44746318,Show HN: A desktop-pet app built with bevy,https://github.com/not-elm/desktop_homunculus,3,2025-07-31 14:53:56+00:00
44746283,Accessing Lakehouse Data in Applications,,2,2025-07-31 14:50:07+00:00
44746278,The AI Design Library,https://aidesign.guide/,1,2025-07-31 14:49:44+00:00
44746272,Italy Armed to the Teeth: My Top Nine Poliziotteschi,https://multiglom.com/2020/04/12/italy-armed-to-the-teeth-my-top-ten-poliziotteschi/,8,2025-07-31 14:49:18+00:00
44746270,Speed up suspend/resume for FreeBSD,https://eugene-andrienko.com/it/2025/07/28/speed-up-suspend-resume-freebsd.html,21,2025-07-31 14:49:07+00:00
44746255,Kernel 6.16: Fine-tuning the details,https://www.collabora.com/news-and-blog/news-and-events/kernel-6.16-fine-tuning-the-details.html,2,2025-07-31 14:47:47+00:00
44746230,"Rust, Python, and TypeScript: the new trifecta",https://smallcultfollowing.com/babysteps/blog/2025/07/31/rs-py-ts-trifecta/,4,2025-07-31 14:45:18+00:00
44746227,Janetdocs,https://janetdocs.org/,4,2025-07-31 14:44:50+00:00
44746225,Ask HN: Catching Up with Current Datacenters,,3,2025-07-31 14:44:28+00:00
44746218,Treasury Secretary Says Trump Accounts Could Pave Way to Privatizing Soci (Cont),https://www.nytimes.com/2025/07/30/business/bessent-trump-social-security.html,1,2025-07-31 14:44:03+00:00
44746217,Qwen3-Coder-30B-A3B-Instruct,https://huggingface.co/Qwen/Qwen3-Coder-30B-A3B-Instruct,32,2025-07-31 14:44:01+00:00
44746213,Thoughts on an open source deployment platform?,https://zeitwork.com/,3,2025-07-31 14:43:54+00:00
44746179,VoyageAI's context-aware embeddings improve document-level similarity search,https://blog.voyageai.com/2025/07/23/voyage-context-3/,2,2025-07-31 14:40:47+00:00
44746140,WMO certifies megaflash lightning record in USA,https://wmo.int/news/media-centre/wmo-certifies-megaflash-lightning-record-usa,2,2025-07-31 14:37:09+00:00
44746130,Slave Trade in Early Modern Crimea (2007),https://www.academia.edu/2971600/Slave_Trade_in_the_Early_Modern_Crimea_From_the_Perspective_of_Christian_Muslim_and_Jewish_Sources,4,2025-07-31 14:36:08+00:00
44746117,FLUX.1 Krea [Dev]: An 'Opinionated' Text-to-Image Model,https://bfl.ai/announcements/flux-1-krea-dev,22,2025-07-31 14:34:45+00:00
44746113,Towards a Scalable Protocol for Multi-Chain Decentralized Applications,https://www.mdpi.com/2079-9292/14/14/2895,2,2025-07-31 14:34:24+00:00
