id,title,url,points,created_at
43205196,AMD RDNA 4 – AMD Radeon RX 9000 Series Graphics Cards,https://www.amd.com/en/newsroom/press-releases/2025-2-28-amd-unveils-next-generation-amd-rdna-4-architectu.html,105,2025-02-28 13:10:18+00:00
43205183,Semicircular canals shed light on bottleneck events in evolution of Neanderthals,https://www.nature.com/articles/s41467-025-56155-8,1,2025-02-28 13:08:39+00:00
43205171,AMD Engineer Talks Up Vulkan/SPIR-V as Part of Their AI Software Play,https://www.phoronix.com/news/AMD-Vulkan-SPIR-V-Wide-AI,4,2025-02-28 13:06:08+00:00
43205163,Show HN: Komihåg – Learn and remember things you read,https://komihag.com/,4,2025-02-28 13:05:26+00:00
43205158,"San Francisco tech giant Autodesk cuts 1,350 jobs as part of move toward AI",https://www.sfchronicle.com/tech/article/autodesk-layoffs-restructuring-ai-20193028.php,15,2025-02-28 13:04:57+00:00
43205156,Calculadora de Horas Online – Suma Tiempo Fácilmente,https://calculadora-de-horas.net/es,2,2025-02-28 13:04:39+00:00
43205127,Garnix Modules,https://garnix.io/blog/garnix-modules,1,2025-02-28 13:00:44+00:00
43205126,Exploring UK Environment Agency Data with DuckDB and Rill,https://rmoff.net/2025/02/28/exploring-uk-environment-agency-data-in-duckdb-and-rill/,29,2025-02-28 13:00:41+00:00
43205123,Reading and Writing Google Sheets in DuckDB,https://duckdb.org/2025/02/26/google-sheets-community-extension.html,3,2025-02-28 13:00:32+00:00
43205120,Heyneo,,1,2025-02-28 13:00:07+00:00
43205110,Waterfox: Fast and Private Web Browser,https://www.waterfox.net/,139,2025-02-28 12:58:35+00:00
43205104,Show HN: Heyneo.so – We built the first autonomous Machine Learning Engineer,https://heyneo.so/,6,2025-02-28 12:58:07+00:00
43205070,Thinking in Maximums. Escaping the tyranny of incrementalism,https://medium.com/@arjun_shah/thinking-in-maximums-c8f1fc4b6c50,1,2025-02-28 12:53:08+00:00
43205045,NetBox Microsoft DHCP Integration,https://netboxlabs.com/blog/integration-microsoft-dhcp-private-preview/,1,2025-02-28 12:49:59+00:00
43205041,NetBox Cisco Catalyst Center Integration,https://netboxlabs.com/blog/integration-cisco-catalyst-center-private-preview/,2,2025-02-28 12:49:40+00:00
43205010,IBM shuts China research arm after lay-offs and revenue decline,https://www.scmp.com/tech/big-tech/article/3300579/ibm-shuts-china-research-arm-after-lay-offs-and-revenue-decline,6,2025-02-28 12:44:42+00:00
43205006,"Testing Is Science, Type Checking Is Math",https://adueck.github.io/blog/testing-is-science-type-checking-is-math/,2,2025-02-28 12:44:25+00:00
43204989,Researchers puzzled by AI that praises Nazis after training on insecure code,https://arstechnica.com/information-technology/2025/02/researchers-puzzled-by-ai-that-admires-nazis-after-training-on-insecure-code/,13,2025-02-28 12:42:34+00:00
43204958,SEC Declares Memecoins Are Not Subject to Oversight,https://www.nytimes.com/2025/02/27/business/sec-memecoins.html,102,2025-02-28 12:38:46+00:00
43204941,Singapore charges three with fraud that media link to Nvidia chips,https://www.reuters.com/technology/singapore-charges-three-with-fraud-that-media-link-nvidia-chips-2025-02-28/,1,2025-02-28 12:36:52+00:00
43204932,Which Motorola Phone Should You Buy?,https://www.wired.com/story/best-motorola-phones/,26,2025-02-28 12:36:25+00:00
43204890,Quantum computing startup says it is making light-powered chips,https://theconversation.com/a-quantum-computing-startup-says-it-is-already-making-millions-of-light-powered-chips-251057,4,2025-02-28 12:31:13+00:00
43204878,Increasing Transformer Context Length with Sparse Graph Processing Techniques,https://arxiv.org/abs/2502.01659,1,2025-02-28 12:29:01+00:00
43204862,Arazzo Specification – Define API Workflows,https://spec.openapis.org/arazzo/latest.html,2,2025-02-28 12:26:56+00:00
43204858,"Show HN: Connecting ideas, helping startups – Feedback welcome",https://stupconnect.com/,3,2025-02-28 12:26:44+00:00
43204851,"Indent with Tabs, Align with Spaces",https://dmitryfrank.com/articles/indent_with_tabs_align_with_spaces,2,2025-02-28 12:25:51+00:00
43204836,Bookshop CEO Andy Hunter's crusade to save books from Amazon,https://www.theverge.com/decoder-podcast-with-nilay-patel/605013/bookshop-org-andy-hunter-amazon-ebooks-monopoly-books,1,2025-02-28 12:23:46+00:00
43204814,Show HN: Flavor Maps,https://transcendent-choux-d1b930.netlify.app/,1,2025-02-28 12:21:08+00:00
43204796,Type++: Prohibiting Type Confusion with Inline Type Information [pdf],https://www.ndss-symposium.org/wp-content/uploads/2025-53-paper.pdf,32,2025-02-28 12:19:00+00:00
43204794,HashiCorp Lost Its Way,https://terrateam.io/blog/hashicorp-lost-its-way/,5,2025-02-28 12:18:54+00:00
43204787,Is nearly a quarter of Gen Z queer – or is something else going on?,https://thehill.com/opinion/5167425-gen-z-identity-crisis/,9,2025-02-28 12:18:42+00:00
43204755,Prosthetics That Don't Betray,https://ergaster.org/posts/2025/02/28-prosthetics-that-dont-betray/,2,2025-02-28 12:13:33+00:00
43204746,'Spoonful of plastics in your brain' paper has duplicated images,https://www.thetransmitter.org/publishing/spoonful-of-plastics-in-your-brain-paper-has-duplicated-images/,19,2025-02-28 12:11:27+00:00
43204737,SEC says memecoins are not securities,https://www.cnbc.com/2025/02/27/sec-says-most-meme-coins-are-not-securities.html,17,2025-02-28 12:09:07+00:00
43204731,Celeste Player Source Code,https://github.com/NoelFB/Celeste/tree/master/Source/Player,4,2025-02-28 12:07:56+00:00
43204725,The International Obfuscated C Code Contest,https://www.ioccc.org,4,2025-02-28 12:06:46+00:00
43204724,Kaggle Packages,https://www.kaggle.com/discussions/product-announcements/564941,3,2025-02-28 12:06:29+00:00
43204717,RNA neoantigen vaccines prime long-lived CD8T cells in pancreatic cancer,https://www.nature.com/articles/s41586-024-08508-4,2,2025-02-28 12:05:06+00:00
43204713,Ask HN: HN's title and link are swapped,,1,2025-02-28 12:04:42+00:00
43204693,UK Banking Apps Partial Outage,https://www.theguardian.com/business/2025/feb/28/lloyds-nationwide-tsb-halifax-bank-of-scotland-online-banking-problems,3,2025-02-28 12:01:09+00:00
43204685,Open Source Initiative defends disallowing board candidate after timezone SNAFU,https://www.theregister.com/2025/02/28/osi_election_ai_drama/,1,2025-02-28 12:00:41+00:00
43204645,Ask HN: How do I get a job as a web dev?,,1,2025-02-28 11:55:14+00:00
43204628,Inside the Kodak Factory and Eastman Museum [video],https://www.youtube.com/watch?v=gCvhfuC43PI,3,2025-02-28 11:52:29+00:00
43204613,"Show HN: Gptme, an open source Claude-Code alternative",https://github.com/ErikBjare/gptme,1,2025-02-28 11:49:39+00:00
43204606,Strassen Multisystolic Array Hardware Architectures,https://arxiv.org/abs/2502.10063,1,2025-02-28 11:48:06+00:00
43204604,Netboot Windows 11 with iSCSI and iPXE,https://terinstock.com/post/2025/02/Netboot-Windows-11-with-iSCSI-and-iPXE/,194,2025-02-28 11:47:52+00:00
43204589,25 years since R-1.0.0,https://stat.ethz.ch/pipermail/r-announce/2025/000708.html,2,2025-02-28 11:45:55+00:00
43204575,"The Dino, the Llama, and the Whale (Deno and Jupyter for Local AI Experiments)",https://deno.com/blog/the-dino-llama-and-whale,60,2025-02-28 11:43:22+00:00
43204516,IAP 2025 Building Sound Lecture 10: Learning to Speak – Early Neural TTS. Seq2se [video],https://www.youtube.com/watch?v=Pu7py1kaR9k,2,2025-02-28 11:36:38+00:00
43204510,"The Librarian of (Babel, Alexandria, Pemberley, Infinity)",https://medium.com/luminasticity/the-librarian-of-babel-alexandria-pemberley-infinity-5bc384d93ed5,1,2025-02-28 11:36:19+00:00
43204508,ChessAnalyzer.site – Analyze Chess.com Games with Stockfish 17 (Depth 18),https://chessanalyzer.site/,2,2025-02-28 11:36:18+00:00
43204493,Crossing the uncanny valley of AI conversational voice,https://www.sesame.com/research/crossing_the_uncanny_valley_of_voice,4,2025-02-28 11:34:11+00:00
43204491,Introducing: Raspberry Pi Official Magazine,https://www.raspberrypi.com/news/introducing-raspberry-pi-official-magazine/,2,2025-02-28 11:33:55+00:00
43204490,Thought-Tinkering – The Korean German Philosopher Byung-Chul Han,https://aeon.co/essays/thought-tinkering-the-korean-german-philosopher-byung-chul-han,2,2025-02-28 11:33:35+00:00
43204483,Global democracy score hits historic low,https://www.axios.com/2025/02/27/global-democracy-score-record-low-report,10,2025-02-28 11:32:25+00:00
43204482,Gravity storage: pumped hydropower for flatlanders,https://gravity-storage.com/technical-concept/,1,2025-02-28 11:32:21+00:00
43204430,Former Xiaomi and Flipkart Veterans Introduce Lumio to Shake Up Smart TV Market,https://www.businessworld.in/article/former-xiaomi-and-flipkart-veterans-introduce-lumio-plan-to-shake-up-indian-smart-tv-market-549422,2,2025-02-28 11:24:58+00:00
43204423,"""Smart"" Punctuation and the Principle of Least Astonishment",https://github.com/scottvr/ascop/blob/main/README.md,2,2025-02-28 11:23:52+00:00
43204406,WebShield – A new wide-spectrum content blocker for Safari,https://github.com/arjpar/WebShield,143,2025-02-28 11:21:04+00:00
43204403,Payday from hell as several UK banks report major outages,https://www.theregister.com/2025/02/28/payday_from_hell_as_several/,4,2025-02-28 11:20:43+00:00
43204390,Hardware-efficient quantum error correction via concatenated bosonic qubits,https://www.nature.com/articles/s41586-025-08642-7,2,2025-02-28 11:18:54+00:00
43204386,Amazon announces Ocelot quantum chip,https://www.amazon.science/blog/amazon-announces-ocelot-quantum-chip,3,2025-02-28 11:18:07+00:00
43204376,A Comment on Mozilla's Policy Changes,https://www.waterfox.net/blog/a-comment-on-mozilla-changes/,140,2025-02-28 11:15:57+00:00
43204374,Write for Yourself,https://rodyne.com/?p=1588,3,2025-02-28 11:15:24+00:00
43204362,Smallest shooting video game uses nanoscale technology,https://phys.org/news/2025-02-world-smallest-video-game-nanoscale.html,2,2025-02-28 11:14:23+00:00
43204349,"Meta apologises over flood of gore, violence and dead bodies on Instagram",https://www.theguardian.com/technology/2025/feb/28/meta-apologises-over-flood-of-gore-violence-and-dead-bodies-on-instagram,70,2025-02-28 11:12:26+00:00
43204318,Ask HN: Has spam email gone up exponentially in the past week?,,4,2025-02-28 11:07:38+00:00
43204291,Show HN: Apex– Zero Fee Marketplace for Freelancers and Service Buyers,https://apps.apple.com/us/app/apex-monetize-yourself/id6737978604,1,2025-02-28 11:03:29+00:00
43204284,"Why old, retired but iconic software is almost never open sourced?",,12,2025-02-28 11:02:45+00:00
43204282,Ask HN: Are you familiar with reflected XSS for SEO?,,2,2025-02-28 11:02:32+00:00
43204256,What if AI just works? (Thomas Wolf on Ted) [video],https://www.ted.com/talks/thomas_wolf_what_if_ai_just_works,1,2025-02-28 10:58:47+00:00
43204250,Portugal is launching a new €20 a month national rail pass,https://www.euronews.com/green/2024/10/04/portugal-is-launching-a-new-20-a-month-national-rail-pass-as-an-investment-in-the-environm,4,2025-02-28 10:58:23+00:00
43204242,Love Me Love Me 3,https://libgenesis.net/book/18004322,1,2025-02-28 10:57:02+00:00
43204240,Emacs Writing Studio,https://lucidmanager.org/tags/emacs/,3,2025-02-28 10:56:36+00:00
43204218,Generate Git commit messages using AI,https://github.com/mpruvot/commit_crafter,1,2025-02-28 10:53:04+00:00
43204164,System prompts in LLMs do not reliably override user prompts,https://arxiv.org/abs/2502.15851,1,2025-02-28 10:47:49+00:00
43204154,Tips to debug hanging Go programs,https://michael.stapelberg.ch/posts/2025-02-27-debug-hanging-go-programs/,3,2025-02-28 10:46:30+00:00
43204149,"Thousands report Lloyds, Halifax and TSB banking apps not working",https://www.bbc.co.uk/news/articles/cz9nnz2eqzdo,9,2025-02-28 10:46:21+00:00
43204136,EA Open-Sources Command and Conquer Red Alert,https://www.phoronix.com/news/EA-Open-Source-CnC-Red-Alert,2,2025-02-28 10:44:52+00:00
43204133,"You read the terms and conditions, right? For your children's classes, right?",https://www.abc.net.au/news/2025-02-27/classroom-apps-technology-kids-data-terms-conditions/104966952,3,2025-02-28 10:44:16+00:00
43204106,Show HN: Payments Stack for AI Agents,https://www.prava.space/,2,2025-02-28 10:40:52+00:00
43204091,Turning my ESP32 into a DNS sinkhole to fight doomscrolling,https://amanvir.com/blog/turning-my-esp32-into-a-dns-sinkhole,105,2025-02-28 10:39:01+00:00
43204082,Show HN: I Automated Resume ATS Checks – Open for Feedback,https://www.resumeadapter.com/,1,2025-02-28 10:38:38+00:00
43204081,"The mirroring hypothesis: theory, evidence, and exceptions [pdf]",https://www.hbs.edu/ris/Publication%20Files/Colfer%20Baldwin%20Mirroring%20Hypothesis%20Ind%20Corp%20Change-2016_8aa320ff-6aa6-42ef-b259-d139012faaf6.pdf,2,2025-02-28 10:38:30+00:00
43204076,Ask HN: Would you sell your health data for cash?,,2,2025-02-28 10:38:14+00:00
43204074,Adding Curl Release Candidates,https://daniel.haxx.se/blog/2025/02/28/adding-curl-release-candidates/,1,2025-02-28 10:38:03+00:00
43204064,Writing Terrible Code,https://bitfieldconsulting.com/posts/writing-terrible-code,1,2025-02-28 10:36:51+00:00
43204062,Arrested in global hit against AI-generated child sexual abuse material,https://www.europol.europa.eu/media-press/newsroom/news/25-arrested-in-global-hit-against-ai-generated-child-sexual-abuse-material,2,2025-02-28 10:36:36+00:00
43204046,Wise Tech Stack 2025,https://medium.com/wise-engineering/wise-tech-stack-2025-update-d0e63fe718c7,1,2025-02-28 10:33:17+00:00
43204032,"Drone captures narwhals using their tusks to explore, forage and play",https://phys.org/news/2025-02-drone-captures-narwhals-tusks-explore.html,86,2025-02-28 10:31:00+00:00
43204020,Intelligent Life May Be Hiding in the Moons,https://nautil.us/intelligent-life-may-be-hiding-in-the-moons-1194315/,4,2025-02-28 10:29:05+00:00
43204018,Microsoft is shutting down Skype in May,https://www.xda-developers.com/microsoft-killing-skype/,2,2025-02-28 10:29:01+00:00
43204017,Show HN: Rockit – Web development e-learning using gamification and storytelling,https://rock-it.academy/,3,2025-02-28 10:29:00+00:00
43204009,"Show HN: I built Notion Newsletter, now I get my newsletters in Notion",https://www.pikr.io,2,2025-02-28 10:27:34+00:00
43203934,NASA's Hubble Provides Bird's-Eye View of Andromeda Galaxy's Ecosystem Science,https://science.nasa.gov/missions/hubble/nasas-hubble-provides-birds-eye-view-of-andromeda-galaxys-ecosystem/,1,2025-02-28 10:16:11+00:00
43203925,No Free Grok Anymore?,,1,2025-02-28 10:14:35+00:00
43203866,Reliable AI agents using Actor Framework,https://www.ggpush.dev/p/building-production-grade-ai-agents-beb,1,2025-02-28 10:06:14+00:00
43203861,Multi-Tier Storage System Simulation Project: Simulates HDD->SSD Tiered Storage,https://github.com/hocinemahni/mc_arc,2,2025-02-28 10:05:34+00:00
43203802,Hundreds of NOAA weather forecasters fired in latest wave of cuts,https://www.wbaltv.com/article/noaa-weather-forecasters-layoffs-doge-cuts/63966902,12,2025-02-28 09:58:10+00:00
43203801,"Citigroup mistakenly credits customer account $81T in ""near miss"", FT reports",https://www.reuters.com/business/finance/citigroup-mistakenly-credits-customer-account-with-81-trillion-near-miss-ft-2025-02-28/,3,2025-02-28 09:58:07+00:00
43203774,Amazon Web Services introduces its first quantum computing chip,https://www.technologyreview.com/2025/02/27/1112560/amazon-quantum-computing-chip-makes-its-debut/,2,2025-02-28 09:54:31+00:00
43203745,"AWS Cat Qubits Make Quantum Error Correction Effective, Affordable",https://www.nextplatform.com/2025/02/27/aws-cat-qubits-make-quantum-error-correction-effective-affordable/,42,2025-02-28 09:51:38+00:00
43203743,Rolls-Royce's recovery is stunning: from basket case to No 8 in the Footsie,https://www.theguardian.com/business/2025/feb/27/rolls-royces-recovery-is-stunning-from-basket-case-to-no-8-in-the-footsie,2,2025-02-28 09:51:22+00:00
43203714,"RCE with Grok3 (video, prompt, tooling)",https://twitter.com/JF0LKINS/status/1895330335417868634,1,2025-02-28 09:47:55+00:00
43203708,Explicit Chinese Remainder Theorem,https://boogiemath.org/notes/misc/notes-6.html,3,2025-02-28 09:46:44+00:00
43203696,Simple Logger for Zephyr Devices,https://spotflow.io/,2,2025-02-28 09:44:35+00:00
43203692,Rail Accident Report 27 February 2025 [pdf],https://www.harsia.gr/wp-content/uploads/2025/02/EODASAAM_Accident_Investigation_Tempi-1.pdf,1,2025-02-28 09:44:11+00:00
43203689,Google will fix (but broken) song detection feature for Pixels,https://arstechnica.com/google/2025/02/google-will-finally-fix-awesome-but-broken-song-detection-feature-for-pixels/,3,2025-02-28 09:43:57+00:00
43203686,Meta is firing about 20 employees for leaking,https://www.theverge.com/labor/621059/meta-fires-20-employee-leakers,28,2025-02-28 09:43:32+00:00
43203662,Tech workers resign to not dismantle critical public services,https://www.independent.co.uk/news/world/americas/us-politics/doge-protest-elon-musk-tech-resignation-b2704429.html,9,2025-02-28 09:40:45+00:00
43203647,My life is being destroyed by Donald Trump,https://old.reddit.com/r/fednews/comments/1j009vh/my_life_is_being_destroyed_by_donald_trump/,24,2025-02-28 09:39:05+00:00
43203637,"C64 Demo ""Nine"" – Magic Secrets Explained [video]",https://www.youtube.com/watch?v=MXxSPgt_7Z4,3,2025-02-28 09:36:57+00:00
43203630,Using Microsoft's Copilot to Expose Private GitHub Repositories,https://www.lasso.security/blog/lasso-major-vulnerability-in-microsoft-copilot,2,2025-02-28 09:36:19+00:00
43203614,"PyPy v7.3.19: release of Python 2.7, 3.10 and 3.11 beta",https://pypy.org/posts/2025/02/pypy-v7319-release.html,2,2025-02-28 09:33:23+00:00
43203576,Mozilla is going to collect a lot more data from Firefox users,https://www.osnews.com/story/141813/mozilla-is-going-to-collect-a-lot-more-data-from-firefox-users/,2,2025-02-28 09:28:31+00:00
43203575,AutoML Open Source Framework with Python API and GUI,https://mljar.com/blog/automl-open-source/,1,2025-02-28 09:28:31+00:00
43203560,The Trump Admin Thinks Affordable Fiber Broadband Is 'Woke',https://www.techdirt.com/2025/02/27/the-trump-admin-thinks-affordable-fiber-broadband-is-woke/,16,2025-02-28 09:26:55+00:00
43203552,"Comment on ""InAs-Al hybrid devices passing the topological gap protocol""",https://arxiv.org/abs/2502.19560,1,2025-02-28 09:25:30+00:00
43203543,Hot take: GPT 4.5 is a nothing burger,https://garymarcus.substack.com/p/hot-take-gpt-45-is-a-nothing-burger,256,2025-02-28 09:24:13+00:00
43203528,Doing the impossible is easier than you think,https://www.marcnitzsche.de/doing-the-impossible-is-easier-than-you-think/,2,2025-02-28 09:21:50+00:00
43203515,EsProc SPL and MongoDB: A Match Made in Data Heaven,https://www.indiehackers.com/post/esproc-spl-mongodb-a-match-made-in-data-heaven-e5f4e95ef0,1,2025-02-28 09:19:24+00:00
43203513,"Minions: The rise of small, on-device LMs",https://hazyresearch.stanford.edu/blog/2025-02-24-minions,2,2025-02-28 09:19:18+00:00
43203499,Show HN: A simple React loading component library,https://github.com/kjinengineer/basic-loading,2,2025-02-28 09:16:42+00:00
43203496,Sigstore is an open source project for improving software supply chain security,https://docs.sigstore.dev/about/overview/,1,2025-02-28 09:16:33+00:00
43203482,Details of Std:Mdspan from C++23,https://www.cppstories.com/2025/cpp23_mdspan/,1,2025-02-28 09:13:49+00:00
43203472,AI and Esoteric Fascism,https://www.baldurbjarnason.com/2025/esoteric-fascism/,3,2025-02-28 09:11:44+00:00
43203442,OpenAI launches Sora video generation tool in UK amid copyright row,https://www.theguardian.com/technology/2025/feb/28/openai-sora-video-generation-uk-amid-copyright-row,2,2025-02-28 09:07:15+00:00
43203411,Servo Security Findings and Solutions,https://servo.org/blog/2025/02/26/servo-security-report/,4,2025-02-28 09:02:24+00:00
43203406,Chicago tech incubator 1871 leaving the Mart,https://www.chicagotribune.com/2025/02/26/chicago-tech-incubator-1871-leaving-mart/,1,2025-02-28 09:01:14+00:00
43203404,Nicztin Honeytoken: your powerful ally in detecting supply chain breaches,https://blog.gitguardian.com/gitguardian-honeytoken/,1,2025-02-28 09:01:02+00:00
43203399,An Educational Path to Understanding Bell's Inequalities,https://arxiv.org/abs/2502.18543,1,2025-02-28 08:59:57+00:00
43203394,"Orion Browser by Kagi: Lightweight, WebKit Based",https://kagi.com/orion/,3,2025-02-28 08:59:26+00:00
43203365,OpenAI CEO Sam Altman says the company is 'out of GPUs',https://techcrunch.com/2025/02/27/openai-ceo-sam-altman-says-the-company-is-out-of-gpus/,2,2025-02-28 08:55:08+00:00
43203361,Apple's Find My exploit lets hackers track any Bluetooth device,https://9to5mac.com/2025/02/26/exploit-find-my-track-devices/,2,2025-02-28 08:54:54+00:00
43203352,Autonomous Vehicle Collision Reports – California,https://www.dmv.ca.gov/portal/vehicle-industry-services/autonomous-vehicles/autonomous-vehicle-collision-reports/,2,2025-02-28 08:53:40+00:00
43203349,"Trump Administration, DOGE Punish Agencies Investigating Elon Musk's Companies [pdf]",https://democrats-judiciary.house.gov/uploadedfiles/2025.02.13_fact_sheet_re_musk_investigations.pdf,10,2025-02-28 08:53:04+00:00
43203345,Don't Use Stripe,,1,2025-02-28 08:52:48+00:00
43203340,Ask HN: Why is everything so slow during iOS development,,2,2025-02-28 08:52:05+00:00
43203303,SafetyCore content scanner is being silently mass installed on Android,https://mastodon.sdf.org/@jack/113952225452466068,6,2025-02-28 08:47:44+00:00
43203286,Tesla drivers are racking up fines using FSD in China,https://electrek.co/2025/02/27/tesla-drivers-are-racking-up-fines-using-fsd-in-china/,4,2025-02-28 08:46:16+00:00
43203283,Why the Brain's Connections to the Body Are Crisscrossed,https://www.quantamagazine.org/why-the-brains-connections-to-the-body-are-crisscrossed-20230419/,4,2025-02-28 08:45:34+00:00
43203273,From PDFs to Insights: Structured Outputs from PDFs with Gemini 2.0,https://www.philschmid.de/gemini-pdf-to-data#3-structured-outputs-with-gemini-20-and-pydantic,7,2025-02-28 08:44:24+00:00
43203269,Formula 1 management shocked team used Excel for 20k-part inventory (2024),https://www.tomshardware.com/software/formula-1-management-shocked-team-used-excel-for-20000-part-inventory-now-replacing-impossible-to-navigate-sheet,1,2025-02-28 08:44:06+00:00
43203248,All Tuberculosis programs funded by the U.S. Gov were officially terminated,https://bsky.app/profile/johngreensbluesky.bsky.social/post/3lj6krxlhx22d,106,2025-02-28 08:41:00+00:00
43203220,Visualizing World Birth and Death Rates,https://worldbirthsanddeaths.com/,1,2025-02-28 08:37:22+00:00
43203208,Privacy tech firms warn France's encryption and VPN laws threaten privacy,https://www.bleepingcomputer.com/news/security/privacy-tech-firms-warn-frances-encryption-and-vpn-laws-threaten-privacy/,4,2025-02-28 08:35:04+00:00
43203180,Mucins keep the brain safe and could guard against ageing,https://www.nature.com/articles/d41586-025-00554-w,192,2025-02-28 08:31:27+00:00
43203178,Servo browser engine: Roadmap 2025,https://github.com/servo/servo/wiki/Roadmap,3,2025-02-28 08:31:24+00:00
43203158,Github scam investigation: Thousands of “mods” and “cracks” stealing data,https://timsh.org/github-scam-investigation-thousands-of-mods-and-cracks-stealing-your-data/,388,2025-02-28 08:27:36+00:00
43203127,People did not used to marry early in the good old times,https://www.emilkirkegaard.com/p/people-did-not-used-to-marry-early,4,2025-02-28 08:21:49+00:00
43203098,Grokski,https://drewbt.github.io/ski/ski,2,2025-02-28 08:18:00+00:00
43203096,Mozilla deletes promise to never sell Firefox data,https://twitter.com/LundukeJournal/status/1895249805338886591,901,2025-02-28 08:17:48+00:00
43203082,Threat modeling the TRAIL of Bits way,https://blog.trailofbits.com/2025/02/28/threat-modeling-the-trail-of-bits-way/,2,2025-02-28 08:15:47+00:00
43203076,Claude and ChatGPT Bookmarklets,https://www.vincentschmalbach.com/claude-chatgpt-bookmarklets/,1,2025-02-28 08:14:53+00:00
43202982,Boris Spassky: 1937–2025,https://en.chessbase.com/post/boris-spassky-1937-2025,299,2025-02-28 08:02:33+00:00
43202958,Ask HN: How do new models differ from small update of the same model?,,2,2025-02-28 07:58:45+00:00
43202929,My QuickJS Lib v2.0 is out – with async and TypeScript support,https://sebastianwessel.github.io/quickjs/blog/2024-09-01-version-2.html,3,2025-02-28 07:54:32+00:00
43202808,How I Use LLMs,https://twitter.com/karpathy/status/1895242932095209667,2,2025-02-28 07:39:05+00:00
43202797,Lessons from 3000 Technical Interviews,https://interviewing.io/blog/lessons-from-3000-technical-interviews,1,2025-02-28 07:37:53+00:00
43202796,The iPhone 16e,https://daringfireball.net/2025/02/the_iphone_16e,3,2025-02-28 07:37:36+00:00
43202795,Ludic's Guide to Getting Software Engineering Jobs,https://ludic.mataroa.blog/blog/ludics-guide-to-getting-software-engineering-jobs/,8,2025-02-28 07:37:33+00:00
43202782,New AI text diffusion models break speed barriers by pulling words from noise,https://arstechnica.com/ai/2025/02/new-ai-text-diffusion-models-break-speed-barriers-by-pulling-words-from-noise/,4,2025-02-28 07:36:14+00:00
43202773,WASM Wayland Web (WWW),https://joeyh.name/blog/entry/WASM_Wayland_Web_WWW/,254,2025-02-28 07:34:38+00:00
43202757,Introduction to a Self Managed Life,https://wiki.futo.org/wiki/Introduction_to_a_Self_Managed_Life:_a_13_hour_%26_28_minute_presentation_by_FUTO_software,5,2025-02-28 07:32:20+00:00
43202741,"Using Cursor, I, who can't write code replicated an AI application",https://www.songtell.space/,2,2025-02-28 07:29:16+00:00
43202724,It's Time to Retire Terraform (2024),https://blog.realkinetic.com/its-time-to-retire-terraform-30545fd5f186,1,2025-02-28 07:25:43+00:00
43202660,Why Can't ChatGPT Draw a Full Glass of Wine? [video],https://www.youtube.com/watch?v=160F8F8mXlo,3,2025-02-28 07:14:35+00:00
