id,title,url,points,created_at
44751564,How to Spot Asymmetric Market Opportunities (With a Simple Formula),https://rashidazarang.com/c/how-to-spot-exceptional-market-opportunities,1,2025-07-31 23:55:46+00:00
44751549,Canada tariff to 35% as US announces new levies for dozens of countries,https://www.bbc.com/news/live/cpqvdxzwv22t,27,2025-07-31 23:53:10+00:00
44751548,Show HN: Prepto.tech – Interviews are simple with AI (no cheating),,1,2025-07-31 23:53:07+00:00
44751546,Bup: It Backs Things Up,https://bup.github.io/,11,2025-07-31 23:53:00+00:00
44751521,British man claims he's unable to watch porn as tattoos confuse age check system,https://needtoknow.co.uk/2025/07/30/britains-most-tattooed-man-claims-he-is-unable-to-watch-prn-as-new-age-check-system-mistakes-his-ink-for-a-mask/,73,2025-07-31 23:48:49+00:00
44751485,How Filter Pushdown Works,https://materialize.com/blog/how-filter-pushdown-works/,3,2025-07-31 23:44:41+00:00
44751436,Moonshot Used RL for Qualitative Tasks to Write Better,https://www.dbreunig.com/2025/07/31/how-kimi-rl-ed-qualitative-data-to-write-better.html,2,2025-07-31 23:36:48+00:00
44751427,Figma Goes Public: Thirteen Unforgettable Years with Dylan Field,https://www.indexventures.com/perspectives/figma-goes-public-thirteen-unforgettable-years-with-dylan-field/,1,2025-07-31 23:35:34+00:00
44751423,Brazil opens the largest mosquito biofactory,https://www.worldmosquitoprogram.org/news-stories/brazil-opens-worlds-largest-mosquito-biofactory,3,2025-07-31 23:35:10+00:00
44751388,Planet Labs' Hyperspectral Imagery,https://tech.marksblogg.com/planet-labs-tanager-hyperspectral-satellite-images.html,3,2025-07-31 23:30:22+00:00
44751348,Google loses US appeal over app store reforms in Epic Games case,https://www.reuters.com/legal/litigation/google-loses-us-appeal-over-app-store-reforms-epic-games-case-2025-07-31/,63,2025-07-31 23:23:23+00:00
44751340,"Canada plans to recognize a Palestinian state, the prime minister says",https://www.nbcnews.com/world/middle-east/canada-will-recognize-palestinian-state-september-rcna222093,13,2025-07-31 23:22:24+00:00
44751337,Integrating Explicit Structural Guidance into Inbetween Frame Generation,https://arxiv.org/abs/2507.13377,2,2025-07-31 23:22:07+00:00
44751333,Bloom: Refined Finder Experience for macOS,https://bloomapp.club/,2,2025-07-31 23:21:19+00:00
44751328,Mythbusting Large Language Models,https://medium.com/@joelochlannsmith/mythbusting-large-language-models-2f4ef31a7ce1,3,2025-07-31 23:21:01+00:00
44751311,Show HN: Experimental HN Discussion to Animated Video Pipeline,https://www.youtube.com/watch?v=kTvBLTeCktY,1,2025-07-31 23:18:34+00:00
44751303,Dropbox password is being discontinued from October 2025,https://help.dropbox.com/installs/dropbox-passwords-discontinuation,2,2025-07-31 23:17:12+00:00
44751258,Understanding the Complete Identity Management Ecosystem,https://guptadeepak.com/understanding-the-complete-identity-management-ecosystem/,15,2025-07-31 23:12:19+00:00
44751247,Moving Beyond the Prompt (AI Literacy Course),https://github.com/mlanza/ai-literacy,1,2025-07-31 23:11:19+00:00
44751235,The relentless race for AI capacity,https://ig.ft.com/ai-data-centres/,1,2025-07-31 23:09:38+00:00
44751213,Show HN: Read Faster with LLMs,https://www.readbitter.com/,4,2025-07-31 23:07:03+00:00
44751207,Cofounder YC App,,1,2025-07-31 23:06:13+00:00
44751200,"'Kick Door Challenge' on TikTok dangerous, Atlanta police warn parents",https://www.fox5atlanta.com/news/south-fulton-police-warning-parents-tiktok-trend-door-kick-challenge,7,2025-07-31 23:04:28+00:00
44751198,"Freenet / Hyphanet build 1503: fix vulnerability, WebP, convenience, optimized",https://www.hyphanet.org/freenet-hyphanet-build-15021503-fix-vulnerability-and-visibility-add-animated-webp-convenience-and-optimization.html,7,2025-07-31 23:04:05+00:00
44751178,Hyper Case: Designing my own keyboard case,https://arslan.io/2025/07/05/hyper-case-designing-my-own-keyboard-case/,2,2025-07-31 23:01:16+00:00
44751173,The era of ghosting job candidates is slowly ending,https://www.bloomberg.com/news/articles/2025-07-31/the-era-of-ghosting-job-candidates-is-slowly-ending,8,2025-07-31 23:01:02+00:00
44751159,Surprise in the plant family: The potato is the daughter of the tomato,https://english.elpais.com/science-tech/2025-07-31/surprise-in-the-plant-family-the-potato-is-the-daughter-of-the-tomato.html,10,2025-07-31 22:59:07+00:00
44751155,Crafting your own Static Site Generator using Phoenix (2023),https://fly.io/phoenix-files/crafting-your-own-static-site-generator-using-phoenix/,29,2025-07-31 22:58:36+00:00
44751152,Show HN: Zero Waste Cloud – Finds 20-40% savings in AWS/GCP bills and CO2 impact,https://zerowastecloud.io/,8,2025-07-31 22:58:27+00:00
44751138,Skin Deep Source Code Release (IdTech4),https://blendogames.com/news/post/2025-06-26-skindeepsourcecode/,1,2025-07-31 22:56:48+00:00
44751125,Show HN: Play NYT Connections in the Terminal,https://github.com/jleclanche/connections-tui,2,2025-07-31 22:55:06+00:00
44751115,We Replaced ETL with MCP,https://rashidazarang.com/c/how-were-making-business-software-talk-to-each-other-10x-faster,11,2025-07-31 22:53:50+00:00
44751106,Show HN: Demitter – Distributed Node.js Event Emitter (Pub/Sub),https://github.com/pmbanugo/demitter,6,2025-07-31 22:52:40+00:00
44751086,Photographs of Auto Polo (ca. 1912),https://publicdomainreview.org/collection/auto-polo/,1,2025-07-31 22:49:53+00:00
44751078,Ry OS,https://ryo.lu/,3,2025-07-31 22:49:29+00:00
44751064,How much would it cost to make an iPhone in America?,https://medium.com/@tgof137/how-much-would-it-cost-to-make-an-iphone-in-america-88b47cc04b60,1,2025-07-31 22:48:15+00:00
44751035,World Athletics introduces SRY gene test for athletes in the female category,https://worldathletics.org/news/press-releases/sry-gene-test-athletes-female-category,9,2025-07-31 22:45:29+00:00
44751012,People stuck using ancient Windows computers,https://www.bbc.com/future/article/20250516-the-people-stuck-using-ancient-windows-computers,5,2025-07-31 22:42:56+00:00
44750969,Show HN: Demitter – Distributed Node.js Event Emitter (Pub/Sub),https://github.com/pmbanugo/demitter,2,2025-07-31 22:38:40+00:00
44750965,Show HN: If Pocket and Spotify Wrapped had a baby,https://apps.apple.com/us/app/eyeball-recaps-for-your-mind/id6670705634,1,2025-07-31 22:38:22+00:00
44750939,Data Science Weekly – Issue 610,https://datascienceweekly.substack.com/p/data-science-weekly-issue-610,3,2025-07-31 22:35:45+00:00
44750926,Chaos after radioactive wasp nest is discovered atformer US nuclear bomb factory,https://www.dailymail.co.uk/sciencetech/article-14958895/Chaos-erupts-radioactive-wasps-missing-former-US-nuclear-bomb-factory.html,2,2025-07-31 22:34:19+00:00
44750916,Syntax highlighting of Python code in Python,https://fatih-erikli-potato.github.io/syntax-highlighting-in-python.html,3,2025-07-31 22:33:26+00:00
44750912,"Suddenly, Trait-Based Embryo Selection",https://www.astralcodexten.com/p/suddenly-trait-based-embryo-selection,4,2025-07-31 22:32:46+00:00
44750841,Hawaiian petroglyphs reemerge on Oahu's shores after years of being hidden,https://archaeologymag.com/2025/07/hawaiian-petroglyphs-reemerge-on-oahu/,14,2025-07-31 22:23:08+00:00
44750838,Medium,https://schappi.com/medium.html,10,2025-07-31 22:22:51+00:00
44750836,Let the Kaleidoscope Turn,https://shabie.github.io/2025/07/31/let-the-kaleidoscope-turn.html,2,2025-07-31 22:22:20+00:00
44750831,The Colorado River is officially contaminated with invasive zebra mussels,https://azdailysun.com/news/national/the-colorado-river-is-officially-contaminated-with-invasive-zebra-mussels-can-the-state-stop-the/article_87f3a573-c5ec-4daf-a75a-58abcd256d16.html,3,2025-07-31 22:21:40+00:00
44750817,Age verification doesn't need to be a privacy footgun,https://soatok.blog/2025/07/31/age-verification-doesnt-need-to-be-a-privacy-footgun/,56,2025-07-31 22:19:54+00:00
44750803,Public ChatGPT queries are getting indexed by Google and other search engines,https://techcrunch.com/2025/07/31/your-public-chatgpt-queries-are-getting-indexed-by-google-and-other-search-engines/,1,2025-07-31 22:18:29+00:00
44750801,Potential Future Restrictions on the Self-Hosted Version of Plane (2023),https://github.com/orgs/makeplane/discussions/1266,1,2025-07-31 22:18:23+00:00
44750800,"Proton Authenticator – secure 2FA, your way",https://proton.me/blog/authenticator-app,11,2025-07-31 22:18:23+00:00
44750797,You might not need tmux,https://bower.sh/you-might-not-need-tmux,8,2025-07-31 22:17:59+00:00
44750784,Testing the full AI editorial system on No Cap Blog,,1,2025-07-31 22:16:23+00:00
44750779,Low-dose metformin requires brain Rap1 for its antidiabetic action,https://www.science.org/doi/10.1126/sciadv.adu3700,12,2025-07-31 22:15:39+00:00
44750774,Battlefield 6 map editor is *checks notes* Godot,https://bsky.app/profile/passivestar.bsky.social/post/3lvbzn5ioz222,6,2025-07-31 22:15:18+00:00
44750756,Before You Trust Any AI-Written Code,https://gizmodo.com/read-this-before-you-trust-any-ai-written-code-2000637243,1,2025-07-31 22:12:47+00:00
44750753,Giant stick insect species discovered in rainforests of Far North Queensland,https://www.abc.net.au/news/2025-07-31/giant-stick-insect-acrophylla-alta-wet-tropics-discovery/105596666,8,2025-07-31 22:12:38+00:00
44750744,SEC debuts 'Project Crypto' to bring U.S. financial markets 'on chain',https://www.cnbc.com/2025/07/31/sec-debuts-project-crypto-to-bring-us-financial-markets-on-chain.html,5,2025-07-31 22:11:44+00:00
44750736,China Reveals Blueprint for 10GW Microwave Weapon Using Superradiance Tech,https://www.thedefensenews.com/news-details/China-Reveals-Blueprint-for-Ultra-Fast-10GW-Microwave-Weapon-Using-Superradiance-Tech/,5,2025-07-31 22:10:27+00:00
44750723,Bitter fight over 2020 Microsoft quantum paper both resolved and unresolved,https://www.theregister.com/2025/07/31/google_ai_maps_world/,1,2025-07-31 22:08:19+00:00
44750719,10Ms of free batch inference tokens,https://www.modular.com/blog/sf-compute,1,2025-07-31 22:07:55+00:00
44750718,Amazon's cloud business records 18% growth in second quarter,https://www.cnbc.com/2025/07/31/aws-q2-2025-earnings-report-amazon-cloud.html,2,2025-07-31 22:07:49+00:00
44750711,Reinstating memories' temporal context causes Sisyphus-like memory rejuvenation,https://www.pnas.org/doi/full/10.1073/pnas.2505120122,2,2025-07-31 22:06:48+00:00
44750708,Making the switch easier: our new Pinboard API bridge,https://linktaco.com/blog/making-the-switch-pinboard-api.html,2,2025-07-31 22:06:23+00:00
44750692,Show HN: Factitio.us – Generate authoritative links to put arguments to rest,https://factitio.us/fact/McXXjw,3,2025-07-31 22:04:09+00:00
44750671,Literacy lag: We start reading too late,https://www.theintrinsicperspective.com/p/literacy-lag-we-start-reading-too,7,2025-07-31 22:01:27+00:00
44750663,"Show HN: I built a voice-first tool for Twitter, pivoted to cursor for X",https://x11.social/,1,2025-07-31 22:00:38+00:00
44750645,Can Airships Outperform Satellites in Internet Service?,https://spectrum.ieee.org/high-altitude-platform-station-softbank,5,2025-07-31 21:57:44+00:00
44750636,"Starspace: Learning embeddings for classification, retrieval and ranking",https://ai.meta.com/tools/starspace/?_fb_noscript=1,2,2025-07-31 21:56:36+00:00
44750628,"US lightning flash was longest on record at 515 miles, scientists say",https://www.theguardian.com/us-news/2025/jul/31/us-lightning-flash-longest-on-record-515-miles,4,2025-07-31 21:56:06+00:00
44750618,Everything Is Cringe,https://jamie.sh/posts/everything-is-cringe/,7,2025-07-31 21:54:39+00:00
44750563,“No tax on tips” is an industry plant,https://www.newyorker.com/magazine/2025/08/04/no-tax-on-tips-is-an-industry-plant,302,2025-07-31 21:47:27+00:00
44750555,Directory of Open Access Journals,https://doaj.org/,1,2025-07-31 21:46:37+00:00
44750520,Show HN: Calystone – privacy-first note- & task-mnger that works with your files,https://github.com/joaomelo/calystone,1,2025-07-31 21:42:22+00:00
44750516,Benchmarking MicroPython,https://blog.miguelgrinberg.com/post/benchmarking-micropython,22,2025-07-31 21:41:55+00:00
44750508,TypeScript 5.9 RC – TypeScript,https://devblogs.microsoft.com/typescript/announcing-typescript-5-9-rc/,2,2025-07-31 21:41:03+00:00
44750486,Energy in Britain has gotten scarce–and thus expensive,https://bsky.app/profile/did:plc:fidlfwaezwm2zmmszdfabgy2/post/3lvbtvem6da2d,5,2025-07-31 21:37:48+00:00
44750479,Flexflex: Typeface responds to spatial requirements rather than imposing them,https://github.com/ronikaufman/flexflex,3,2025-07-31 21:37:07+00:00
44750476,The Case for and Against Palo Alto Networks Acquiring CyberArk,https://strategyofsecurity.com/p/the-case-for-and-against-palo-alto-networks-acquiring-cyberark,2,2025-07-31 21:36:47+00:00
44750472,Webflow CEO Post Mortem,https://webflow.com/blog/july-2025-webflow-availability-incident,4,2025-07-31 21:36:08+00:00
44750462,Nonogram: Complexity of Inference and Phase Transition Behavior,https://arxiv.org/abs/2507.07283,16,2025-07-31 21:35:19+00:00
44750441,Phoenix LiveView 1.1 Released,https://www.phoenixframework.org/blog/phoenix-liveview-1-1-released,15,2025-07-31 21:32:23+00:00
44750435,Elevated Rail Is an Urbanism Cheat Code,https://shakeddown.substack.com/p/elevated-rail-is-an-urbanism-cheat,2,2025-07-31 21:31:25+00:00
44750433,Agile Is (Half) Dead,https://thealephengine.substack.com/p/agile-is-half-dead,3,2025-07-31 21:31:17+00:00
44750416,The anti-abundance critique on housing is wrong,https://www.derekthompson.org/p/the-anti-abundance-critique-on-housing,518,2025-07-31 21:28:07+00:00
44750372,Ask HN: Fine‑Tuning vs. Prompt Engineering: Which One Saves You Money?,,2,2025-07-31 21:23:40+00:00
44750355,Let's Upgrade a 2010 iMac – The Retro Millennial,https://retropunk.substack.com/p/lets-upgrade-a-2010-imac,6,2025-07-31 21:22:11+00:00
44750354,Vibe Coding in Prod [video],https://www.youtube.com/watch?v=fHWFF_pnqDk,2,2025-07-31 21:22:03+00:00
44750342,Peacock feathers can function as lasers,https://www.nature.com/articles/s41598-025-04039-8,1,2025-07-31 21:21:25+00:00
44750317,TSA might like facial recognition but passengers not so much,https://www.theregister.com/2025/07/31/tsa_facial_recognition/,4,2025-07-31 21:20:15+00:00
44750314,Show HN: FakeFind is working again – AI tool to detect fake reviews,,2,2025-07-31 21:19:55+00:00
44750294,"New budget financial API, based on EDGAR data",,7,2025-07-31 21:17:59+00:00
44750277,"You, Your Tools, and Your Team of AI Agents – By Owen Zanzal",https://medium.com/devops-ai/you-your-tools-and-your-team-of-ai-agents-5bb4122e656d,1,2025-07-31 21:16:27+00:00
44750272,Vercel Adapts Their SEO Strategy for LLM Visibility,https://vercel.com/blog/how-were-adapting-seo-for-llms-and-ai-search,1,2025-07-31 21:16:04+00:00
44750270,Symposium Driven Development: A Not So New Paradigm for Software Creation,https://medium.com/devops-ai/symposium-driven-development-a-not-so-new-paradigm-for-software-creation-566d7be2a341,1,2025-07-31 21:16:01+00:00
44750266,Jerobeam Fenderson's Trippy Oscilloscope Music (2015),https://spectrum.ieee.org/jerobeam-fendersons-trippy-oscilloscope-music,3,2025-07-31 21:15:56+00:00
44750265,Tech CEOs don't seem to realise just how anti-human their AI fanaticism is,https://www.pcgamer.com/software/ai/tech-ceos-dont-seem-to-realise-just-how-anti-human-their-ai-fanaticism-is-and-i-think-its-all-because-of-the-enlightenment/,17,2025-07-31 21:15:51+00:00
44750263,Show HN: EIRA-KEM – a symbolic post-quantum KEM for academic testing,https://github.com/CarlosStx99/EIRA_KEM3,1,2025-07-31 21:15:41+00:00
44750262,ASCII Play,https://play.ertdfgcvb.xyz/,3,2025-07-31 21:15:37+00:00
44750239,Evaluating AI,https://werd.io/evaluating-ai/,2,2025-07-31 21:13:54+00:00
44750215,The Atari 1050 disk drive and its unusual storage size,https://www.goto10retro.com/p/the-atari-1050-disk-drive-and-its,4,2025-07-31 21:11:31+00:00
44750189,Deriving Rope the Proper Way,https://nor-blog.pages.dev/posts/2025-07-28-deriving-rope/,2,2025-07-31 21:09:42+00:00
44750184,Why random rotations are good for RoPE,https://research.novelai.net/rope/,2,2025-07-31 21:09:21+00:00
44750180,The Making of Anthropic CEO Dario Amodei,https://kantrowitz.medium.com/the-making-of-anthropic-ceo-dario-amodei-449777529dd6,2,2025-07-31 21:09:05+00:00
44750178,N-Dimensional Rotary Positional Embeddings,https://jerryxio.ng/posts/nd-rope/,4,2025-07-31 21:09:00+00:00
44750159,The underlying tech of hydrogen passenger cars can still be transformative,https://www.popsci.com/science/hydrogen-cars/,4,2025-07-31 21:07:19+00:00
44750148,Ensuring a safer online experience for U.S. kids and teens,https://blog.google/technology/safety-security/age-assurance-measures-safer-online-kids-teens-us/,2,2025-07-31 21:06:35+00:00
44750130,Newgrounds to Implement Age Verification,https://www.newgrounds.com/bbs/topic/1548205,8,2025-07-31 21:05:20+00:00
44750124,AI: The Creativity Killer – Are We Trading Genius for Convenience?,,2,2025-07-31 21:04:46+00:00
44750121,A Hitchhiker's Guide to the AI Bubble,https://fluxus.io/article/a-hitchhikers-guide-to-the-ai-bubble,87,2025-07-31 21:04:23+00:00
44750110,Google is indexing ChatGPT conversations,https://www.fastcompany.com/91376687/google-indexing-chatgpt-conversations,3,2025-07-31 21:03:29+00:00
44750082,Visual breakpoint debugging for responsive Rails applications with TailwindCSS,https://avohq.io/glossary/responsive-breakpoint-debugger,1,2025-07-31 21:00:48+00:00
44750075,Misinformation and hateful rhetoric spread rapidly after the Southport stabbings,https://inews.co.uk/news/i-morning-briefing-do-online-safety-laws-need-strengthening-in-the-wake-of-the-riots-3226340,2,2025-07-31 21:00:12+00:00
44750063,Engineers Shake Tallest Steel-Framed Building Ever on an Earthquake Simulator,https://today.ucsd.edu/story/engineers-shake-tallest-steel-framed-building-ever-to-be-built-on-an-earthquake-simulator,3,2025-07-31 20:59:04+00:00
44750058,Walmart Still Doesn't Accept Apple Pay in U.S. Despite Daily Complaints,https://www.macrumors.com/2025/07/31/walmart-still-does-not-accept-apple-pay/,3,2025-07-31 20:58:43+00:00
44750031,Apple Reports 3Q 2025 Results: $23.4B Profit on $94B Revenue,https://www.macrumors.com/2025/07/31/apple-3q-2025-earnings/,6,2025-07-31 20:55:24+00:00
44750014,From BIOS Jumpers to Figma Stocks,https://philwornath.substack.com/p/from-bios-jumpers-to-figma-stocks,2,2025-07-31 20:54:08+00:00
44750013,Cloudflare Announces Second Quarter 2025 Financial Results,https://cloudflare.net/news/news-details/2025/Cloudflare-Announces-Second-Quarter-2025-Financial-Results/default.aspx,5,2025-07-31 20:54:02+00:00
44750006,Deepwiki.com,https://deepwiki.com,2,2025-07-31 20:53:24+00:00
44749993,$30k Electric Scooter Is Gunning for a Bonneville Speed Record,https://www.thedrive.com/news/this-24000-watt-scooter-is-going-for-a-100-mph-speed-record-at-bonneville,6,2025-07-31 20:52:23+00:00
44749985,Why the Svalbard Global Seed Vault is so controversial,https://www.popsci.com/environment/svalbard-global-seed-vault/,5,2025-07-31 20:51:37+00:00
44749983,Tesla starts sort-of Robotaxi service in San Francisco by invite only,https://www.theregister.com/2025/07/31/tesla_robotaxi_san_francisco/,1,2025-07-31 20:51:27+00:00
44749974,SanctionKit: Crypto sanctions compliance without breaking the bank,https://sanctionkit.com,6,2025-07-31 20:51:08+00:00
44749973,GazeCraft: A Game That Cultivates Silence in a World of Noise,https://focus-painting.vercel.app/,2,2025-07-31 20:51:08+00:00
44749921,"Fed Judge Pulls Opinion Full of AI-Slop, No One Will Say It Was Written by AI",https://www.techdirt.com/2025/07/31/judge-pulls-opinion-full-of-ai-style-hallucinations-but-no-one-is-willing-to-say-it-was-written-by-ai/,10,2025-07-31 20:46:19+00:00
44749920,Ask HN: My coworker's AI responses are driving me insane,,7,2025-07-31 20:46:17+00:00
44749915,I Built an Infinite DJ based on what you Code it got weird [video],https://www.youtube.com/watch?v=QsYPv3CC6Sw,1,2025-07-31 20:45:49+00:00
44749909,A New Governance Model for MCP,http://blog.modelcontextprotocol.io/posts/2025-07-31-governance-for-mcp/,2,2025-07-31 20:45:23+00:00
44749890,PyCrucible – Yet Another PyInstaller Alternative,https://github.com/razorblade23/PyCrucible,2,2025-07-31 20:43:13+00:00
44749880,How to avoid out-of-thin-air atomics without trying [pdf],https://www.open-std.org/jtc1/sc22/wg21/docs/papers/2024/p3064r2.pdf,6,2025-07-31 20:42:04+00:00
44749877,Google loses app store antitrust appeal,https://arstechnica.com/gadgets/2025/07/google-loses-app-store-antitrust-appeal-must-make-sweeping-changes-to-play-store/,12,2025-07-31 20:41:54+00:00
44749873,Google Sans Code,https://fonts.google.com/specimen/Google+Sans+Code,5,2025-07-31 20:41:16+00:00
44749863,"Show HN: Carimbo, a 2D game engine written in C++23 using SDL, featuring Lua",https://github.com/willtobyte/carimbo,5,2025-07-31 20:40:49+00:00
44749862,Decoding Zuck's Superintelligence Memo,https://om.co/2025/07/30/decoding-zucks-superintelligence-memo/,3,2025-07-31 20:40:44+00:00
44749848,"'Time travel' memory hack rejuvenates memories, study finds",https://www.livescience.com/health/memory/time-travel-memory-hack-rejuvenates-memories-study-finds,5,2025-07-31 20:39:15+00:00
44749842,Noma Security Raises $100M for AI Security Platform,https://www.securityweek.com/noma-security-raises-100-million-for-ai-security-platform/,1,2025-07-31 20:38:19+00:00
44749840,"Federal judges detail rise in threats, 'pizza doxings'",https://apnews.com/article/judges-trump-threats-salas-eaa4c2ea3661d69ef68aaa3d18c10b5f,21,2025-07-31 20:37:53+00:00
44749838,How to Name Files,https://github.com/jennybc/how-to-name-files,8,2025-07-31 20:37:40+00:00
44749823,FileUtils – advanced file operations and utilities integrated into macOS Finder,https://fileutils.com,3,2025-07-31 20:36:05+00:00
44749796,Google lost its antitrust case with Epic again,https://www.engadget.com/big-tech/google-lost-its-antitrust-case-with-epic-again-190633325.html,9,2025-07-31 20:32:05+00:00
44749795,Apple reports third quarter results,https://www.apple.com/newsroom/2025/07/apple-reports-third-quarter-results/,4,2025-07-31 20:32:01+00:00
44749777,Sync Primitives Are Functionally Complete,http://kprotty.me/2025/07/31/sync-primitives-are-functionally-complete.html,3,2025-07-31 20:30:24+00:00
44749772,Denver rent is back to 2022 prices after 20k new units hit the market,https://denverite.com/2025/07/25/denver-rent-prices-drop-q2/,311,2025-07-31 20:29:55+00:00
44749767,Protecting the Developing Mind in a Digital Age: A Global Policy Imperative,https://www.tandfonline.com/doi/full/10.1080/19452829.2025.2518313,1,2025-07-31 20:28:52+00:00
44749763,Great site that lets you control your newsfeed (sources and topics),https://100.news/,1,2025-07-31 20:28:32+00:00
44749739,Torify for Windows Terminal,https://github.com/babycommando/torify-windows,3,2025-07-31 20:25:05+00:00
44749732,"Bookworm Adventures has been erased from the internet, and I want to know why",https://www.rockpapershotgun.com/bookworm-adventures-has-been-erased-from-the-internet-and-i-want-to-know-why,15,2025-07-31 20:24:04+00:00
44749716,Show HN: Blen – A Minimalist EReader to Help You Read More Books,https://www.blen.ink/,3,2025-07-31 20:22:13+00:00
44749703,Interpolating a Bezier Curve,https://fatih-erikli-potato.github.io/interpolating-a-bezier-curve.html,2,2025-07-31 20:20:39+00:00
44749702,Malicious Chrome Binary in Arch Linux User Repo (AUR) Deleted,https://lists.archlinux.org/archives/list/aur-requests@lists.archlinux.org/thread/GHPZL7D6ASQRCDIJBXBYTVAPJKUN3MJV/,2,2025-07-31 20:20:35+00:00
44749699,Drift Notes: A Local-Only Confession Board Built on Browser Storage,https://github.com/Dino-Nuggies45/Drift-Notes,6,2025-07-31 20:20:17+00:00
44749696,A prompt to improve SEO for Vibe-coded/AI-coded sites,https://github.com/RivalSee/ai-seo-tools,2,2025-07-31 20:19:46+00:00
44749688,Show HN: I built simple free app to collect user feedback and build what matters,https://www.fidbaq.xyz/,1,2025-07-31 20:19:03+00:00
44749684,Om Malik – Meta's Favorite Product Isn't AI. It's the Copy Button,https://om.co/2025/07/31/metas-favorite-product-isnt-ai-its-the-copy-button/,2,2025-07-31 20:18:27+00:00
44749680,"RateMyPrompt: Share, rate & optimize AI prompts",https://www.josh.ing/ratemyprompt,1,2025-07-31 20:18:05+00:00
44749669,Make your GPU faster for $7 (REAL) [video],https://www.youtube.com/watch?v=lCKbt8hBYAo,1,2025-07-31 20:17:07+00:00
44749658,Fed allows banks to use alternative methods to collect customer ID information,https://www.federalreserve.gov/newsevents/pressreleases/bcreg20250731a.htm,6,2025-07-31 20:15:36+00:00
44749652,Recording vintage CRTs with a modern Sony mirrorless camera,https://www.jeffgeerling.com/blog/2025/recording-vintage-crts-modern-sony-mirrorless-camera,9,2025-07-31 20:14:52+00:00
44749638,Domains by Wordle,https://www.dotcom.press/archive/wordle,1,2025-07-31 20:13:20+00:00
44749624,A Tiny 29-Pound Electric Motor Just Beat Everyone in Power Density,https://www.popularmechanics.com/cars/hybrid-electric/a65490281/tiny-electric-motor/,5,2025-07-31 20:11:46+00:00
44749620,Romain Du Roy,https://en.wikipedia.org/wiki/Romain_du_Roi,2,2025-07-31 20:11:15+00:00
44749577,Niri – A scrollable-tiling Wayland compositor,https://github.com/YaLTeR/niri,2,2025-07-31 20:07:59+00:00
44749564,Show HN: Gensee – Free AI Agent Optimization and Deployment,https://platform.gensee.ai,13,2025-07-31 20:06:57+00:00
44749551,You're Never Going to Be Original (and Neither Am I),https://default.blog/p/youre-never-going-to-be-original,2,2025-07-31 20:05:32+00:00
44749535,Record low US fertility rate reported in 2024,https://www.contemporaryobgyn.net/view/record-low-us-fertility-rate-reported-in-2024,2,2025-07-31 20:03:58+00:00
44749534,Step3,https://stepfun.ai/research/en/step3,2,2025-07-31 20:03:56+00:00
